,title,topic,stance,comment,parent_id,comment_id,viewpoint
0,How Abortion Should Be Dealt With?,abortion,support,What do you see as the major flaw of the view opposite of your in regards to how abortion should be dealt with?,0,1,topic_stance_votes_2
1,How Abortion Should Be Dealt With?,abortion,support,Abortion is a private matter. It is not the concern of the Church and State.,1,2,topic_stance_votes_2
2,How Abortion Should Be Dealt With?,abortion,support,"If I understand your question correctly, you are asking pro-choice people to state what they think is the major flaw in the pro-life arguement and vice-versa. 
I think that the major flaw in the pro-life arguement is that they use slogans which may sound appealing but, on closer inspection, do not have much substance. 
For example, saying that ""life is precious"" may sound right but one has to analyze what one means by ""life"", which they mostly do not bother to do. When people hear ""life is precious"", people can relate because they see their own lives and those of their friends and loved ones as precious. However, the pro-life people extend that all the way back to the earliest fetus/embryo. I have seen posts of imaginary letters from that early fetus meant to elicit sympathy. This is anthropomorphising (attaching a personality where there is none) on a grand scale. They are imagining a baby with an innocent, helpless personality where there is in reality simply a growing body which will someday (around the third trimester) possess a mind, but not yet. They may have an arguement that the *potential* of that fetus is important (since, after all, we all started as fetuses) but the potentiality arguement is much less emotionally appealing and wins fewer converts than the arguement which appeals to people's imaginations in imagining a helpless, innocent, suffering baby. When it comes to the early fetus, that last arguement is an illusion - imagination is not reality. Reality is what is important.
A second, more minor, point against the pro-life arguement is that they often cannot help but mix in their views on sexual morality into their case against abortion. Many would give exceptions in the case of rape and incest because they feel sympathy toward those women. They have no sympathy toward women who chose to have sex.",1,3,topic_stance_votes_2
3,How Abortion Should Be Dealt With?,abortion,support,"To me the largest flaw in the pro-life argument is that the practice of medicine has it's own ethical controls, and doctors are the ones who should be deciding whether or not an abortion should be done, not politicians or judges who have little to no knowledge of medical issues. We don't need laws to tell doctors who should be able to have abortions and when anymore than we need laws to prevent doctors from performing elective limb amputation on healthy patients, or to prevent them from performing gender reassignment surgeries on people for any darn reason they want one.",3,4,topic_stance_votes_2
4,How Abortion Should Be Dealt With?,abortion,support,"You have a good point about this but returning to the
line of argument-- suppose it is the case that you lack confidence
in your belief. I fail to see why that should hold you back, if the
other person is not more certain. And I don't think it is the case
that people who seek abortions after viability, or the physicians who
do them, are more confident that what they are doing is right, than
you are that they are wrong. Or perhaps it isn't a matter of
confidence at all, but you simply regard your view about when a human
being with human rights comes into existence as somehow something
""purely subjective"".",2,5,topic_stance_votes_2
5,How Abortion Should Be Dealt With?,abortion,support,"I think the major flaw in the pro-life position is their classification of abortion.
It is not about taking a life.
It is about abandonment.",5,6,topic_stance_votes_2
6,How Abortion Should Be Dealt With?,abortion,support,"You make a good point, but I’m going to watch this program on Thursday on FX Channel. I found a video clip of the abortion episode on YouTube. 
Check it out http://www.youtube.com/watch?v=4ScUKhmD7c8
(http://www.fxnetworks.com/30days/)",6,7,topic_stance_votes_2
7,How Abortion Should Be Dealt With?,abortion,support,Abandonement? That's a new one by me. How so? I'm intrigued.,6,8,topic_stance_votes_2
8,How Abortion Should Be Dealt With?,abortion,support,"The mother is providing a service for the child. She is a care giver, and that child needs that care to survive.
I believe quite firmly that no one should be required to provide care against their will. If they choose to provide that care, and then choose to stop providing that care, they should take all reasonable steps to ensure someone else assumes the role of care giver.
For example, if a carer at a mental home has a personal emergency and has to leave, then he should attempt to call in any on-call staff, try and get the next rostered person to come in early, or so on. After he's taken all reasonable steps, he is free of an obligation to stay.
Or if a mother can no longer handle caring for her children, she should attempt to get a friend or babysitter to care for them, or give them up to the state.
Or if a pregnant woman no longer wishes to carry her baby. Unfortunately, in that instance, it is unlikely that anyone will be in a position to assume the role of caregiver.
However, regardless of the eventual fate of the person recieving care, no person should be required, no person should be forced to provide care against their will. They should be able to abandon that person, provided they take all reasonable steps to ensure someone else assumes the role of care giver.
Needless to say, I don't consider a pregnancy to be a 'reasonable step'.",8,9,topic_stance_votes_2
9,How Abortion Should Be Dealt With?,abortion,support,Ah! That makes alot of sense. Thanks for explaining.,9,10,topic_stance_votes_2
10,How Abortion Should Be Dealt With?,abortion,attack,The major flaw in the pro-choice camp is that pro-choice is based on selfishness. emoticonXGood,10,11,topic_stance_votes_1
11,How Abortion Should Be Dealt With?,abortion,attack,"I felt inspired when I watched the episode on 30 Days at FX Channel about abortion earlier. It was fun and interesting show. Have you seen it?
If you missed that show you can watch this on YouTube
http://www.youtube.com/watch?v=4ScUKhmD7c8",11,12,topic_stance_votes_2
12,How Abortion Should Be Dealt With?,abortion,attack,"Firstly I would like to say that I do not think that selfishness is by itself bad (nor good). 
Secondly, I am not sure if anti-abortion (I refuse to call them pro-life) is really based on alturisam. It seems more based on jealousy, as punishment for anyone who has had more sex than anti-abortion advocate. Did you know this:
If anti-abortion were truly alturistic , they would offer their uteruses to save all those 'lives'.",11,13,topic_stance_votes_2
13,How Abortion Should Be Dealt With?,abortion,support,"[I think people choose to have children for selfish reasons, yet I see nothing wrong with that. It just is as it is.]
The complete disregard for a woman's unique, individual circumstances; the current climate towards single mothers; the lack of resources for woman who find themselves pregnant and don't want to be; the blanket labeling of women who desire abortions as 'selfish'; the desire to legislate morality for the masses; the selfish need to get involved intimately in the life of someone you will most likely never meet or be in a position to help; the pervasiveness of religion in the issue; and...oh, I think that's most of it. :)
I am not fond of many aspects of the pro-choice side either, such as those who do not wish for the man to have the same choice as the woman; the acceptance of late(r) term abortions; the misunderstanding that abortion is not harmful to women's mental health (it is not always...but frequently); the unrecognition that a fetus is a human being and alive; the lack of healthy discussion that abortion can be detrimental to the feminist movement (why should women have to abort to remain career competitive for example-and how can we support women so that they don't have to abort if there is a financial problem).",13,14,topic_stance_votes_2
14,How Abortion Should Be Dealt With?,abortion,attack,"I believe much of this is the extreme end of things, and that most pro-lifers don't think this way at all. FWIW. Just like most extreme perceptions about the pro-choice movement by pro-lifers is probably really extremist elements rather than the movement at large. I have no problem with the pervasiveness of religion in the issue--religion is at work with both sides.",14,15,topic_stance_votes_1
15,How Abortion Should Be Dealt With?,abortion,support,"Jyoshu, can you please explain to me how religion plays a part on both sides? We all know how religion comes into play on the pro-life/anti-abortion/christian side. I believe most pro-choice people look at abortion from a more scientific and realist view VS. a moral stance...even though morals do come into play for both sides. 
Bell, I completely agree with everything you said. I'll just say that one of my biggest beefs with the pro-life side is their religious stance. I feel that because not everybody has the same religion it is not fair for Christians to think that they can impose their beliefs on the rest of the country just because they are the majority. I suppose that is my biggest concern because most of the main-stream religions make me want to vomit (Christianity, Fascist Islam), just the way I am. 
Originally Posted by Steeeeve 
The major flaw in the pro-choice camp is that pro-choice is based on selfishness. emoticonXGood 
That is not really a fair or well thought-out statement is it Steeeve? I don't think that you can attribute one solid answer for any decision that someone makes, especially such a difficult one that contains so many levels of emotion and decision making. Your thumbs-up smiley face disturbs me also, when discussing such a touchy subject I would assume that someone would take it a little more seriously.",15,16,topic_stance_votes_1
16,How Abortion Should Be Dealt With?,abortion,support,OT...does anybody know where you can download or get the whole episode of 30 days? I'd like to watch them but can't stay up late enough. Thanks!,15,17,topic_stance_votes_1
17,How Abortion Should Be Dealt With?,abortion,attack,"Yes, they are extreme, but isn't it all true?
I can guess that what you might be getting at is that prolifers are more focused on the baby. I agree that that may be their original intent, but unfortunately these baby-friendly sentiments do result in the above extreme elements of prolifism.
I also would like to hear how religion is at work in the prochoice side. Again, I'll take a stab and say that perhaps it's a 'tool' to show the unfairness of the debate such as Aivlis said; 
and the prochoice side touts this as ""unfair"". Or something. Like that.",15,18,topic_stance_votes_2
18,How Abortion Should Be Dealt With?,abortion,attack,"I'd say it's only true for the more extreme fringe elements of the pro-life movement. Most pro-lifers don't see things that way--certainly not the ones I've been around. Believe it or not, most pro-lifers are very reasonable, caring people who really don't hate women and really do take them into consideration. They just have a different view than you do.
Yes, but that doesn't mean they aren't at ALL focused on the woman as well.
I've seen pro-choicers argue from the standpoint that their view is the more religious. That it's the 'christian' way of doing things. So both sides invoke religion.",18,19,topic_stance_votes_1
19,How Abortion Should Be Dealt With?,abortion,support,"Hmm Jyoshu, I don't think I've heard that argument from pro-choicers. Could you please explain their argument and why they think it is the ""christian"" thing to do and how you disagree with their argument or provide some facts. 
I suppose it wouldn't surprise me because there are so many types of christians....some more radical than others and some who don't really follow the bible at all.",19,20,topic_stance_votes_1
20,How Abortion Should Be Dealt With?,abortion,attack,I'd be curious to hear how a pro-choice Christian defines going against belief system dogma and reconciling that opinion as religious.,19,21,topic_stance_votes_2
21,How Abortion Should Be Dealt With?,abortion,attack,"If those are the ""extreme"" sides of the pro life viewpoint, then what are the ""middle of the road"" elements of the pro life viewpoint?
Sure they are focused on the mother...just not in what I call a positive, empathatic, caring way.
I have never, ever seen, heard or written anything like this in my years of interest on this subject. That doesn't mean it's not out there, of course, just that it's not a well worn rug.
I surely don't think you mean to compare the usage of religion as a focal point in both ""camps"" as equal. Pro lifers most certainly invoke religion in their campaign against abortion much more often than prochoicers.",19,22,topic_stance_votes_2
22,How Abortion Should Be Dealt With?,abortion,attack,"Frankly, I think that Jesus doesn't care what women decide about abortion.",20,23,topic_stance_votes_2
23,How Abortion Should Be Dealt With?,abortion,attack,"It depends on how a particular State sees the matter. The state may decide that abortion is a crime, therefore it is a matter of the state. 
The same applies to the Church, if it considers it a sin, and the Catholic church does, then it is also a religious matter.",2,24,topic_stance_votes_1
24,How Abortion Should Be Dealt With?,abortion,attack,"Well, Jesus is dead, OK, maybe he resucitated. My question is: Was abortion practiced during Jesus's life?",23,25,topic_stance_votes_1
25,How Abortion Should Be Dealt With?,abortion,attack,"I consider myself a centrist pro-lifer. My views are that abortion should be legal in cases of rape or incest, and I have less concern with it early in the pregnancy, such as the 1st trimester. But am definitely against it after that. I can confidently say the things you listed aren't the way I believe, and aren't the way most anyone I know believes that's pro-life. I also think more effort should be made to help mothers who choose to have their baby than is given, particularly single women. Some in the PL movement haven't always been very good in this way. I think the pro-choice movement sometimes portrays prolifers the way you described--in the most extreme picture as possible. But it's not usually that way from what I've seen. BOTH sides have done too much smearing propaganda at times, and it has polarized things a lot.
Many times they are empathetic to the mother too--they just don't compromise by agreeing the baby should be killed. I know a guy who runs a counselling service that helps mothers find a way to avoid abortions. They go to great lengths to help mothers support the baby whether that adoption or raising it. This is an example of pro-lifers giving support to the mother. The oft-used pro-choice generalization that ""pro-lifers don't care about women"" is a generalization. Many do. They can care about women and still believe it is wrong to kill a baby.
I've heard the arguments, but no I'm not saying they are equal in terms of frequency of use. Nevertheless, there's nothing wrong with religion being a defining force behind one's views. Religion, at the end of the day, is simply ideology. And ideology is usually behind anyone's views. When religious people argue their points because of their religion, it's just ideologically-driven debate--that's what everyone does. We ALL argue because of whatever ideology we have, religious or not. At the end of the day it all goes back to people's personal moral views, and whether that's influenced by religion or not shouldn't matter. Everyone has their reasons for their views.",22,26,topic_stance_votes_1
26,How Abortion Should Be Dealt With?,abortion,attack,"It's very simple--many pro-choicers beleive the way they do because they feel it is the most empathetic and compassionate way to be for the mother and for women. Those doing so that are religious sometimes argue that that compassion is consistent with Christian belief as taught by Christ. Therefore their religion is, to some degree, behind it.
I think there are some serious holes in that thinking, but nevertheless I've heard that way of thinking before. Believe it or not, sometimes religion is what opposes belief system dogma.",21,27,topic_stance_votes_1
27,How Abortion Should Be Dealt With?,abortion,attack,"Definitely. I do not know how successfully it was done but women were using herbal aborfacients at that time:
http://referaty.atlas.sk/cudzie-jazy.../contraception",25,28,topic_stance_votes_2
28,How Abortion Should Be Dealt With?,abortion,support,"Also, from the Greeks at about the same time as Christ:
http://www.unc.edu/courses/rometech/.../Abortion.html",28,29,topic_stance_votes_2
29,How Abortion Should Be Dealt With?,abortion,support,"From Wikipedia:
Antiquity (prehistory to 476 AD)
The first recorded evidence of induced abortion is from a Chinese document which records abortions performed upon royal concubines in China between the years 500 and 515 BC. According to Chinese folklore, the legendary Emperor Shennong prescribed the use of mercury to induce abortions nearly 5000 years ago.
Abortion, along with infanticide, was common in the ancient Greco-Roman world. Numerous methods of abortion were used, ""the more effective of which were exceedingly dangerous"". Several common methods involved either either dosing the pregnant woman with a near-fatal amount of poison, in order to induce a miscarriage, introducing poison directly into the uterus, or prodding the uterus with one of a variety of ""long needles, hooks, and knives"". Unsurprisingly, these methods often led to the death of the woman, as well as the fetus.
There have been archaeological discoveries which would seem to indicate early surgical attempts at the extraction of a fetus; however, such methods are not believed to have been common, given the infrequency with which they are mentioned in ancient medical texts. Many of the methods employed in early and primitive cultures were non-surgical. Physical activities like strenuous labour, climbing, paddling, weightlifting, or diving were a common technique. Others included the use of irritant leaves, fasting, bloodletting, pouring hot water onto the abdomen, and lying on a coconut shell which had been heated.
References in classical literature
Hippocrates, the Greek physician whose famous Oath forbids abortion, nonetheless writes of having advised a dancer and prostitute who fell pregnant to jump up and down, touching her buttocks with her heels at each leap, so as to induce miscarriage. [7] Other writings attributed to him describe instruments, fashioned to dilate the cervix and curette inside of the uterus, which he used to perform an abortion upon one of his patients.
Tertullian, a 2nd and 3rd century Christian theologian, also described surgical implements which were used in a procedure reminiscent of the modern dilation and evacuation. One tool had a ""nicely-adjusted flexible frame"" used for dilation, an ""annular blade"" used to curette, and a ""blunted or covered hook"" used for extraction. The other was a ""copper needle or spike"". He attributed ownership of such items to Hippocrates, Asclepiades, Erasistratus, Herophilus, and Soranus.
Tertullian's description is prefaced as being used in cases in which abnormal positioning of the fetus in the womb would endanger the life of the pregnant women. Saint Augustine, in Enchiridion, makes passing mention of surgical procedures being performed to remove fetuses which have expired in utero. [10] Aulus Cornelius Celsus, a 1st century Roman encyclopedist, offers an extremely detailed account of a procedure to extract an already dead fetus in his only surviving work, De Medicina.
In Book 9 of Refutation of all Heresies, Saint Hippolytus of Rome, another Christian theologian of the 3rd century, wrote of women tightly binding themselves around the middle so as to ""expel what was being conceived.""
Soranus, a 2nd century Greek physician, provided some rather detailed suggestions in his work Gynecology. He recommended that women wishing to abort their pregnancies should engage in violent exercise, energetic jumping, carrying heavy objects, and riding animals. Diuretics, emmenagogues, enemas, fasting, and bloodletting, were also prescribed, although Soranus advised against the use of sharp instruments to induce miscarriage due to the risk of organ perforation.",29,30,topic_stance_votes_2
30,How Abortion Should Be Dealt With?,abortion,attack,"Simone, what makes you think that Jesus doesn't care about what women decide about abortion? emoticonXConfused",23,31,topic_stance_votes_1
31,How Abortion Should Be Dealt With?,abortion,attack,"Could you be specific about what you, as a ""centered"" pro-lifer, would like to see legislation-wise in regards to first trimester abortions?
I agree with many of your sentiments. I would like to ""combine"" forces and do what we can to reduce the need for abortions. 
It does appear however that the more extreme prolifer arguments get the attention. Same w/ prochoice. Squeaky wheel...
And my original assertions-- such as the desire to legislate morality for the masses; the selfish need to get involved intimately in the life of someone you will most likely never meet or be in a position to help-- still stand because these are the results of the prolife mvt as a whole. If you do not wish to legislate your morality to the masses, and if you think it is wrong to get intimately involved on such a personal level in a strangers' life, then your position needs reconsidered b/c this is ultimately what happens.
I don't think there is enough empathy and care for the woman if you are circumventing her options, opinions, and wishes by telling her she must carry a pregnancy to term.
Of course there is nothing wrong w/ religion being a defining force behind someone's views. Or lack of religion. Whatever your ideology is you base your decisions on, that's fine and grand. However, there is something wrong when someone uses only their religious/ideology views, which are not shared by all, to legislate morality to everyone.",26,32,topic_stance_votes_2
32,How Abortion Should Be Dealt With?,abortion,attack,Here Here!,32,33,topic_stance_votes_1
33,How Abortion Should Be Dealt With?,abortion,attack,"I'd be content with abortion law that allows it early in the pregnancy, but makes it illegal in the 2nd or 3rd trimester. In some ways, that would be a compromise for all.
But the pro-choice side also legislates it's morality to making it legal to kill the inborn baby. Roe v Wade was a legislation of morality--a morality that says women should be able to kill their unborn babies.
That's impossible, unless the woman is physically restrained. No one can truly take away anyone's ability to do what they want (even if it's illegal). The goal of the pro-life movement is stop abortions. The end goal is not to make abortion illegal, though making it illegal is the means they seek to real their goal. The logic is straightforward: if our goal was to, say, stop homicides, we wouldn't do so by making homocide legal. The same applies to abortion. 
Frankly, you're arguing that it should be legal to kill a baby just so a mother can avoid discomfort. I agree women should be given care and empathy, but not at the expense of killing someone, which is where your logic goes. I think there needs to be BOTH--save the baby AND help the mother. The idea that the two should be mutually exclusive from one another, juxtaposed, is a terribly wrong idea.
I disagree. Everyone who votes, supports candidates, supports any given law, etc. is, in essence, trying to get their morality legislated. It's the way our system works. Everytime someone supports a law based on their personal beliefs and ideology, they are trying to see their morality legislated. Everyone does this based on ideology--I see no reason why religious people should not be allowed to do this when everyone else does it.",32,34,topic_stance_votes_1
34,How Abortion Should Be Dealt With?,abortion,attack,"Of course. The only question, when one gets right down to it, is this;
Is a pregnancy a 'reasonable step' for someone to take before they are justified in relinquishing their duty of care?",34,35,topic_stance_votes_2
35,How Abortion Should Be Dealt With?,abortion,attack,"According to scripture, Jesus said absolutely nothing about abortion.",31,36,topic_stance_votes_2
36,How Abortion Should Be Dealt With?,abortion,attack,"No, But He did say:""You shall not murder""",36,37,topic_stance_votes_1
37,How Abortion Should Be Dealt With?,abortion,attack,"Well that is only relevant if you believe Jesus was God, the God of Abraham in the Hebrew scriptures - AND you believe that Moses actually heard the word of God and wasn't just power hungry or crazy or delusional - AND you believe that Moses existed - AND you even believe in the God of Abraham/Jehovah/Yaweh - AND you believe murder and abortion to be the same thing.",37,38,topic_stance_votes_2
38,How Abortion Should Be Dealt With?,abortion,attack,"Exactly! If Christ is not the center of your life, then all of the other points make no sense.",38,39,topic_stance_votes_1
