,title,topic,stance,comment,parent_id,comment_id,viewpoint
78,How Abortion Should Be Dealt With?,abortion,attack,"well Adept, what other kind of step can someone take before they are justified in ""abandoning"" or relinquishing their care. Pregnancy seems like a pretty reasonable step as seeing that it has everything to do with you and your body. You said that nobody has to take care of anybody, yet you don't think pregnancy to be a reasonable step. ?????",78,79,topic_stance_votes_1
79,How Abortion Should Be Dealt With?,abortion,attack,"It depends on the situation, and 'societies' definition of reasonable. For example, if a single mother wants to go on a date, she has to temporarily cease caring for her children. It would be reasonable to expect her to ask a family member or baby-sitter to look after the kids. If she couldn't get anyone to look after them, it would be reasonable to expect her to cancel her date.
As another example, if two men are mountain climbing and one suffers a broken leg, then the other man is justified in leaving him on the mountain to die, if he takes all reasonable steps to get help. After he's called for help on the radio, attempted to carry the injured man out, or help him walk out, he should be able to leave his companion there and be legally innocent.
I'm not sure what you are saying here.
I don't see the mutual exclusivity.",79,80,topic_stance_votes_2
80,How Abortion Should Be Dealt With?,abortion,attack,I have no idea what you're talking about Adept. Maybe I'm not the only one because not many people have responded to your post.,80,81,topic_stance_votes_1
81,How Abortion Should Be Dealt With?,abortion,attack,Which part are you unclear on? I will endeavour to clarify.,81,82,topic_stance_votes_2
82,How Abortion Should Be Dealt With?,abortion,support,"If a person aborts a child they should get the death penalty emoticonXKill 
Just Kidding, got you guys there. Here is my morals on abortion:
I rather prefer the ""morning after"" pill over abortion so if people are not sure if they are pregnant or not they should get the pill before the 72 hours is over.
If a woman is raped she should be able to get an abortion
If a couple or one night stand or etc. were using, birth control, condom, aka safe sex, and they accidentally UNintentionally get pregnant the woman should be able to get an abortion
If a person is stupid and gets drunk, its your own mistake, you took that chance by taking the one to many drinks - so in that case abortion in my opinion is wrong. (BUT: if a drunk woman is raped or taken advantage of - the man intentionally has sex with her knowing she is not infavor of it if she was sober than abortion can be allowed) The drunk thing is tricky - if both the man and woman were drunk and got pregnant the woman should not be able to have an abortion - if the woman was drunk and the man was not drunk and she got pregnant: abortion allowed. Tricky but I still think people who are stupid to get pregnant when drunk should not be able to take that shortcut. 
If a couple plans and succesfully gets pregnant but has second thoughts or doesn't want the child because it might be mentally disabled - to bad. no abortion.
Anyways I AM IN FAVOUR of the morning after pill. It eliminates abortions. So I just wish people could catch it before the 72 hours.",1,83,topic_stance_votes_2
83,How Abortion Should Be Dealt With?,abortion,attack,"Actually, its about womens rights, and liberty.
If men had to go through what women did in pregnancy, then there would be no question about Pro-Choice Vs. Pro-Life, it would all be pro choice. But, sadly, women are the mistreated minority here, and are only viewd by PLs as child bearing cubicles instead of people.
And the thing is, i have no problem with people thinking Pro-Life. They can run the most viscious ad campains and commercials, and preach against abortion at their hearts content. But what they CAN'T do is legislate their religious beliefs into laws. Separation of church and state is very important, and legislating Anti-Abortion laws would harm that. You can preach against abortion, and run anti-abortion commercials and such, but like i said before YOU CANNOT LEGISLATE IT INTO LAW!",11,84,topic_stance_votes_2
84,How Abortion Should Be Dealt With?,abortion,support,"It sounds like you are saying if pregnancy occurs through no fault of the woman, or if it occurs despite taking all prudent precautions to prevent it, abortion should be legal.
While I have no problem with punishing stupid and irresponsible people, the ""punishment"" here is a pregnancy. I am not sure I want to specifically select out stupid people to be parents. And even really responsible people occasionally make mistakes. It makes this medical issue a moralistic one.
The big problem is this would be utterly unenforceable; how would you be able to discern how the pregnancy occurred (except in the case of assault), besides ""the honor system"".
You have to know that to the extent that the morning after pill may prevent implantation of an embryo, some people feel it is abortion. I don't, but that it an argument that is often given.",83,85,topic_stance_votes_2
85,How Abortion Should Be Dealt With?,abortion,support,"True, that is a very tricky argument. Its not very solid, and who is going to be deciding who gets abortions and who doesnt?",83,86,topic_stance_votes_2
86,How Abortion Should Be Dealt With?,abortion,attack,"Like I said in another thread, the argument I hear most often from so-called ""pro-choicers"" is that you cannot legislate morality. Well then what CAN you legislate? Every law in existence is legislation of morality! By that way of thinking, then we should have no laws. If someone kidnaps and murders your 3-year-old child, then let's hope the murderer goes free because we cannot legislate morality!",1,87,topic_stance_votes_1
87,How Abortion Should Be Dealt With?,abortion,support,"Perhaps in the future you should check your facts before making assertions like that.
Good grief. This thread is more then 4 months old. Please do not resurrect Zombie threads. It's common courtesy on virtually every board.
Apparently you are new to the whole forum thing. One does not resurrect Zombie threads for several reasons.
1) Often the posters on them are no longer around, therefore making arguments aganist theirs is a waste of time and server space
2) It interrupts to flow of current threads
3) It is common courtesy to let them die unless they hold direct quotes or arguments necessary to a new thread
There's a reason I'm editing instead of posting a new response.",87,88,topic_stance_votes_1
88,How Abortion Should Be Dealt With?,abortion,support,"As long as a topic is still open, anyone can respond at any time.",88,89,topic_stance_votes_1
