,title,topic,stance,comment,parent_id,comment_id,viewpoint
39,How Abortion Should Be Dealt With?,abortion,support,"A few accepted definitions make your opinion far stronger and acceptable than those based on simple faith. 
Faith: Belief that does not rest on logical proof or material evidence.
Jesus: A teacher and prophet whose life and teachings form the basis of Christianity. 
Prophet: A person who speaks by divine inspiration or as the interpreter through whom the will of a god is expressed. 
God: An image of a supernatural being; an idol. 
Abortion: Termination of pregnancy and expulsion of an embryo or of a fetus that is incapable of survival. 
Murder: The unlawful killing of one human by another, especially with premeditated malice. 
Gotta be pretty much up against the wall of personal desperation to believe a 2000 year old prophet supposedly acting for an idol considered an embryo or fetus a human.",38,40,topic_stance_votes_2
40,How Abortion Should Be Dealt With?,abortion,attack,So when are you gonna get that using your religion as justification for meddling with our lives isn't gonan cut it with us?,39,41,topic_stance_votes_2
41,How Abortion Should Be Dealt With?,abortion,attack,"Of course many pro-life religious people also draw their conclusions about abortion from logic as well. Rational arguments can be made for both sides, which is one reason abortion is such a polarized debate.
This isn't a religion versus reason issue. It's one-side's reasons versus the other-side's-reasons. Religion happens to fit one side more than the other, IMO because religion tends to put a high value on the sanctity of life.",40,42,topic_stance_votes_1
42,How Abortion Should Be Dealt With?,abortion,attack,"A murder is an illegal killing. An abortion is not illegal, therefore not murder.
Christ is not the centre of my life, and all of my other 'points' make perfect sense to me.",37,43,topic_stance_votes_2
43,How Abortion Should Be Dealt With?,abortion,attack,"If we did this, and changed alot of other things, like abortions are done in a hospital, covered by insurance, plenty of counseling before and after, then we could strike a compromise.
No, the prochoice sides gives you the option to choose your morality. The pro-life side decides that for you.
I really want to listen to what you have to say, especially when I see that you are not against first trimester abortions (in the legal sense, at least) but when I read ""you're arguing that it should be legal to kill a baby just so a mother can avoid discomfort"" I automatically shut down. Baby is not accurate. Discomfort is subjective. Ending someone's career aspirations or ruining someone's life is not discomfort. (Here's where someone pipes in and says ""kids or being pregnant don't ruin someone's life"" and I say, tell that to my mother who told me that repeatedly and i'm sure i'm not alone here.)",34,44,topic_stance_votes_2
44,How Abortion Should Be Dealt With?,abortion,attack,"Counseling is fine, and often goes on already. Doing abortions in hospitals would never fly because of the widespread view in society that it ends life and prevents someone from growing up. (and it does.) Insurance depends a lot of business issues, unfortunately.
??? The ability to choose one's morality is there no matter which side one is on. It's impossible to take away peoples' moral views.
Well, sorry, but I have no interest in using only purely clinical terms to describe a fetus. (Though sometimes I use ""fetus"" as well.) If it's not accurate, then you need to tell that to every OB/GYN doctor that tells a hopeful mother that her ""baby is fine"". There's a reason they don't use the term ""fetus""; because it's clinical and cold. There is basically no diffence in the development of a premature baby between the moment before it exits the birth canal and the moment after. It doesn't just then magically become a baby. (and that's why many people use the concept if viability-outside-the-womb as the point in the pregnancy where they feel abortion shouldn't be done.) I think many in the pro-choice movement prefer clinical terminology because it offers a certain disconnectedness. If it's called a ""baby"" then the risk is run of actually thinking of it in a personal way. IMO, using only clinical terminology is a coward's way out. If you are going to believe that abortion should be legal, then I say have the balls to face up to what you're really doing: killing a baby--someone that, if allowed to live, would grow into a todler, a child, an adolescent, and an adult. That may tick you off, but it's what I believe so take it or leave it. I'm not against you using the term ""fetus"", but don't chastise me for calling it a baby either.
On the flipside, too many in the pro-life movement prefer to be disconnected from the issues the mother is facing. I think consideration for both the baby AND the mother is the best way. I think a lot more mothers would carry their baby to term if they know they had the support they needed, and/or the ability to know they they could give their baby up. In that sense, the pro-life goals of saving lives would be helped by actually giving more support to mothers.
I agree with you that it may ruin a career or ruin someone's life. I just don't think that's a good reason to not allow a baby (or fetus if you prefer) to live. It's still a death sentence.",44,45,topic_stance_votes_1
45,How Abortion Should Be Dealt With?,abortion,support,"This is true which is why the pro-life side is more consistent. If you felt I should be able to choose my own morality then me saying all white people should be slaves for 100 years should be ok with you. I also believe that theft should be legal for anyone making under $25,000 (we will just say poor folks). How about that morality? Can I choose that without punishment?
<note: this is not a morality I would like to take..just making a point>",45,46,topic_stance_votes_1
46,How Abortion Should Be Dealt With?,abortion,attack,"Laws should not be about morality. Laws against slavery and theft have to do with individual rights and not doing harm.
It is true that abortion does harm - but the arguing point is whether that harm is worse than the harm of a pregnant woman not having options and also whether the fetus or the mother has greater rights.",46,47,topic_stance_votes_2
47,How Abortion Should Be Dealt With?,abortion,attack,"emoticonXConfused 
Laws by nature are about morality.",47,48,topic_stance_votes_1
48,How Abortion Should Be Dealt With?,abortion,support,"I'll comment on Jitobears post since someone quoted it for me.
She said laws should not be about morality and then turns around and says a law should do no harm (a moral stance). Not harming others is a moral code so I am not sure why there has to be an inconsistent thought.
As for who has greater rights...why can't it be equal rights? I believe the fetus and mother have an equal rights structure. The question becomes what right is at the top?",48,49,topic_stance_votes_1
49,How Abortion Should Be Dealt With?,abortion,attack,Equal rights do not allow one to live physically attached to another. None have that right.,49,50,topic_stance_votes_2
50,How Abortion Should Be Dealt With?,abortion,attack,"aside from they fact that you don't set rights...the right to live is probably a right you and I agree on. So regardless of an attachment or not, this right would be the on in question.",50,51,topic_stance_votes_1
51,How Abortion Should Be Dealt With?,abortion,attack,"A right to live, certainly. A right to live physically attached to someone, no. Your right to live ends where I begin. Equal rights would not allow the fetus to live attached to the woman.",51,52,topic_stance_votes_2
52,How Abortion Should Be Dealt With?,abortion,attack,"There isn't always inconsistency. Frequently laws do match some or maybe even most purpose's morality. But they are not there to define people's morality for them. That is bordering on facist and quite frankly disgustingly scary to me.
Laws - in the U.S. - should be about protecting the rights and freedoms of its citizens. This should win over morality any day. Which is why a black person's right to freedom (eventually) won over that of someone else thinking its moral for a black person to be a slave. And who knows - maybe that still is someone's morality - but tough on them, they can keep their morality but the law supports freedom.
Because they do not have equal needs. And if the needs of the fetus (basically being where it is and taken care of by the mother) impede the woman to meet her needs, somebody has to come first - and that is where you have to determine who has greater rights. At this juncture the law recognizes that the mother does and I agree with that.
And just like some folks may believe it is moral to own slaves - currently the law does not support you.",49,53,topic_stance_votes_2
53,How Abortion Should Be Dealt With?,abortion,attack,"The key word there however, is ""needs."" Does the discomfort and inconveniece qualify as not having one's needs met? I think in most cases it does not. In this day and time it is mostly rare for pregnancies to be truly threatening to a mother's health. The best thing is for society to step up and support mothers so that they can comfortably carry their babies to term without the hardship of having to lose their careers or quality of life in doing so. The worst thing to do however, is to kill the baby. There are cases where women truly DO have the meeting of their needs threatened, but most of the time the abortion debate is about killing versus lack-of-convenience/comfort. And that's what the pro-life movement has the biggest problem with. If it were truly about needs, I might be more inclined to agree with you, but abortion law doesn't take that into account at all.",53,54,topic_stance_votes_1
54,How Abortion Should Be Dealt With?,abortion,attack,"But by killing the baby, you've taken away BOTH--their possible right to live attached, AND their right to live unattached. Remember, abortion law allows for the legal killing of babies that could live outside the womb as well.",52,55,topic_stance_votes_1
55,How Abortion Should Be Dealt With?,abortion,attack,"Need for the mother would be her realistic socioeconomic ability to cope with not only physical and emotional consequences of pregnancy, which should be her choice under any circumstance, plus 18 or so years of legal parental responsibility. In the US, society raising unwanted human spawn is still generally limited to accepted WASP heritage. 
You're stating termination of an undesired conception or probability of is subject to your moral definition of killing a human being and rationalizing that moral decision by blaming society for being remiss in not taking responsibility for the results of all unwanted conceptions. To me that means you feel a woman should have no choice in the matter, but because you can't offer a solution acceptable to individuals without the ability for or desire of bearing the responsibility of taking a conception to term and adulthood, your opinion is theory, not reality in your lifetime. On what platform do you actually base your pro-life opinion?",54,56,topic_stance_votes_2
56,How Abortion Should Be Dealt With?,abortion,attack,What's your time schedule for world ability to fund and raise unwanted conceptions to adulthood in an acceptable manner?,55,57,topic_stance_votes_2
57,How Abortion Should Be Dealt With?,abortion,attack,"Absolutely. If society stepped up and gave women the help they need, it would not only help the baby, but it would help the woman as well. 
There are many things that are not reality but it doesn't mean we shouldn't strive toward it. Ending world hunger isn't a likely reality either but we don't cease efforts to end it on the basis that the opinion it can be acheived soon is ""theory, not reality in your lifetime.""
The issue isn't choice; it's that abortion is bad. Even many pro-choice people believe that abortion is bad and would prefer women have less of them. I have a lot less problem with abortion early on in the pregnancy (1st trimester) but after that there is much greater chance of viability of the baby outside the womb.",56,58,topic_stance_votes_1
58,How Abortion Should Be Dealt With?,abortion,attack,"Indeed it is. You seem to think that a pregnant's woman's needs are pretty minimal. Not dieing - maybe good health. Is that all you need?
I am pleased to see that you have upped it to all kinds of health needs and not just whether she will die.
I AGREE and have been advocating as much since forever. But society has not done this - if they had I don't believe abortion would be nearly as prevalant.
Wow - that's pretty arrogant since the above remains a gap and you can not possibly know the circumstances of every woman out there.
And of couse you have to go back to trivializing women and their lives. 
They are about needs. Its just that so many lifers see pregnant women as either pregnant or dead - there is no other reality in their life that really needs to be considered.",54,59,topic_stance_votes_2
59,How Abortion Should Be Dealt With?,abortion,support,Right on! Jitobear!,59,60,topic_stance_votes_2
60,How Abortion Should Be Dealt With?,abortion,attack,"How is being comfortable a ""need""? I'm talking about abortion for convenience/comfort.
That's a poor reason to not strive toward getting society to do so.
I'm not talking about every circumstance. I already told you, I'm ok with early term abortions, and in cases where the life and health of the mother is at stake.
I agree--many lifers do that, just as so many choicers see an unborn baby as just tissue rather than something with real value. Both sides could stand to learn.",59,61,topic_stance_votes_1
61,How Abortion Should Be Dealt With?,abortion,attack,"What I am questioning is the idea that being comfortable is the reason why women choose abortion. It's absolutely degrading. Women choose abortion for health reasons, emotions reasons, financial reasons, becuase they are in an abusive relationship, the middle of college, they are 13 years old, they were raped, they are on meds they can't go off of, job security, no money to sustain a pregnancy, they are alone, they are scared - a MILLION reasons. If you think all of those things are a matter of ""comfort/convenience"" you have damned bleak esteem for women.
I was agreeing with you - not arguing.
I understand that - it's your stance that you think most abortions are ""convenience"" matters that I take issue with.
How we see the fetus is irrelevant. We grant choice to the MOTHER - what we think is moot.",61,62,topic_stance_votes_2
62,How Abortion Should Be Dealt With?,abortion,attack,"Regardless, the law would allow a woman to abort her baby for any reason, even if it didn't fall under any of those reasons you give, and even if it were for the absolute most trite reasons. It may be that most women don't have abortions for discomfort, but that's beside the point in terms of what the law allows.
Phrases like ""How we see the fetus is irrelevant"" are exactly what I'm talking about. There are some very good reasons for the pro-choice movement making the effort to acknowledge the value of the life of the fetus. For one, it would go a long ways toward making your movement look less draconian to those of us who see such elements there. (and believe me, there are MANY of us.) If anything, it would be better PR. Another reason is that by doing so, you'd be taking the moral highground by stepping out and valuing both the mother AND making an effort to value the life of unborn babies. No one is saying you have to abandon your views of how important women are in order to show some understanding of the value of life. And frankly, it just seems to me that it would simply be a benevolent thing to do. Understand that I also think pro-lifers should also make more effort in this way to value women and mothers and to understand their feelings.",62,63,topic_stance_votes_1
63,How Abortion Should Be Dealt With?,abortion,attack,"If the fetus can be removed safely then that should be the method to remove it. However, equal rights for the fetus would not allow it to live attached to the woman since none now have that right. Allowing it to do so would give it greater rights than others have.",55,64,topic_stance_votes_2
64,How Abortion Should Be Dealt With?,abortion,attack,"There is not enough counseling. Before my abortion the conseling consisted of watching a 2 minute video on the procedure. There's more done for you when your tonsils are removed. I suspect that if there was more comprehensive counseling available then you'd see abortion rates diminish. Really talk to women, find out why they are getting an abortion. Educate them, show them their options. Have them talk to other women. This would all be optional, of course. But readily available.
Abortions are surgical. They can have major complications. Anesthesia is involved. They should be done in a hospital, no matter what the perception is. 
Since abortions are legal, let's make sure women get the best care and have the best resources available. This is surely at a hospital.
What's a ""trite"" reason? Something about vanity? Like, ""I don't want stretch marks""? Yeah, this may be a ridiculous reason, but maybe she's a model and makes her living modeling...who am i to decide what's reasonable or not?
Can anyone find stats on the reasons women have abortions? I've looked several times but haven't found much. Thanks...
Let's not forget that jyoshu said he's not opposed to early term abortions. I think this is quite phenomenal! emoticonXHoho",45,65,topic_stance_votes_2
65,How Abortion Should Be Dealt With?,abortion,attack,"I have no problem with that. But since abortion clinics are the ones that would give this, and since they are typically tied to the pro-choice movement, you need to take that up with the clinics and the pro-choice movement to pressure them to do so. These clinics are mostly business ventures, not free public service providers.
There may be sound reasons for abortions to be a hospital-based procedure, but the fact it's often surgical isn't one of them. Surgery is not limited to hospitals--there are many specialty clinics that perform many types of surgeries, and are well-equipped to handle complications. And regardless, some hospitals indeed do abortions. Hospitals are business ventures (mostly anyway--the ones that aren't are non-profit but unafiliated with govt.), and they have their own say in what procedures they offer. 
Again, some hospitals offer abortions. But you'd have to address other hospitals on a case-by-case basis to convince them to offer them because they decide their own procedures.
Either way, the law allows for abortions for even the most trivial reasons. In fact, it would allow abortion for no reason at all.
What's the big deal? Pro-lifers come in varying degrees. The view that abortion shouldn't be done after the 1st trimester is pretty common.",65,66,topic_stance_votes_1
66,How Abortion Should Be Dealt With?,abortion,attack,"Thats really irrelevant. The only question is:
Is a pregnancy a 'reasonable step' for someone to take before they are justified in relinquishing their duty of care?",45,67,topic_stance_votes_2
67,How Abortion Should Be Dealt With?,abortion,attack,"Your personal moral position aside and in particular the fact you're not a woman facing the responsibility of pregnancy, giving birth and 18-years of parental responsibility, why shouldn't it?",66,68,topic_stance_votes_2
68,How Abortion Should Be Dealt With?,abortion,attack,"Let me restate your question... ""leaving your view of right and wrong makes makes up many of our laws and reasons for doing things...why should abortion become illegal?""
why should murder be illegal? Theft? assault? It comes down to someone thinking something is wrong.",68,69,topic_stance_votes_1
69,How Abortion Should Be Dealt With?,abortion,attack,"How is not having to pee every five minutes because your bladder is quished by your pregnancy, especially when you are at work, not a need? How is not vomiting your guts out for the first three months not a need? How is getting so constipated by your bowel's constriction that you are in constant pain not a need? How about one's inability to keep one's balance at very necessary time when one is trying to cllimb a stairs or negotiate other difficult terrain not a need?
Are you willing to stand by to step every time a pregnant woman must leave for a few minutes to urinate? Are you there to hold a barfing bag for her and feed her soda crackers to calm her stomach? Are you there on the spot to help a pregnant woman up and down stairs?
So, where is your commanding presence in this merely ""uncomfortable, inconvenient"" scenario?",61,70,topic_stance_votes_2
70,How Abortion Should Be Dealt With?,abortion,attack,"If being pregnant is criteria for debating about abortion, that pretty much leave you out too, George. Why shouldn't you what?? Have an abortion for absolutely no reason? 
No, those aren't needs, IMO. Those are mostly you making the discomfort of pregnancy out in the worst possible light.
I'm sorry, but I've seen XXXX that would show what real needs are, and people in the US typically have it just fine. Try being in a country where a bleeding miscarriage is a death sentance. So, sorry if I don't feel too sorry for you.
I've caught my wife's barf in my hands, stayed up all night with her, through the whole thing. I consider all those things you mention as not going far enough. Yes, she's the one going through it, but it doesn't mean I can't have an opinion. So, the self-righteous approach you're taking isn't working. Just be glad she's not the one debating you on this--she's a heck more pro-life than I am.
What's most telling is that you apparently think there is some litmus test of having gone through pregnancy for what I'm saying to matter. That's arrogance--nothing less.",70,71,topic_stance_votes_1
71,How Abortion Should Be Dealt With?,abortion,attack,"I agree. I've always taken the position that abortion should be a woman's choice. Men taking the position of barring or limiting abortion and pursuing legislation to do so makes absolutely no sense. I have yet to read one post by a pro-lifer, even those with somewhat modified views, that puts the woman first in all circumstances and makes it her sole decision, regardless of moral claims by men. That's truly dark ages mentality with zero consideration for the woman.",71,72,topic_stance_votes_2
72,How Abortion Should Be Dealt With?,abortion,attack,"Wow, so you think only people who have had abortions should debate about it?? Do you also think that only people who are on death row should debate the death penalty? Should only gun owners have an opinion on gun control?
The reason you don't find pro-lifers putting the woman first in ALL things is that it's not about just the woman. It's also about the baby growing inside of her. I'd had to think I didn't consider the baby as well. Dark ages mentality would be completely ignoring one or the other (the mother or the baby) without taking both into some degree of consideration, and there are people on both sides of the issue that do that. You are a good example because you basically give NO consideration toward the value of the life of the baby whatsoever.",72,73,topic_stance_votes_1
73,How Abortion Should Be Dealt With?,abortion,attack,"Not in all things - just pregnancy. In pregnancy she does, should and HAS TO come first. Biology dictates that.",73,74,topic_stance_votes_2
74,How Abortion Should Be Dealt With?,abortion,attack,Could you please elaborate?,74,75,topic_stance_votes_1
75,How Abortion Should Be Dealt With?,abortion,attack,"From post #9 in this thread:
The mother is providing a service for the child. She is a care giver, and that child needs that care to survive.
I believe quite firmly that no one should be required to provide care against their will. If they choose to provide that care, and then choose to stop providing that care, they should take all reasonable steps to ensure someone else assumes the role of care giver.
For example, if a carer at a mental home has a personal emergency and has to leave, then he should attempt to call in any on-call staff, try and get the next rostered person to come in early, or so on. After he's taken all reasonable steps, he is free of an obligation to stay.
Or if a mother can no longer handle caring for her children, she should attempt to get a friend or babysitter to care for them, or give them up to the state.
Or if a pregnant woman no longer wishes to carry her baby. Unfortunately, in that instance, it is unlikely that anyone will be in a position to assume the role of caregiver.
However, regardless of the eventual fate of the person recieving care, no person should be required, no person should be forced to provide care against their will. They should be able to abandon that person, provided they take all reasonable steps to ensure someone else assumes the role of care giver.
Needless to say, I don't consider a pregnancy to be a 'reasonable step'.",75,76,topic_stance_votes_2
76,How Abortion Should Be Dealt With?,abortion,attack,"I still don't understand what you mean by ""reasonable step"", we don't get pregnant just to have an abortion. Do you mean is pregnancy a reasonable REASON to have for relinquishing duty of care?",76,77,topic_stance_votes_1
77,How Abortion Should Be Dealt With?,abortion,attack,"No. Reasons are irrelevant.
A 'reasonable step' or reasonable measure is something that it is reasonable to expect someone to do before they are justified in abandoning that care.",77,78,topic_stance_votes_2
