,title,topic,stance,comment,parent_id,comment_id,viewpoint
0,Would you be for two biologically related gay brothers or sisters to marry?,gay marriage,support,"In todays world it IS possible, unfortunately...
And if you are FOR gay marriage between two biologically unrelated gay men/women and would be FOR a ban on marriage between two biologically related gay men/women,such as brothers/sister, aunts/nieces, etc... who are you to say anything about someone who wants a ban on gay marriage, like the proposed Constitutional Amendment.
BTW, if you have no problem with gay marriage between two biologically related gay people, then you are sick. 
As well, I hear all the time that what someone does in the privacy of their own homes is their business. Would you agree in the case of two biologically related gay men/women, such as two biologically related gay brothers/sisters who are at the age of consent?
I hope not.
Lets see how many who say that it is discriminatory to ban gay marriage as with the proposed Cons. Amend. will show themselves to be hypocrites by not being for gay marriage with two biologically related gay men/women such as brothers/sisters who are at age of consent....
Lets see how many are sick enough to be FOR marriage between two biologically related gay men/women, such as brothers/sisters, who are at age of consent.
I am consistent. 
I am ONLY for traditional marriage... between a man and a woman.
No gay marriage of any type, thank you.",0,1,topic_stance_votes_2
1,Would you be for two biologically related gay brothers or sisters to marry?,gay marriage,attack,Are you for marriage between 2 biologically related heterosexuals? I'm not either. Incest has nothing to do with homosexuality.,1,2,topic_stance_votes_1
2,Would you be for two biologically related gay brothers or sisters to marry?,gay marriage,support,"Well I'm afraid I must be sick then, as I would be for both proposals. 
Though I wouldn't say those only for homosexual marriage and not to incestual are hypocrites, they are indeed two completely different things.
Why are you only for heterosexual marriage?
edit: sp",2,3,topic_stance_votes_1
3,Would you be for two biologically related gay brothers or sisters to marry?,gay marriage,attack,"Ya know, it is really funny how you use the bible as your weapon against gay marriage, but yet you are forgetting about the very beginning as the bible tells it.
""Adam and Eve"" were the only two homosapians on earth in the beginning, right? Are you with me so far? ""Adam And Eve's"" were instructed to go forth and multiply the earth. Who do you think Adam and Eve's sons multiplied with? Wouldn't it have to be their sisters? Or do you feel your ancestors multiplied with the dinosaurs? 
How about the story of Noah's ark? Noah's grandchildren had no one but the own cousins to breed with. 
The way I see it, you might want to be thanking your Creator that incest and poligamy existed in the old ""traditional"" days or your butt may not be here to breed your hate in the name of God.
As far as gay marriage leading to poligamy being legalized...that is the ""traditional way"" back in the old testiment. Many men had more than one wife. 
So if you want to use your bible as a weapon against gay marriage, and if you fear this all leading to incestial marriage or poligamy, what is going to be your weapon against stopping that? You won't be able to use your bible as your weapon because incest and poligamy stories far out number your arguments against them.
I would say you better get to finding a new weapon if this is your fear. 
Tell me, how does it feel to fear the future so much? Your insides must be tormented and in a dis-ease on a constant basis beings you are not able to force your beliefs and ""morals"" on everyone. Did you know that dis-ease causes disease? 
Just to clarify my position a little better...who people fall in love with and marry, is not my business. (or yours, contrary to what you might think.)
Love is never wrong...God is love. Only people's false concept of what love really is, is the problem we face in this world.
Lilac Angel",1,4,topic_stance_votes_1
4,Would you be for two biologically related gay brothers or sisters to marry?,gay marriage,attack,"No, I am not for marriage between two biologically related heterosexuals. The law allows that second cousins may marry, but to me that is still wrong...
Go check out my thread...""Will you sign NoGayMarriage Petition"". go to page 8
Check out responses #115 and #116.
That is why I started this thread.
I was shocked.... I wondered if others had similiar views concerning allowing biologically related brothers being allowed to marry...",2,5,topic_stance_votes_2
5,Would you be for two biologically related gay brothers or sisters to marry?,gay marriage,support,"Don't be stupid angel, everyone knows the dinosaurs never existed, the skeletons were just put there by God to test us :p",4,6,topic_stance_votes_1
6,Would you be for two biologically related gay brothers or sisters to marry?,gay marriage,support,"Hmm, I did check out the other thread, where you posted:
This would be the Bible in which:
So both daughters get daddy ******, shag him and get pregnant. And considering that God smites people for just about anything and everything in the Bible, he seems silently approving in this case.",6,7,topic_stance_votes_1
7,Would you be for two biologically related gay brothers or sisters to marry?,gay marriage,attack,"If God was silently approving I doubt He would have have the the case of Lot and his daughters in the Bible. Case in point, be careful what you environment you let your children be exposed to. Well, if you did truly check out that thread, would it be ok, in your opinion, for two biologically related brothers to engage in sodomy in the privacy of their own homes?
Incest happens with heteros and homos, unfortunately.
They can't have children so the incest law would not apply, and they aren't any less gay than two biologically unrelated gays.
Well, what's your answer? You commented thrice, do it again.",7,8,topic_stance_votes_2
8,Would you be for two biologically related gay brothers or sisters to marry?,gay marriage,attack,"I will indeed.
I approve of any sexual act between adults providing it is will the full consent of all involved parties, and has no adverse affect on others. Quite what people do to each other behind close doors is their own business.
I further support the rights of people (note I said people, not two people) in a consenting, loving relationship to have the support of the government in providing full marital (or whatever you want to call it) support.
Marriage is no longer about God, it is about creating a stable and supportive relationship between people.
There, I think that shows my exact stance on the matter.
And like I say, in every other instance God explicitly spells out his disapproval of human actions (yes including homosexuality). He does not here, therefore it is implied he approves. In the context of the chapter it is seen that the daughters did the right thing in allowing their lineage to be preserved. Further, as angel points out, why would he have made only two original humans, therefore creating the necessity for incest from the outset?
One cannot use God to confirm one's prejudices in one case and twist His word when it doesn't confirm another",8,9,topic_stance_votes_1
9,Would you be for two biologically related gay brothers or sisters to marry?,gay marriage,attack,"Actually it seems you are the one that is sick. You have this obsession with what others do with their sex life and want the government to try and prevent any kind of sex you don’t approve of. It looks like you are trying hard to repress homosexual desires you have. Otherwise why do you care what others do when it doesn’t affect you?
I'm not for or against what other adults do with their consentual sex life. It's none of my business.",1,10,topic_stance_votes_1
10,Would you be for two biologically related gay brothers or sisters to marry?,gay marriage,support,"I don't believe I could have worded my stance on this as good as what you just wrote. I am in agreement 100 percent on all your words.
I agree with everything you wrote above also except...
Human's wrote the bible. Not all words in the bible were inspired by God. They are simply fallable man's interpretation of a greater intelligence. Human's little finite minds cannot comprehend this greater intelligence in all concepts. I believe that is why God sent his Spiritual Masters, such as Jesus, to us so that he could up-date our understandings. But yet we still have a long way to go. 
Lilac Angel",9,11,topic_stance_votes_1
11,Would you be for two biologically related gay brothers or sisters to marry?,gay marriage,attack,"Like I said, incest has nothing to do with homosexuality. And I did check out the thread, actually, I responded to it by saying ""No, and I will not sign a no straight marriage petition either"". I think this pretty much sums up my feelings on it.",5,12,topic_stance_votes_1
12,Would you be for two biologically related gay brothers or sisters to marry?,gay marriage,attack,"You have the nerve to call me sick when there are others on here saying that it doesn't matter if people engage in incest, and give reasons like its ok if they love each other...Go look in the mirror for sickness!!!! You not commenting on phuntings response to me (after I asked him to respond to me a fourth time, which I thank him for, though I disagree with his response) disturbs me, as it should anybody....
The only obsession is see is the obsession gays have in seeking acceptance for their lifestyles....
No, there are no desires that I am trying to repress...Especially not sick homosexual desires....
That tired, worn out method of calling people 'closet cases' won't work with me...Maybe you are the closet case and don't like me bringing stuff like this up???",10,13,topic_stance_votes_2
13,Would you be for two biologically related gay brothers or sisters to marry?,gay marriage,attack,"Incest does too have to do with homosexuality...If two biologically related brothers engage in sodomy or any other sex act, then that is incest. If two biologically related sisters sisters engage in sexual acts that is incest. 
Should biologically related gays, say brothers, be allowed to engage in sodomal incest in the privacy of their homes???
Allowed to marry?",12,14,topic_stance_votes_2
14,Would you be for two biologically related gay brothers or sisters to marry?,gay marriage,attack,"Incest does too have to do with heterosexuality...if bilogically related brothers and sisters engage in sodomy or any other sex act, then that is incest.
Again, I don't see why this is a difficult concept for you, but:
Should biologically related straights, say brother and sister, be allowed to engage in sodomal incest in the privacy of their homes???
Allowed to marry?",14,15,topic_stance_votes_1
15,Would you be for two biologically related gay brothers or sisters to marry?,gay marriage,attack,"My simple answer to the question of this thread is: No.
I don't condone Homosexuality or Incest in any form.",15,16,topic_stance_votes_2
16,Would you be for two biologically related gay brothers or sisters to marry?,gay marriage,attack,"It didn’t take all that much courage but thanks for the compliment.
You sound like my wife. :)
It doesn’t disturb me. I’m not concerned about what people do in their private lives. You are the one that wants to look in other people’s bedrooms.
You keep starting all these threads on gays, that’s called obsession.
Then why are you so interested in what other people do in private?
It seems to have worked. You got all bent out of shape. :)
Go ahead and bring it up. But it does make you appear you are trying hard to repress something.",13,17,topic_stance_votes_1
17,Would you be for two biologically related gay brothers or sisters to marry?,gay marriage,attack,"Sorry DS, I just don't get the connection between homosexuality and incest. Are you asserting that a connection exists?",16,18,topic_stance_votes_1
18,Would you be for two biologically related gay brothers or sisters to marry?,gay marriage,attack,"Sickness is all in the eye of the beholder, what I find sick you may well not and I think we have seen that I find things acceptable that you don't. I will not condemn any of it however unless it actually causes harm.
Oh I quite agree. Unfortunately, not everyone is able to see it as such. I was admitting to those who don't that it does appear that God confirms their homosexual prejudices. 
To back Traveler up however, I don't buy the 'closet case' answer myself. People who are racist aren't secretly scared they are black, equally homophobes aren't necessarily closet homosexuals. Unfortunately such irrational prejudices just exist.",13,19,topic_stance_votes_1
19,Would you be for two biologically related gay brothers or sisters to marry?,gay marriage,attack,"You said that incest has nothing to do with homosexuality...Yes it does...There is such as thing as sodomal incest...and it can happen with BOTH these groups... biologically related gay brothers and biologically related heterosexual siblings.
Incest can happen between gays and heterosexuals...
Biologically related related straights engaging in sodomy is just as sick and just as much sodomal incest as two biologically related gay brothers engaging in sodomy...
Now, admit that homosexuals can engage in incest just as readily as hetrosexuals can...Your failure to do so will cause many to wonder just why you don't...",15,20,topic_stance_votes_2
20,Would you be for two biologically related gay brothers or sisters to marry?,gay marriage,support,"Neither do I...Sadly,though, there are those on here who seem to have no problem with two biologically related gays, be they gay brothers or gay sisters engaging in sexual activities as long as it is in the privacy of their homes...
And I believe that they are, in fact, the true closet cases when it pertains to gay incest..",16,21,topic_stance_votes_2
21,Would you be for two biologically related gay brothers or sisters to marry?,gay marriage,attack,"Well yes it does have something to do with homosexuality if you put it like that. To the same extent as catching a bus has to do with homosexuality in that homosexuals can do it.
I don't think that sundowner is disputing that, he appears to be saying that you are making an illogical intrinsic connection between homosexuality and incest.
I notice that all you homosexual references are to men, do you not consider lesbians homosexuals?
edit: I see that's not totally true, however you do appear to put an emphasis on men.",20,22,topic_stance_votes_1
22,Would you be for two biologically related gay brothers or sisters to marry?,gay marriage,support,"Thank you, that is precisely what I was saying. I do not condone incest at all, but I find no basis for making a connection between incest and homosexuality any more than making the connection between incest and heterosexuality. Incest is an action, homosexuality and heterosexuality are lifestyles. Perhaps the point you are attempting to make is clear, but I just don't get it.",22,23,topic_stance_votes_1
23,Would you be for two biologically related gay brothers or sisters to marry?,gay marriage,support,"This thread is absolutely ridiculous. Maybe I'm not understanding it :: gay brothers or sisters having sex with each other? I'm sure it occurs but to stretch this into a debate is hardly worth it. If there are gay bro/sis people here who want to defend this, go for it, but I believe this thread is so off-track, it's a mere distraction to the real issues at hand.",23,24,topic_stance_votes_1
24,Would you be for two biologically related gay brothers or sisters to marry?,gay marriage,attack,"I'm asserting that I believe both are wrong sexual relations, and sinful in the eyes of God, and that is all I am asserting.",18,25,topic_stance_votes_2
25,Would you be for two biologically related gay brothers or sisters to marry?,gay marriage,attack,"I hate to admit it, but I actually agree with you mjames. :p That's never happened before!
We should spend out time clobbering each other over these debates separatly.....",24,26,topic_stance_votes_2
26,Would you be for two biologically related gay brothers or sisters to marry?,gay marriage,attack,"I'm curious, why do you think incest is wrong?
How closely related do you think two people have to be for it to be incest? Or at what point is it no longer incest?",25,27,topic_stance_votes_1
27,Would you be for two biologically related gay brothers or sisters to marry?,gay marriage,attack,"I do with the more traditional view, that Cousin or anything closer is too close.....so
Grandfather ect...
Grandmother ect....
Mother 
Father
Uncle 
Aunt
Cousin",27,28,topic_stance_votes_2
28,Would you be for two biologically related gay brothers or sisters to marry?,gay marriage,attack,"Please read this post as an interest in discussing the logic of the subject. I am saying that because I can see where you might take it as being sarcastic; but my intent is to examine the issue more closely. I am not trying to paint you into a corner and prove a point. I actually haven’t given this subject much thought before and am just interested in what’s behind the thinking on this being wrong.
Cousins are 25% related by genetics. Based on your statement, would I be right in assuming you would not consider sex with someone that was related by 24% genetics as incest?
I am trying to get a handle on what you consider incest and why you consider incest a sin. Is it the act of having sex with someone that is too closely genetically related or is it the acceptance of the act. In other words if someone married an adopted sibling that they did not know was their sibling, would having sex with that person be incest before they found out or after they found out or both. And would they need to obtain a divorce or should they stay married and just never have sex with that person again or how would that work? I'm making the assumption that you believe divorce is a sin which may be a bad assumption.",28,29,topic_stance_votes_1
29,Would you be for two biologically related gay brothers or sisters to marry?,gay marriage,support,"Only problem with incest is that after several generations the chance of getting a recessive genetic disorder in the offspring are quite high. So really the only problem is that it can produce disabled childrenif continued, one off incest isn't really at all damaging (unless one of the original parents of the incesting couple has one of these genetic disorders). As a homosexual coupel have absolutely no chance of producing a child with these disorders these rules wouldn't apply. Is it actually a crime to have an child through incest- or just marrying your cousin/brother/parent by the way?
Raises another point though, if the increased risk of disabled children is the reason for the law why are people who suffer from an serious dominant genetic disorder or two carriers of a recessive disorder allowed kids as long as they are not related?",29,30,topic_stance_votes_1
30,Would you be for two biologically related gay brothers or sisters to marry?,gay marriage,support,"Well, you should know that in the U.S., several states allow marriage between cousins. If gay marriage is ever made legal, there will be second cousins who are gay that sooner or later will want the right to marry, just as there have been second cousins who are heterosexuals who have, unfortunately, been given the right to marry.
Gay second cousin marriage could very likely open the door to other gay marriages past even that.
Not likely? Go back 60, 70 years and tell someone that legal gay marriage could happen one day. They would laugh in your face.
Think that gay marriage between 2nd cousins and then on from there to say gay uncles/nephews, aunts/neices wont ever happen if gay marriage is legalized
Think again...They will argue that they can't have deformed children, heck they can't even have children, so the incest laws wouldn't apply to them...
This world is becoming more and more depraved by the year, and you had better realize that...",26,31,topic_stance_votes_2
31,Would you be for two biologically related gay brothers or sisters to marry?,gay marriage,attack,"OK, but it just seems that you want to ignore the fact that incest is not only homosexual, it can be heterosexual as well. Heck, if you include the family dog it can be bestiosexual. I just wonder why the title of the debate is not:
Would you be for 2 biologically related people to marry. Remember, gays are people too, a fact you seem to ignore. Just more of you putting yourself and other meddling heterosexual christians on a platform over this sick, twisted, sinful group? emoticonXRolleyes",25,32,topic_stance_votes_1
32,Would you be for two biologically related gay brothers or sisters to marry?,gay marriage,attack,"Go back 100 years and tell someone that legal black and white marriage could happen one day. They would laugh in your face.
Yes it is. We should be going back to the good old days of slavery and when the church had complete control and everyone had to tow the line or be declared a heretic and burned at the stake and women didn't have the right to vote and when a parent could give a child a lobotomy for being unruly and when blacks were convicted of crimes simply because a white person accused them. Now those were the good old days when morals really meant something.",31,33,topic_stance_votes_1
33,Would you be for two biologically related gay brothers or sisters to marry?,gay marriage,attack,"No, I'm not ignoring that fact. What I am saying is that I believe all incest and all homosexuality is wrong, not jsut homosexual incest. 
Sundowner......Everyone is biologically related. It's simply the closeness. I would not be in favor of any sexual relations between anyone closer togethar than cousin or second cousin.",32,34,topic_stance_votes_2
34,Would you be for two biologically related gay brothers or sisters to marry?,gay marriage,attack,Is it purely for the biological reasons that incest is wrong though (i.e higher chance of genetic defect)? This would be the reason it isn't very common in any cultures to a real degree.,34,35,topic_stance_votes_1
35,Would you be for two biologically related gay brothers or sisters to marry?,gay marriage,attack,"So it is all a matter of degree to you. Let me ask, how do you decide what is acceptable and what is not? Is there a book or manual that breaks incest down into acceptable and not acceptable. And if you are against ALL incest as you claim, and we are ALL related.....",34,36,topic_stance_votes_1
36,Would you be for two biologically related gay brothers or sisters to marry?,gay marriage,attack,"Ok, I've said this before, and I'll say it again.
God decides not me. 
I know we are all related. I SAID that I was not in facor of anything closer than a cousin. Did you not hear me?",36,37,topic_stance_votes_2
37,Would you be for two biologically related gay brothers or sisters to marry?,gay marriage,attack,DS are you not interested in replying to the questions I asked in #29?,37,38,topic_stance_votes_1
38,Would you be for two biologically related gay brothers or sisters to marry?,gay marriage,attack,"That's called a historical trivialization. The difference between blacks and whites and homosexuality and heterosexuality is that homosexuality is abnormal, it is a mental disorder that can be cured- just like depression, alcoholism, and even pedophilia. It is not in human nature to be depressed, be an alcoholic, be a pedophiler, or be gay. Being Black or Jewish is completely natural.",38,39,topic_stance_votes_2
39,Would you be for two biologically related gay brothers or sisters to marry?,gay marriage,attack,"That's called a bad anology.
I think you'll find being homosexual is far more common in nature than being Jewish, and alchololism has a very strong genetic tendacy, also it is not cured but overcome. Most of the other other things you suggest are either suspencted or known to be linked to biological causes. Human nature is just a way of you saying what you think poeple shoud be like in this case.",39,40,topic_stance_votes_1
