,title,topic,stance,comment,parent_id,comment_id,viewpoint
40,Would you be for two biologically related gay brothers or sisters to marry?,gay marriage,attack,"Saying that homosexuality is abnormal is a subjective argument. Saying that it is a mental disorder that can be cured is a fallicy. Look at the DSMIV, there is no listing of homosexuality as a mental disorder. And comparing it to depression, alcoholism, and pedophilia is a rediculous connection. 
Depression is a mental disorder, one that often has underlying physiological origins..ie...imbalances of neurotransmitters. This can hardly be helped by the individual, and often can be treated and controlled, but not cured. 
Alcoholism is a disease, one that has strong genetic links. The addiction associated with alcoholism is both psychological and physiological. Alcoholism has also been associated with imbalances of neurotransmitters. Again, alcoholics cannot be cured, they can only be treated. You will never find a cured alcoholic, only a recovering one. Ask anyone who is a member of AA if they are an alcoholic or a former alcoholic. 
Pedophilia is a criminal act, unlike the rest of the list. Saying that pedophilia is a mental disorder is technically correct. It is listed in the DSMIV under the category of Sexual and Gender Identity Disorders. It is important to note however that most pedophiles are often diagnosed with other disorders, such as personality disorders...etc. Again, you will find few that would agree that this can be cured, only controlled through medication or behavior modification therapy. 
Homosexuality is a lifestyle, not an abnormal disorder or mental disease that can be cured. Where is your objection to homosexuality based, in your views, observations, and knowledge of human psychology or in your religious views? Saying that homosexuality is not human nature could not be farther from the truth...what do you think human nature is? Do you think gay people are ""recruited and brainwashed"" into the homosexual lifestyle? All of the things you listed are human nature. Human nature does not only include that which is considered good and morally acceptable by society, or the church. Human nature is behavior observed in humans. Being black is not human nature...it is genetic. Having 2 black parents makes you black. And being Jewish is not human nature...it is a religious affiliation that is learned. If being Jewish was human nature, people would be born with Jewish tendencies and ideals. Would you say that you were born Orthodox or raised Orthodox? If you were born and raised in a completely neutral religious environment where religion is not taught and information is not available on religion, would you still be Orthodox? Would you know what Orthodox theology was all about? If you did, then you could say that it is human nature.",39,41,topic_stance_votes_1
41,Would you be for two biologically related gay brothers or sisters to marry?,gay marriage,attack,"Sorry, I didn't see it.
Ok, first, I hate divorcce. God hate's divorce. So yes, I believe it is a sin, except under some cuircumstances.
As in if one of them is cheating on the other. This is perfect grounds for a divorce if you want.
I also wouldn't exactly be suprised by a divorce where abuse was involved. If you're getting beaten up by your husband, then you probably should get out of there. 
As for the people who found out they were really brother and sister, but were married first......I dont know. nothing like that has happened before. I'd have to give it some thought. {Please keep in mind, I'm comparatively young, I may not be able to anwer all your arguements}",38,42,topic_stance_votes_2
42,Would you be for two biologically related gay brothers or sisters to marry?,gay marriage,attack,"I was referring to changing ideas about what is right and wrong. However homosexuality is caused by genetics, it’s not a mental disorder.",39,43,topic_stance_votes_1
43,Would you be for two biologically related gay brothers or sisters to marry?,gay marriage,attack,Fair enough. What about the 24% related question. Is that incest or not? If no then what about 24.5%. I think you get where I'm going. Where exactly do you draw the line?,42,44,topic_stance_votes_1
44,Would you be for two biologically related gay brothers or sisters to marry?,gay marriage,attack,"America can't Ban anything? It opened the closet to a portal to Hell.
Look at the bright side, at least the circus will be exciting, from all the diseases/ and ""freaks"" concieved at the family orgy. Or perhaps the family will grind the freak babe up and eat it-",15,45,topic_stance_votes_2
45,Would you be for two biologically related gay brothers or sisters to marry?,gay marriage,attack,"I want to make nonsensical posts like you do, rapture. Will you teach me?",45,46,topic_stance_votes_1
46,Would you be for two biologically related gay brothers or sisters to marry?,gay marriage,attack,"Looks like you got it under control, and what about my post didn't you understand?",46,47,topic_stance_votes_2
47,Would you be for two biologically related gay brothers or sisters to marry?,gay marriage,attack,"can you show how homosexuality is caused by genetics?
I wouldnd classify homosexuality as a mental disorder. I wouldnt even say its abnormal, because 'normalcy' has everything to do with the majority. but I keep seeing repeatedly people claiming that homosexuality is genetically caused. can you show some type of proof supporting this?",43,48,topic_stance_votes_2
48,Would you be for two biologically related gay brothers or sisters to marry?,gay marriage,attack,"Because of the following and many more.
Klinefelter's syndrome 
Turner's syndrome – 
Congenital adrenal hyperplasia (or adrenogenital syndrome) 
Androgen insensitivity syndrome (AIS, or testicular feminization) 
Partial AIS: 
Mayer-Rokitansky-Kustur-Hauser syndrome 
Vaginal agenesis 
Cloacal exstrophy 
Hypospadias 
Hermaphroditism
All of the above are sexual disorders caused by genetics. Since sometimes we can’t even determine whether a child is a male or female, it is obvious that genetics plays a very important part in human sexual orientation.
So I would ask this question. If a person with female outward appearance that has XY chromosomes, has sex with another female, is she/he a homosexual?",48,49,topic_stance_votes_1
49,Would you be for two biologically related gay brothers or sisters to marry?,gay marriage,support,"Here's a ""nutshell"" layman's terms quote from the Advocate:
""ALL THE SCIENCE SO FAR 
Here's what researchers have reported in their search for the ""cause"" 
Lesbians' ring fingers tend to be longer than their index fingers, whereas straight women's ring fingers tend to be the same length as their index fingers. 
Boys who show ""pervasive and persistently"" effeminate behavior have about a 75% chance of growing up gay. 
A person with a gay identical twin is at least 10 times more likely to be gay than a person without one. 
There is about a 2% chance that a firstborn male will grow up gay. That chance grows to at least 6% for males with four or more older brothers. 
Gay men and lesbians are more likely to be left-handed. 
Gay men have smaller hypothalamuses than straight men. 
A man is more likely to be gay if there are gay men on his mother's side of the family. 
Lesbians' inner ears tend to react to sounds more like men's inner ears than like straight women's. 
Gay men have more testosterone and larger genitalia than straight men."" 
--and this from Behavior Genetics:
Multivariate structural equation modeling techniques have been applied to examine the causes of individual differences in responses to several items concerning sexual orientation. To minimize potential ascertainment and response biases, the study sample involved a large (N = 4901) community-based cohort of Australian twins aged 18–52 who answered an anonymous questionnaire on sexual behavior and attitudes. The statistical power of the analysis was increased by the availability of multiple measures of sexual orientation (behaviors, attitudes and feelings), providing stronger evidence for the existence of additive genetic influences on this phenotype than in a previous analysis (Bailey et al., 2000). Estimates of the heritability of homosexuality in this sample ranged between 50 and 60% in females but were significantly lower (heritability of approximately 30%) in males. [ABSTRACT FROM AUTHOR]",49,50,topic_stance_votes_1
50,Would you be for two biologically related gay brothers or sisters to marry?,gay marriage,attack,"Actually I think it's a valid point, no doubt said people 100 years ago would spout bogus facts that interacial breeding is a disorder, in fact they did do many similar things in using science to 'prove' blacks were inferior.
Cured? Come on. No more than you can be 'cured' of your hetrosexuality. 
Oh and how is being Jewish 'natural', it is a product of society.",39,51,topic_stance_votes_1
51,Would you be for two biologically related gay brothers or sisters to marry?,gay marriage,attack,"I would ask this question: if a person has X and Y chromsomes but female characteristics, does that determine which gender they will be sexually attracted to? I am aware that sexual disorders exist and they are genetic. but how does that necessarily correlate to sexual preference (which is the basis of homosexuality)? since the existence of the Y chromosome or even testosterone in men does not dictate that they are sexually attracted to females, then what does? so far you have not demonstrated a link between genetics and sexual preference",49,52,topic_stance_votes_2
52,Would you be for two biologically related gay brothers or sisters to marry?,gay marriage,attack,"That’s a very good observation UP and I think you are correct to point that out. Although I noticed you didn’t attempt to answer my question. I was not trying to explain how genetics determines sexual preference although I admit I stated that previously. But my point was this. If there are cases where we can not determine what sex a person is, how can we determine if they are homosexual or not? So to answer your question, I don’t know the answer, do you? But I am interested in pursuing this line of reasoning. So I would request that you give me an answer to my original question and I will ask another question. How do you think the gender of a person should be determined?",52,53,topic_stance_votes_1
53,Would you be for two biologically related gay brothers or sisters to marry?,gay marriage,attack,"my answer, as it has always been, is that sexual preference is a personal choice, not influenced by genetics, biology, chemistry or physiology. people choose to be either sexually attracted to males, females, family members, animals, etc. its a choice. nobody is born gay
it is beyond me that people take my point to mean that I am against gays, or that I think homosexuality is wrong, or anything like that. people make choices, and it is up to them to live with their choices. no matter what choice anyone makes, the consequences of that choice is theirs to bear, whether you consider them 'good' or 'bad' to me is really a question of perception, which is also based on choice
the statement ""people are not born gay"" does not condemn people for being gay. it simply brings to light a common misconception that society has been spreading for the past few years. and the statement itself, being a factual statement, is always open for verificatin to see whether it is true or not. it is not an opinion statement, and if it can be proven that people are born gay, then I would gladly retract it
personally, I have no problem with gays as people. homosexuality is just something I choose not to practice",53,54,topic_stance_votes_2
54,Would you be for two biologically related gay brothers or sisters to marry?,gay marriage,attack,"So you actually remember when you made the choice to become hetrosexual?
What about my questions? Can you answer them?",54,55,topic_stance_votes_1
55,Would you be for two biologically related gay brothers or sisters to marry?,gay marriage,attack,"Today I chose to be heterosexual. Just as I can choose later today to be homosexual. the choice itself doesnt change anything about me except what I do.
Q: If a person with female outward appearance that has XY chromosomes, has sex with another female, is she/he a homosexual? 
I think the person is a male, possibly a transvestite or a man that took a sex-change operation. the outward appearance would be female, but the genetic composition would be the same as before. and no, technically that person is not a homosexual (although they would fall under the biblical category of ""sexual pervert"")
Q: How do you think the gender of a person should be determined?
The traditional way: see if they got testicles. if that fails, then the chromosomes, if possible.
Of course it can be argued that if someone is born with a peculiar gender, and they dont have sex with someone of their gender then they are really not homosexual. probably if all else fails use the chromosome method. there's no ambiguity in that",55,56,topic_stance_votes_2
56,Would you be for two biologically related gay brothers or sisters to marry?,gay marriage,attack,"I’m not following you. Do you mean that later today you could decide to be attracted to another male (assuming you are male)? I was really referring to sexual preference, not sexual actions.
So for someone that has female sexual organs but XY chromosomes and doesn’t know that, has sex with a male, then they are homosexuals? And by your definition, God would have created a “sexual pervert”. 
If they have a penis and no testicles, then they are female?
Okay but that does make someone with female outward appearances and male chromosomes a male.",56,57,topic_stance_votes_1
57,Would you be for two biologically related gay brothers or sisters to marry?,gay marriage,attack,"yes I am male, and yes I could will my self to be attracted to a man. of course preferably with nice features, but it is always a possiblity. 
if you read what I said youd see I put its probably either a transvestite or a man that had a sex change operation. God doesnt make transvestites or change people's sex. people choose to do these things. if on the other hand a baby is born with female genitals and XY chromosome, then I think that would be very wierd. I've never heard of that happening before though
thats the traditional way, Hank
when all else fails, the rule is XY = male, XX = female. you cant have any other combination, so there is no guesswork",57,58,topic_stance_votes_2
58,Would you be for two biologically related gay brothers or sisters to marry?,gay marriage,attack,"Okay but personally I find that strange. I have always been attracted to females and never to males. I don’t think there is any amount of will that would make me become attracted to a male. I guess we’re just different. But I don’t believe I have ever talked to another male that has said they could be attracted to a male if they tried except for a homosexual.
Then you are very uninformed. About one of every two thousand children in America are born with some kind of indefinite sexual characteristics. There is a point in fetal development when the sex organs of the child are determined by a shot of testosterone. If a child gets that hormone, they develop an external sex organ or penis, if not then they develop an internal sex organ or a clitoris. This is regardless of whether they have the XY male chromosome or the XX female chromosome. Of course if every thing goes according to plan, the fetus with the XY chromosome will get the shot of testosterone. However is a child with XY chromosomes does not get the shot of testosterone, then they develop female sex organs even though they have the male XY chromosomes. And the amount of testosterone can vary greatly, causing mixed sexual organs or underdeveloped sex organs.
I don’t understand how that was responsive to my question. But let me ask it a different way. What gender do you think a child should have when they have both sex organs.
Again you are uninformed. A person can have XO, XXY, XX/XY and other combinations. So there is a lot of guesswork. 
So with that information which you can look up for yourself if you don’t believe me, I will ask the question again.
If someone that has female sexual organs but XY chromosomes and doesn’t know that, has sex with a male, then they are homosexuals?
And again I’ll say, by your previous definition, God would have created a “sexual pervert”.",58,59,topic_stance_votes_1
59,Would you be for two biologically related gay brothers or sisters to marry?,gay marriage,support,"So you are saying that sexual preference is entirely down to choice. Unkerpaulie, have sex with a man tonight (seeing as you can choose), did you enjoy it as much as a woman?
So either you are wrong or gay, your choice (which is the issue here).
If this site wasn't PG-13 I could give you links to show sexual abnormalities, as it is quite relavant to Drosophila genetics (the multi cellular test species) and is seen quite commonly in humans (we are one of the worst eukaryotes when it comes to non-disjunction)",59,60,topic_stance_votes_1
60,Would you be for two biologically related gay brothers or sisters to marry?,gay marriage,attack,"I'll admit I was uninformed, probably because those cases are so rare and I never really looked up gender disorders. anyway, sexual perverts and not born, people choose choose to alter their sexul identity. if someone is born with a gender abnormalty, I really cant tell you the rules about that
homosexuality is all about being sexually attracted to people of same gender. it really has nothing to do with what you are born like.
and tastyfish, how do you account for bi-sexuals that enjoy sex with either male or female and no real preference. besides, enjoying sex, whether with male or female, can be learned or acquired, just as it can be lost. some people can start off enjoying homosexuality and then find that theu enjoy other forms of sex and lose interest in the type they were previously accustomed to. it happens",60,61,topic_stance_votes_2
61,Would you be for two biologically related gay brothers or sisters to marry?,gay marriage,attack,"Do you call 1 in 2000 rare? Do you realize how many people that is just in the US alone?
If you can't determine someones gender, how do you determine if they are homosexual or not?",61,62,topic_stance_votes_1
62,Would you be for two biologically related gay brothers or sisters to marry?,gay marriage,attack,"well, I guess I cant answer that, Hank. Im not qualified to determine gender of these cases. for now we can only cover the other 1999 out of 2000 that we can more easily determine their gender.
at the end of the day, when all is said and done, sexual preference still has nothing to do with genetics. there is no built-in feature that determines who will be sexually attracted what gender.",62,63,topic_stance_votes_2
63,Would you be for two biologically related gay brothers or sisters to marry?,gay marriage,attack,"After seeing all the things that can go wrong in fetal development. After finding out that your sexual organs are determined by hormones, and enough of them, at exactly the right time. After finding out that those hormones can be anywhere from non-existent to too much. You still now say that you think everyone has total control over their sexual preferences. Someone once said “with what judgement you judge, you will be judged”. You obviously have no empathy for walking in someone else’s shoes. 
I will just speak for myself at this point. Although you can apparently make yourself become attracted to another male, I don’t have that capacity. Something inside me, whether it is genetics or hormones or some kind of chemical makes me attracted to females and females only. I never picked my sexual preference. It has been females from the very beginning and will always be females. 
You may be hooked on logic but you don't know how to use what has hooked you.",63,64,topic_stance_votes_1
64,Would you be for two biologically related gay brothers or sisters to marry?,gay marriage,attack,"Do you know anything about genetics and reproduction. Or are you just a plain ignorant brainwashed homophobe.
Did you know that every child conceived in the womb is female unless it is given a certain chromosome, i dont want to go into too much detail and waste my time as i think you havent the intellegence to understand, and you neither have the feedom of mind to comprehend. In other words every human starts life in the womb as female, oh i can just hear you thinking, what about lesbians? Its a proven fact that the genetics of humans dont all work the same, hence gay people.
You havent had that conversation with your doctor i suggested some time back, have you? Are you afraid what you might hear.",63,65,topic_stance_votes_1
65,Would you be for two biologically related gay brothers or sisters to marry?,gay marriage,attack,"=====================================
I truly think the original post is confusing in the way it is posed...My points:
1)We cannot really compare homosexuality and incest - unless someone can prove me wrong (and I am willing to hear arguments here), incest is a matter of choice and behavior which most people consider to be immoral. Homosexuality is not a matter of choice and behavior. People do not choose to be gay.
2)It think it is misleading and faulty to try and mix issues of personal morality and the Constitution. The argument against the ban on gay marriages is over breaches of the Constitution. This isn't about personal views. It is about legal rights that are not being extened to all of the citizens of the United States that are afforded by the Consitution. The Consitution does not force you, or me, to approve of anything - only to respect the rights of those who are protected under it. The real question, then, is what right does anyone have to deny Constituational rights based on a sense of personal morality and NOT the reverse as stated at the end of the original post.
3)If the Constitution protects those who engage in incest, and if those who do engage in incest are being denied any rights afforded them by the Constitution by unconstituational laws, then I would have to say that I support a shift for those rights to be extended. Does this mean that I personally approve of incest? No it does not. 
We live an a country that respects a variety of people while allowing use to hold to our own personal views and beliefs. What is this thing with the human will to power to try and make everyone think the same way?
MC",1,66,topic_stance_votes_1
66,Would you be for two biologically related gay brothers or sisters to marry?,gay marriage,support,"When people are insecure about their own beliefs, they feel compelled to force them onto others. In this area people that are called conservatives in this country are the worst offenders. They are scared to death their beliefs might not be ‘right’.",66,67,topic_stance_votes_1
67,Would you be for two biologically related gay brothers or sisters to marry?,gay marriage,support,"I would not think that someone would 'choose' to be incestuous. You are attracted to who you are attracted to. But I agree there is no comparison between the two.
And I totally agree with everything else you say.",66,68,topic_stance_votes_1
68,Would you be for two biologically related gay brothers or sisters to marry?,gay marriage,support,"If you are talking about the act of homosexuality or incest, then it is definitely a choice. If you are talking about being attracted to the same sex or a relation, then it is not a choice. Our debate is usually about whether the act should be legal or not. Although sometimes the debate is about whether it is even a choice or not. UP is arguing that the attraction is a choice. I find that not to be true, at least in my own personal case.",66,69,topic_stance_votes_1
69,Would you be for two biologically related gay brothers or sisters to marry?,gay marriage,attack,"Hank, show one single case where genetics, chemistry or biology dictated which gender someone was attracted to. I'm talking about a case where the facts are scientifically backed up, not a case based on personal feelings or perspective
we already went over the cases where gender is deviant from straight-forward male or female. you said this acounts for about 1 in 2000 people. but you have yet to show a link between hormonal imbalance and sexual preference. that is, what hormones present have been shown to make certain people attracted to males, or to females, or perhaps family members if possible, etc. or what gene, biological feature or chemical composition makes people more likely to be attracted sexually to a particular gender.",64,70,topic_stance_votes_2
70,Would you be for two biologically related gay brothers or sisters to marry?,gay marriage,attack,"Before I do that, so I'll know if it will do any good, do you have an explanation for why about 95% of females appear to be attracted to males and 95% of males appear to be attracted to females?",70,71,topic_stance_votes_1
71,Would you be for two biologically related gay brothers or sisters to marry?,gay marriage,attack,"no explanation, but I can guess because its normal and its what was taught growing up. everywhere in the society sexual attraction to males and females is promoted. now that homosexuality is being promoted more liberally than years past, I expect to see homosexuality more commonly. like I said, its not an explanation, just a guess",71,72,topic_stance_votes_2
