,title,topic,stance,comment,parent_id,comment_id,viewpoint
72,Would you be for two biologically related gay brothers or sisters to marry?,gay marriage,attack,"========================================
""...now that homosexuality is being promoted more liberally than years past...""
Promoted? Interesting alignment there. As if gays are trying to broaden the scope of their lifestyle in numbers? None of the gay people I know are out to change heteros into gays (and none think that is somehow possible to begin with). People don't buy into a gay lifestyle or get talked into it. 
A more common acknowledgement of homosexuality means more people are coming out of the closet because society is allowing this to be done more freely. Its not some sort of gay invasion taking momentum.
MC",72,73,topic_stance_votes_1
73,Would you be for two biologically related gay brothers or sisters to marry?,gay marriage,attack,Okay then what about for the other animals. Are they mostly hetrosexual because they were taught that growing up?,72,74,topic_stance_votes_1
74,Would you be for two biologically related gay brothers or sisters to marry?,gay marriage,attack,"yeah, scombridae, better wording. by 'promote' I mean more openly expressed, not meaning advertising...
yes and no. animals learn by mimicking or they just know by instinct, depending on the animal and environment. it is abundantly clear that humans differ from other animals in that survival and preservation of the species is not the instinctive driving force for humans. humans can choose leisure or entertainment over reproduction and physical health. humans also are capable of being guided by ethics and culture over natural instinct.",73,75,topic_stance_votes_2
75,Would you be for two biologically related gay brothers or sisters to marry?,gay marriage,attack,"Well humans are animals also. And they learn exactly the same way.
But what about the apes for instance. Do you think they learn sex by mimicking or do you think they instinctively know how to have sex?
Survival is not an instinctive force for humans? Sex is not an instinctive force for humans? What planet are you talking about? You couldn’t be more wrong.
Reproduction is entertainment. LOL But seriously humans CAN choose leisure or entertainment over sex but most don’t.
Above you said sex was not an instinctive driving force for humans. So what natural instinct are you referring too?",75,76,topic_stance_votes_1
76,Would you be for two biologically related gay brothers or sisters to marry?,gay marriage,attack,"you are confusing sex with reproduction. sex without reproduction is solely for pleasure, sex with the intent or reproduction is for preservation of species. but sex and reproduction is not interchangable, although they can be, and the same with pleasure. for instance, you said ""reproduction is entertainment"". actually sex is entertaining, childbirth usually isnt. get the picture? and I never said ""sex is not an instinctive force"", I never said that, I said species preservation is not the driving force
anyway, I cant answer for how apes learn about sex, all I can give you is guesses.
I have a question for you: what makes humans prone to commit self-destructive actions (drug abuse, sky-diving, drag racing) knowing fully the potential hazard those actions can have on their personal survival?",76,77,topic_stance_votes_2
77,Would you be for two biologically related gay brothers or sisters to marry?,gay marriage,attack,"Since when did incest, emoticonXConfused , equate homosexuality? Last I checked they were two different words with two different definitions. I laugh at the incompetents convinced that the acceptance of gay relationships will suddenly lead to legalized incest, pedophilia, or animal-human interbreeding. Homosexuality does not lead to the carnal love of one's toaster. I personally know of no gay individual that provoked a desire among their peers to engage in coitus with their pet turtle either. This sort of illogical association is too funny to rationally protest! emoticonXClown",1,78,topic_stance_votes_1
78,Would you be for two biologically related gay brothers or sisters to marry?,gay marriage,attack,"nobody said that incest was the same as homosexuality. however, Im sure you would agree that people in incestuous relationships are being socially pressure similar to the gay community a few years ago. so think about it, an incestuous couple cannot legally get married or benefit from any of the rights that homosexuals are protesting for. yet, like gays, their position is that they are consenting adults that are not hurting anyone by their actions. the sanctioning of gay marriages will very likely open the doors for incest marriage. bestiality commiters will possibly make similar arguments, since their logic is about the same (i.e., not illegal, not hurting anyone else), and there will be no surprise if people could marry their pets in the future.
while nobody equated homosexuality to incest, there are grounds of commonality between the 2, and thats what the discussion was about. I hope you see that",78,79,topic_stance_votes_2
79,Would you be for two biologically related gay brothers or sisters to marry?,gay marriage,attack,"Maybe some of the Homophobes who are in fear of 'brother-sister-', 'animal-human-' or 'plant-stone-' marriages should remember that there is a biological reason why incest is forbidden.
So it is nonsense to see the gay-marriage as a step towards that direction.
Even in liberal European countries where homosexuals are allowed to marry, there aren´t even attempts to allow other forms of marriage; not even marrying 2 or more women.",79,80,topic_stance_votes_1
80,Would you be for two biologically related gay brothers or sisters to marry?,gay marriage,attack,"But bestiality consists of animal cruelty, so very much hurts another. Just not another human.",79,81,topic_stance_votes_1
81,Would you be for two biologically related gay brothers or sisters to marry?,gay marriage,attack,"not necessarily. it is not impossible to think that the animal would enjoy, or learn to enjoy sex with humans. think of male dogs with women (well, you dont really have to think about it if you dont want to :p ), it would be hard to prove that the dog would be under cruelty",81,82,topic_stance_votes_2
82,Would you be for two biologically related gay brothers or sisters to marry?,gay marriage,attack,"emoticonXConfused Did you forget the original post? emoticonXConfused 
In todays world it IS possible, unfortunately...
And if you are FOR gay marriage between two biologically unrelated gay men/women and would be FOR a ban on marriage between two biologically related gay men/women,such as brothers/sister, aunts/nieces, etc... who are you to say anything about someone who wants a ban on gay marriage, like the proposed Constitutional Amendment.
BTW, if you have no problem with gay marriage between two biologically related gay people, then you are sick. 
As well, I hear all the time that what someone does in the privacy of their own homes is their business. Would you agree in the case of two biologically related gay men/women, such as two biologically related gay brothers/sisters who are at the age of consent?
I hope not.
Lets see how many who say that it is discriminatory to ban gay marriage as with the proposed Cons. Amend. will show themselves to be hypocrites by not being for gay marriage with two biologically related gay men/women such as brothers/sisters who are at age of consent....
Lets see how many are sick enough to be FOR marriage between two biologically related gay men/women, such as brothers/sisters, who are at age of consent.
I am consistent. 
I am ONLY for traditional marriage... between a man and a woman.
No gay marriage of any type, thank you.
__________________
How can anyone absolutely know that their actions/lifestyle choice isn't harming/hurting another? 
:p How many people know of someone who is gay that would like the right to marry their partner or a future partner? ______ How many people know of someone who is gay or straight that would like the right to marry their father, mother, sister, brother? _______ Riiiiiiiiiiiiiiiight. emoticonXRolleyes Who thinks these two questions have any link? ____________  :p",79,83,topic_stance_votes_1
83,Would you be for two biologically related gay brothers or sisters to marry?,gay marriage,attack,"you missed the entire point. gay marriage and incestuous marriage can be discussed under the same topic, in the same thread, but that still doesnt equate the 2. anyway, why dont you point out the fundamental differences between gay marriage and homosexual marriage, just in case Im the one thats missing the point...",83,84,topic_stance_votes_2
84,Would you be for two biologically related gay brothers or sisters to marry?,gay marriage,attack,"Then, do you think we should disallow same-sex marriage (i.e. deny gay's their rights) because society may be forced to debate other controversial marriage issues (i.e. incest, animal-human, polygamy etc.) and continue to reshape our definition of it? 
I hope not. Change and redefinition = inevitable.",84,85,topic_stance_votes_1
85,Would you be for two biologically related gay brothers or sisters to marry?,gay marriage,attack,"nothing is being forced. I said the possibility may arise. furthermore I never said disallow gay marriages in the first place. 
what reason is there for a mother and son or 2 sisters not to get married?
and on touching ""gay rights"", nobody is denying gay rights. gays are not being allowed to marry because thats the law, not because anybody is prejudiced or victimizing gays. until the laws change, it will be illegal for gays to marry. gays are making a big issue out of it, when really, they are the ones currently at fault. you cannot disregard a law and then be mad at the legal system for not accomodating you. if the laws change so that gays can get married, then fine. but nobody is denying gays any rights. gays are aware of the laws concerning marriage, yet they want do things contrary to the established legal framework and then cry discrimination when the legal system doesnt accomodate them. thats not how things work. 
I have no problem with gays lobbying to change the laws. thats what your state government is for. but dont go accusing people of discrimination when the gays are deliberately going against the law, and feeling the consequences",85,86,topic_stance_votes_2
