,title,topic,stance,comment,parent_id,comment_id,viewpoint
28,Doctors Vs. Guns,gun control,attack,"And now we see why you are so upset by this fact. 
What is “old enough,” to you? And, (guessing) if 15 isn’t old enough, are you suggesting that no 15 year old should ever be without adult supervision?? No camping trips unless mom and dad come along?? No staying home alone for a few hours while mom and dad go to dinner or a movie? 
I’m glad you weren’t my dad. 
You mention 12 year olds, does this mean you think 13 is old enough to carry a hand-gun? 
1. What state do you live in?
2. Please elaborate on “some surgery.” 
If the doctor’s writing is illegible (as it often is), I think you can. In fact, I deal with illegible writing at the lab everyday! 
Total number of cars on American highways estimated at 123 million 
http://www.recycle-steel.org/cars/autorec.html
Total number of firearms in America estimated at 192 million 
(http://216.239.41.104/search?q=cache...n&ie=UTF-8</a>
So? Now its your turn to think about how many cars drive on American roads in one year.
Look, life isn’t fair. Bad things happen to good people every day. There is no law you can pass to change that. When you say “Any preventable accidental death of a child should be considered a problem. (or of an adult for that matter).” 
I disagree. We should look at the rate of incidence and remember that there is NOTHING we can do to bring the rate down to zero. In the end, every year somebody is going to die playing dodge ball. Someone will die in a car accident. Someone will die in a plane crash. The only way to reduce these rates to zero is to do away with cars, guns, planes and everything else. 
Life is dangerous. It can kill you. 
?? 
Let’s recap (paraphrasing):
Hellhound says “Hey look, more people are *accidentally* killed by doctors than guns.”
You say “ No way! Lots of sick people who are dying anyway die in hospitals.”
I point out ”Sick people who are dying anyway do not contribute to the ‘medical misadventure’ statistic.”
You come back and say “I know more about medical forms than you!”
So I ask “If that’s the case, why do you want to throw rightfully dead people in with the ‘medical misadventure’ statistic? Don’t you know better than that?” 
You return and say that I am misrepresenting what you say?? 
I think you are getting too worked up about this. Take a deep breath, relax and accept the fact that more people die due to medical misadventure than accidents with firearms. And there are a LOT more firearms than doctors in America (just like cars). 
It does.
When I was 12, I knew how to be safe with a firearm. If a 12 year old is so stupid that he accidentally shoots one of his friends, I want him off the streets and under government supervision. Because, in few years, he’s going to be driving a car. A few years after that he’ll be voting! Better to get the stupid genes out of the pool at the first sign of trouble, rather than wait until he’s an adult and having an even bigger negative impact on society. As for his victim, well, it’s sad, but that’s life. Stupid people do stupid things with guns (and cars, and health care).
Furthermore, When my friend Vinny was 14, a burglar broke into his house while his parents were away. Vinny shot the intruder dead in his living room with his dad’s revolver. 
It’s survival of the fittest no matter how you look at it.",26,29,topic_stance_votes_2
29,Doctors Vs. Guns,gun control,support,"Why not include the adults? That’s what we are arguing about. The statistics Hellhound posted are derived from the entire population, not a remarkably healthy and typically foolish subset (young people). Are you trying to change your argument? 
No I don’t notice that. Are you privy to the rates of the total population with all ages? 
Lots of things can be rightfully said about the numbers, but that isn’t one of them. It is misleading at best. 
No. They portray guns in such a way as to make people like you think accidental death by firearm is an epidemic. It isn’t.",29,30,topic_stance_votes_2
30,Doctors Vs. Guns,gun control,attack,"If you take notice, I did show the statistics for all ages in the previous posting. 
It's all posted right there for you to read. Taken from a link posted by Kelvin and Rev. O are you ignoring the information you don't want to see. Or perhaps you are incapable of interpreting data?
Again, it is a fact supported by the statistics that I posted.
I guess it depends on your point of view. Perhaps it is not an epidemic to you, but to the parents who have lost children due to accidental shootings, it may very well be. Ask one of them about their point of view. Or perhaps they will just agree with you that s&*! happens and that's just life.",30,31,topic_stance_votes_1
31,Doctors Vs. Guns,gun control,attack,"If you deal with it every day, then you should know that if you cannot clearly understand, then you clarify. Same goes for nurses, if a nurse cannot clearly read a script or order, they clarify it. If they don't clarify it and guess, you cannot hold the doctor responsible. This is one of the most basic rules in health care. They teach this to first year nursing students on their very first nursing class. 
That's great. You say ""well, we can't completely eliminate the problem, so let's do nothing."" 
Some people have this funny notion that if we do everything we can to reduce the problem, then we have taken a positive step. We will never completely resolve the problem, but preventing even one accidental death is worth the effort. Imagine if the aviation industry operated like that. ""well, we can't stop all accidents, so let's do nothing and hope for the best."" Don't you want every possible step taken to assure that you are safe the next time you fly on a plane?",30,32,topic_stance_votes_1
32,Doctors Vs. Guns,gun control,attack,"Ok, something strange is going on. I got an e-mail from these boards saying that you replied with things like
This is NOT the same post you left on the bottom of Page 2 of this discussion, and it is not the post I was responding to. 
The post on page 2 contains incomplete data, none of these comments, and no hyper link to the CDC. 
I don't know how that happend. 
I'm glad you agree. 
I'm not suggesting attacking the other problems, I'm saying the problem with guns is a false idea perpetuated by the media and politicians. It pales in comparrison to other problems that we happily live with every day. 
Notice that the original message inthis thread compares the rate of death by medical misadventure per doctor with the rate of death by firearm per *registerd firearm owner.* That's how the statistic (9,000 times more deadly) is arrived at. Its not a depiction of guns Vs Doctors, rather Doctors Vs registered gun owners.
Edit: Your post on the bottom of page 2 now appears with the links and these comments. THe incomplete post seems to still be there too.",32,33,topic_stance_votes_2
33,Doctors Vs. Guns,gun control,attack,"I show it as post 27 for all age groups, and post 28 showing only children. I don't know what happened on your end, but these 2 are what I posted. 
It says firearm owner, not registered firearm owner. And who are registered firearm owners, define this? Anyway, where does the figure 120,000 deaths due to medical misadventure come from? I got 776 accidental gun deaths per year from the CDC web link. The same source says 2804 medical care deaths per year, approximately 4x the number of gun deaths. How do you get 9000x out of these figures?",33,34,topic_stance_votes_1
34,Doctors Vs. Guns,gun control,attack,"I do see that now, with the helpful link to the CDC. But using your logic, we should make laws that keep old people out of the hospital because they are more likly to die of medical misadventure than young people! 
And again, why are you trying to shift the argument to children, when the original post regarded all people? 
Fine, you're right. It says ""firearm owner"" not ""registerd firearm owner."" Way to pick those nits! 
That's a good question. Maybe we should fnd the person who's posting that all over the internet and ask them. 
Me too. Seems 120,000 is not accurate. 
Remember, there are the figures: 
You can bother checking the math if you want. I was only quoting the original source as saying that ""doctors are approximately 9,000 times more dangerous than gun owners"" 
You seem to want to argue that doctors are only 4 times as dangerous as guns. And I'm not going to dispute that. But the original point was a comparison between gun owners and doctors, not guns and doctors.",34,35,topic_stance_votes_2
35,Doctors Vs. Guns,gun control,attack,"Can anyone point me to the original source of this information, or show me the original documentation which concluded these statistics? I have done much research in attempt to find it, and have turned up nothing except a bunch of people spouting off the same erronious numbers without the original source documented.",1,36,topic_stance_votes_1
36,Doctors Vs. Guns,gun control,attack,"No, we should work to eliminate or reduce the incidence of medical misadventure for all ages. Same as the incidence of accidental gun deaths.
I am not trying to shift the argument, I am merely posting the facts, and pointing out statistical curves defined by age. I posted for both children and all ages. I just found it interesting that the statistics showed that children were more likely to die by accidental gun death than adults. 
Good idea. I would think that if someone was going to post obscure figures that they would at least attempt to validate them first. My argument and more importantly the CDC statistics disprove these numbers without doubt. Perpetuating these misleading numbers does nothing but discredit the poster. 
But Rev is not the original source, he saw it on the internet, probably from someone else who saw it on the internet who saw internet...etc...
My question is where are the original numbers, who is the author, show me the validation of the study.",35,37,topic_stance_votes_1
37,Doctors Vs. Guns,gun control,support,"And should the study be gun owners vs. doctors, or gun owners vs. doctor owners (ie. patients)? There are many more patients than doctors. Also, many of the people killed accidentally by guns are not the actual gun owners. This may seem like more nitpicking to you, but it goes to the heart of the credibility of the statistics posted. Out of the research I did trying to find the source, I did find one commonly repeated statement: That the author included abortions among the deaths caused by physician. I don't know the validity of this information either, but it could possibly explain the inflated numbers. Without true documentation however, I don't consider any of it to be valid.",37,38,topic_stance_votes_1
38,Doctors Vs. Guns,gun control,attack,"Sure. But we also need to keep weapons available to law-biding citizens who may need them. Although the occasions of accidents and misuse of firearms are horrific, the benefit outweighs the cost. 
I wouldn't be so quick to claim victory. Even you now admit that doctors are roughly 4x more dangerous than guns, which is not what you were arguing on page 1 when you said
I know that. I wasn't insinuating that he was the source. I've seen that statistic all over the net for a couple of years now. I've never seen a source for it. However, I also know that doctors are more dangerous than guns. I have verified that in a number of places before having this discussion, because it seemed so outlandish to me the first two times I heard it I, like you, refused to believe it. Only after doing a little research did I come to see it was true. Dr. Akermann's discussion was one of the things that finally convinced me. 
I doubt you'll have much luck there. You'd be better off re-doing the research yourself (we've already done most of it, we just need to know how many gun owners and doctors there are) and doing the same statistical analysis. 
It won't come out to 9000x but it will still say the same thing (doctors are more dangerous than gun owners)",37,39,topic_stance_votes_2
39,Doctors Vs. Guns,gun control,support,Now you're just being silly.,39,40,topic_stance_votes_2
40,Doctors Vs. Guns,gun control,attack,"No, not really, if you think about it.
I agree with the first part. However, is there a way to do this and at the same time decrease the amount of accidental shootings that occur...I think there is. 
My argument and the CDC numbers shot down the initial thread, however, I did not agree doctors were more dangerous than guns. I agree that there are more ""medical misadventures"" than accidental shootings per year, which as you pointed out is a mistake by a professional health care provider leading to the death of a patient. This includes nurses, doctors, PA's, technicians, respiratory therapists, and everyone else involved in direct patient care, and even some not directly involved, such as pharmacists and laboratory workers. Now if you include all of these people in the medical misadventure category, then I would wager that there are more professional health care workers than just doctors alone as the thread suggests, and therefore a higher rate of medical misadventure vs. accidental shooting is logical. And I think the other important thing to remember is, how many people have access firearms per year, vs. how many people access health care per year. If you find that these there is more access to health care by a population than access to guns, it is only logical that the number of medical misadventures is higher than accidental shootings. This is what I meant by ""doctor owners"". 
I would still say this is a false statement. Perhaps if you said the health care system is more dangerous than gun owners, maybe. But like I pointed out above, there are many more health care workers responsible for medical misadventures than just doctors. Let me try to get those numbers.",40,41,topic_stance_votes_1
41,Doctors Vs. Guns,gun control,attack,"How many of these accidental deaths were due to gun malfunctions? How many were due to operator error? how many were due to rangemaster error, finally how many were due to mechanical falure.
Your counter logic has...... FAILED
I point this out because YOU pilot are championing the causes of further erosion of our second amendment rights. I am pointing this out Pilot beacuse you are throwing stones in a glass house. I am pointing this out Pilot because with only a minimal number of accidental deaths by handgun this is a non issue that you Pilot are talking about like it is a plague epidemic.",26,42,topic_stance_votes_2
42,Doctors Vs. Guns,gun control,support,Don't forget that more people die in plane crashes than by accidental shootings!!!,29,43,topic_stance_votes_2
43,Doctors Vs. Guns,gun control,attack,"http://www.hepcsolutions.com/interac...feb16-2003.htm
I just punched in Accidental deaths caused by physicians per year are 120,000 into google.... Origional source is Statistics from the U.S. Dept. of Health. Did ya think of trying that?",36,44,topic_stance_votes_2
44,Doctors Vs. Guns,gun control,attack,That is not the US department of health and human services website. The US DHHS is only listed as the source of the information. Looking this up reveals no such information.,44,45,topic_stance_votes_1
45,Doctors Vs. Guns,gun control,attack,"http://www.anxieties.com/index.php?nic=flying-howsafe 
Please check out the link. I hope you enjoy it, especially towards the bottom on the graph that shows numbers of death per year on commercial flights as compared to accidental shootings. What's a matter Rev? Someone proved your original statement false with proper documentation and you feel you now have to attack tham from another angle? Get over it. And also, while I am at it, here is another interesting statistic for you. 
According to the National Ambulatory Medical Care Survey of 2000, done by the National Center for Health Statistics (NCHS), there were 823.5 million visits by patients to doctors offices in the year 2000. This does not include emergency department, access to emergency medical services outside the hospital, or inpatient services. I do not yet have the stats for these, but I'm sure the number would go closer to 1.5 billion. There are how many gun owners in the US? If you look at the total number of visits to health care professionals and the extremely low incidence of ""medical misadventures"" per patient visit, you come to the conclusion that perhaps your whole argument may need to be re-tooled.
www.cdc.gov/nchs/releases/02news/physician.htm",43,46,topic_stance_votes_1
46,Doctors Vs. Guns,gun control,attack,"RIGHT UNDER THE STATISTICS THEY GIVE YOU THE SOURCE! Do they give pilots a vision test? jeesh.....
You humor me.",45,47,topic_stance_votes_2
47,Doctors Vs. Guns,gun control,attack,"***YAWN**** 
Take out plane crashes and you get 100 who died aboard plane crashes. You proved nothing false. Being a blind pilot does not prove me false!
Oh its per patient now.. well there are 300 MILLION guns in the US and 800 or so accidental deaths.....
Still pilots kill more people than accidental shootings!",46,48,topic_stance_votes_2
48,Doctors Vs. Guns,gun control,support,"If you are going to talk about every single time someone visits a doctor, than you have to compare that to every single time someone pulls a trigger. 
I actually saw the statistic for how many rounds are fired in 1 year in the US. It was on the History channel, on a show about bullets. I can't remember the number now. Maybe you can find it in your research? I'm sure it exceeds the total number of doctor visits. 
After all, a single automatic weapon can fire hundreds, or even thousands of rounds a minute! How many doctors work that fast? And with such precision and low rate of error?",48,49,topic_stance_votes_2
49,Doctors Vs. Guns,gun control,support,"First, do you think it is easier for the average american to get health care or get a gun? 
Second, if health care is more likely to cause you to die via accident, why do the people on the left always cry about how we have insufficient access to health care and too many guns?? 
Do they have an ulterior motive? 
Clearly, to make society safer, we should restrict access to health care and have the government subsidize gun ownership!
(that would actually be more in line with our rights, by the way)",49,50,topic_stance_votes_2
50,Doctors Vs. Guns,gun control,attack,"I looked all through the US DHHS site, and did several searches. Even so, I doubt it would be found there, as they provide the statistics for the CDC, and I have already showed you the CDC statistics. Can you read?",47,51,topic_stance_votes_1
51,Doctors Vs. Guns,gun control,attack,"It is probably easier to get a gun, do you know the answer to this question? Many Americans cannot afford health care, many do not have insurance, and therefore do not seek healthcare or delay seeking health care. Many recieve substandard health care because of location or local resources. 
Personally, I don't care what the people on the left or on the right cry about. They mean very little to me, as does the entire governmental system in this country. And as far as ulterior motive, just about everyone has some sort of agenda or motive fueling their actions. 
Make society safer by restricting access to health care and have governmental subsidation of guns. Wow, that's a great idea... emoticonXRolleyes
With irrational logic such as yours, no wonder people want to violate and take away your rights. Your ideas are dangerous, absurd, and extreme.",50,52,topic_stance_votes_1
52,Doctors Vs. Guns,gun control,support,"A good friend died of cancer last April. During her treatment her husband became a self taught cancer specialist by reading every scientific article he could get his hands on. She was at one of the best cancer treatment specialist hospitals in the state.
1) She was nearly killed on 2 seperate times by given the wrong chemo. On the third seperate time before receiving the chemo he asked the make sure she was not getting a particular drug. On the last minute the doctor took the chart turned his back and scratched out a line on the chart. Yes he was about to give her the wrong drug again.
2) She was almost overdosed on radiation. Her husband caught a wrong calculation to set the radiation. The calcuation had to be done by 3 seperate people 1) attending doctor 2) the nurse 3) the radiation specialist. All of them got it wrong.
3) On another occasion the doctor recommend a course or gene therapy. When 3 years ago he wrote a paper that proved the ineffectiveness of the treatment for this particular cancer.
This happens all time time to people who do not ask critical questions.
The purpose of this? YOU are the last person responsible for YOUR own health and saftey. You can sue the cops and the doctors all you want. It does not matter to make someone fess up to failure to protect your health and saftey after your dead.",50,53,topic_stance_votes_2
53,Doctors Vs. Guns,gun control,attack,"In that case, you would have to compare the number of bullets fired to the total number of health care encounters. So, if a nurse walks into the room, that is an encounter. If she leaves and comes back, encounter # 2. Do you see the point here? It is a bogus comparison to compare gun owners to doctors in the first place. The numbers cannot be made into a fair side by side comparison. The only thing I was out to do in this thread is disprove the BS theory that doctors are 9000x more dangerous than guns, and to find some real statistics to back it up. I have done that, and I guess I should thank Kelvin and Rev for the links they provided for me, as they proved my case.",49,54,topic_stance_votes_1
54,Doctors Vs. Guns,gun control,attack,i dont believe you,1,55,topic_stance_votes_1
55,Doctors Vs. Guns,gun control,attack,"Thats nice. How's those ""32"" guns you ""own"" and hows your ""training"" going.
Funny though how you can believe or not believe a question....",55,56,topic_stance_votes_2
56,Doctors Vs. Guns,gun control,attack,"Actually, he said he didn't believe you. Come to think of it, I don't believe he has 32 guns either.",56,57,topic_stance_votes_1
57,Doctors Vs. Guns,gun control,attack,"Before you were comparing doctors to the 80 million gun owners. Now you're comparing doctors to 300 million guns. At least be consistent.There are about 25,000 gun deaths each year in the US, but you seem to prefer to focus only on accidental gun deaths. I believe this is just an attempt to rationalize away the problems that America has with gun violence. 
Here's a question for you and others that believe that doctors are more dangerous than guns. Suppose you are very sick and that you have to decide between visiting a doctor or buying a gun. Which choice will you make? I'd visit a doctor, but I want to see if you will do more than just pay lip service to your ideas.",48,58,topic_stance_votes_1
58,Doctors Vs. Guns,gun control,support,"I'd be doubly suspicious about Hellhound and Kelvin's stats as they are very dubious.
Earlier it was claimed that since my nation's tougher gun-laws, gun-reated deaths had sky-rocketed here in Australia... their source was quoting figures made up who know where.",58,59,topic_stance_votes_1
59,Doctors Vs. Guns,gun control,attack,"Please specify which stats are dubious and why? My source is the Center for Disease Control. Which is obviously a rabid anti-gun institution. My claim is more infants are going to die in open toilets and buckets of water than from accidental deaths from firearms.
Why is the Center for Disease Control dubious?
Accidental water injuries (including buckets and toilets) for ages 0-4 in 2000 are:
568
Accidental injuries for ages 0-4 in 2000 are:
19
http://webapp.cdc.gov/sasweb/ncipc/mortrate10.html
A common way infants die is they fall head first into a bucket and drown:
""Nine-month-old Oscar Geraldo Flores is the second child to drown in a bucket in a week"" - http://www.lifesaving.com/news/news_articles/news62.htm",59,60,topic_stance_votes_2
60,Doctors Vs. Guns,gun control,attack,"And what exactly is your point? Again, you cannot make a side by side comparison of anything other than raw numbers. You must look at exposure. How many households that have guns are there in this country that a 0-4 y/o could access? Now, for a fair comparison, how many households in this country have toilets, buckets of water, pools, bathtubs, sinks, puddles outside, streams, rivers, lakes, ponds, oceans, cesspools, septic tanks etc... that a 0-4 y/o could access.",60,61,topic_stance_votes_1
61,Doctors Vs. Guns,gun control,attack,"The point? Guns are dangerous. They are not as dangerous as you think they are.
How many guns in this country vs sources of water you stated? The water outnumbers the guns, yet there are fewer gun deaths aren't there?",61,62,topic_stance_votes_2
62,Doctors Vs. Guns,gun control,support,"Hey Montaban:
Can you please help me find any dubious CDC stats? I really hate it when researchers try to present bogus scientific information. I need the specifics, I plan to write to the CDC and complain about thier dubious stats.
Thanks in advance.",62,63,topic_stance_votes_2
63,Doctors Vs. Guns,gun control,support,A good point. What is more dangerous per minute of exposure? I'm exposed much more often to water than guns. But if you still insist on looking at raw numbers then compare the number of homicides committed with water to the number of homicides committed with firearms.,61,64,topic_stance_votes_1
