,title,topic,stance,comment,parent_id,comment_id,viewpoint
0,Doctors Vs. Guns,gun control,support,"Number of physicians in the U.S...........................................700, 000
Accidental deaths caused by physicians per year...............120,000
Accidental deaths per physician...........................0.171
Number of gun owners in the U.S. ................................ 80,000,000
Number of accidental gun deaths per year (all age groups)......1,500
Accidental deaths per gun owner..................................0.0000188
Therefore, doctors are approximately 9,000 times more dangerous than gun owners!!!!!!!!!!!!!!!!
Taken from the Internet.
Should we ban doctors?",0,1,topic_stance_votes_2
1,Doctors Vs. Guns,gun control,attack,"What is the source of this? How do they define accidental gun death and accidental physicians death?
Using your logic you may indicate that we should eliminate cars, food, heating/cooling systems, chairs, stairs, houses, apartments, work, money, paper, plastic, and basically everything that we have on earth because somewhere people are going to die because of almost everything. You have to look at risk-reward.
Is there a greater risk to having doctors than there is reward? Clearly the answer is no, there is not a greater risk than reward to doctors. Is there a greater risk to having guns than there is reward? This is debatable as Japanise and US data will show you. One country has a ton of guns and a ton of gun deaths while the other has few guns and few gun deaths. There are of course other risks outside of just deaths as well as many rewards outside of just protection from death when it comes to the gun debate. Still I don't think we have a defined answer as to what amount of gun freedoms allows for the best risk-reward ratio and I find it highly unlikely that total gun freedoms allows for maximum risk-reward benefits.",1,2,topic_stance_votes_1
2,Doctors Vs. Guns,gun control,attack,"You forget, that all those nice rewards? None of them are rights.",2,3,topic_stance_votes_2
3,Doctors Vs. Guns,gun control,support,"Personally Rev. my favorite is:
More infants are going to die in a bucket of water and open toilets this year than accidental death from firearms.
http://webapp.cdc.gov/sasweb/ncipc/mortrate10.html",1,4,topic_stance_votes_2
4,Doctors Vs. Guns,gun control,support,You would have to include non-accidental deaths and consider how many patients doctors treat or how many times guns are used.,1,5,topic_stance_votes_2
5,Doctors Vs. Guns,gun control,attack,"Uhh... thats your logic... As Kelvin says (and you too)Ban cars, toilets, now doctors, before you ban guns.
Tell those Jews in the Warsaw Ghetto about ""risk/reward"" of guns Vs. Doctors.",2,6,topic_stance_votes_2
6,Doctors Vs. Guns,gun control,attack,"That isn't my logic. My logic states that banning doctors would cause more deaths and our current system does. You are trying to debate that doctors are threatening withour realizing that they have great rewards as well. My logic is to look for the risk and reward and not just focus on one side of the debate.
Your logic was that since doctors cause deaths then they should be banned if guns are, correct? Then why isn't it also consistant with your logic to believe that we should ban food since food causes deaths?
So lets clairfy here, do you believe that guns have a better risk/reward than doctors? If you HAD to ban one which would it be? I await your sidestep of the question.
lol, now your comparing the Jews to current US gun issues? Why did you choose to do this? The risk-reward for Jews is different than the risk-reward for the US. Jews probably would have faired better if the Germans used Japanise gun control laws.",6,7,topic_stance_votes_1
7,Doctors Vs. Guns,gun control,attack,The whole argument is weak unless gun control advocates are only pressing the issue due to accidental deaths.,7,8,topic_stance_votes_2
8,Doctors Vs. Guns,gun control,attack,"Proving logic to ban an item is not the point. The above statistics show what the real risk from firearms really is compared to common items. Don't believe anti-gunners if they say that guns are such an incredibly dangerous object that ""normal"" people should not have them.
You want to know the reward from guns are? One of them is protecting democracy. Is democracy a good enough reward for you?",7,9,topic_stance_votes_2
9,Doctors Vs. Guns,gun control,support,"It is a widely known fact. A simple search on Google will turn up hundreds of articles, reports and so on. 
Dr Michael Ackermann has a great deal of specific information (although he is Canadian, he research applies to the U.S. too)
http://www.dsgl.org/Articles/Ackermann.htm
He has a complete list of references and links to other sources on that page. A good one is here: 
teapot.usask.ca/cdn-firearms/Suter/med-lit.html
No. The point is that doctors are more dangerous than guns, highlighting the stupidity of the anti-gun crowed who believe that guns should be outlawed because they are “dangerous.”
Furthermore, if we wanted to include deliberate killing, we would have to include doctors who deliberately kill. And we would have to point out that many people who are killed with guns - should be killed (violent criminals, for example). 
A few other education links are here: 
http://www.aapsonline.org/press/medsentgun.htm
http://teapot.usask.ca/cdn-firearms/...n/doctors.html
Yes. But guns are about more than safety. 
A well-regulated Militia being necessary to the security of a free State, the right of the people to keep and bear Arms shall not be infringed.",9,10,topic_stance_votes_2
10,Doctors Vs. Guns,gun control,attack,"The point that doctors are more dangerous than guns is absolutely rediculous. First off, I seriously doubt the validity of the study supporting the argument. And let me ask, how do you define ""accidental death caused by a doctor"". Accidental death with a gun is rather easy to define. Accidental death by doctor seems rather broad to me. How many of these ""accidental deaths"" were actually caused by a nurse who gave the wrong medication, an x-ray tech who did not hook the patient back up to oxygen for the trip downstairs, or just a sick patient that died? People die in the hospital every day, and some people seem to think that if someone dies in the hospital they must have been killed by some retarded doctor. The fact remains that sick people go to the hospital, sick people die, sick people die in the hospital. I agree that guns save lives in some situations, but they also can take lives, ie...accidental shootings of children, suicides, etc. I don't think this means the answer is to ban guns, but perhaps provide stiffer penalties to those who make the gun available to the kid who accidentally shot his brother, or the 13 y/o who put a tunnel through his head after finding dads revolver. Banning guns or doctors is irrational. But saying doctors are more dangerous to guns is also irrational. If you want people to take your arguments seriously, then make a logical argument.",10,11,topic_stance_votes_1
11,Doctors Vs. Guns,gun control,attack,"Then you have your head in the sand. You need to wake up a realize that there are facts out there that you don't like to hear. 
The clinical term is ""Medical Misadventure."" It is defined as ""Medical misadventure is a personal injury resulting from treatment by a registered health professional, or in limited circumstances an organisation. ""
No. 
When someone dies in the Hospital, their care givers must fill out forms detailing the Cause of Death. If someone dies because they are sick, they didn't die because of ""medical misadventure."" 
""medical Misadventure"" means the doctor made a mistake that caused a person to die who would have lived otherwise. 
Next time, try reading some of the links I posted in my last message before you say something stupid again. 
Ah, yes, the CHILDREN.
Newsflash: Most suicides don't kill themseves with guns. Again read some of the links I posted above. Furthermore, if guns were banned, suicidal people would just use other means to kill themselves. Witness Japan. THey have some of the strongest anti-gun laws in the world, but their suicide rate is the highest in the world. 
Oh, please. Give it a rest. 
No, it is a statement of fact. You are being irrational by denying it. Note that even Doctors themselves don't refute that claim. Again, see my link to Dr. Ackermann's discussion about guns. 
If you want to have an intelligent conversation, you ned to educate yourself first.",11,12,topic_stance_votes_2
12,Doctors Vs. Guns,gun control,attack,"WON""T SOMEBODY PULEEEZE THINK ABOUT THE CHILDEREN! emoticonXBanghead 
Sundowner.... Instead of a media propaganda blitz that guns are bad, Guns kill children, and the other XXXX..... Why not teach your childeren about guns. Teach them the proper use, the rules of saftey... Children stay off of railroad tracks, they don't stick thier fingers in light sockets that often, don't see a bridge and jump. Don't play in traffic.
Tha 13 year old shoul never habe ""found"" that revolver in the first place. He should have known where it was how it worked and by the age of 13 should have been an expert marksman. 
Are you advocating that manufactures should be held responsible?
MOLON LABE!",11,13,topic_stance_votes_2
13,Doctors Vs. Guns,gun control,attack,"The links are right there for you. They all say they same thing. More people are killed by accident from doctors than guns.
Don't believe anyone here? Then believe the experts and reporters on those links.
Your living in the dark ages. Believe what you can prove, not what you think you know.",11,14,topic_stance_votes_2
14,Doctors Vs. Guns,gun control,attack,"Is it registered health professional or doctor? and ""limited circumstances by an organization""...what does this mean? A registered health professional can be a nurse, and x-ray tech, a physical therapist, a speech pathologist, a paramedic, a lab tech, etc... Lets try getting your cows over their buckets. 
Do you work in one? What are the forms called. Can you link one of these forms to me? The only ""forms"" that a filled out are the death certificate (which is filled out for everyone) and the nursing notes. Are these the ""forms"" you talk of?
Again, is it doctor or registered health professional? Big difference. 
What, like the doctors for sensible gun control article? That was just laughable. I will disect that for you later today. 
Yes...the children. Do you see it as a problem that a 4 y/o finds a gun and shoots his 3 y/o sister? I do. Even if it only happens 1 time a year. It is a preventable death. 
Give what a rest? Suggesting stronger penalties for irresponsible adults who leave a gun laying out on the coffee table? Blaming parents for the preventable actions of children too young to know the consequences? Talk about putting your head in the sand. Do you honestly believe that no children are killed by accidental shootings? Do you think that a parent has never left a gun loaded and unlocked where a kid can find it and accidentally shoot himself or someone else? Or does this not bother you? I have not even suggested banning guns, just stronger penalties for XXXXXX. 
You seem to have a problem deciding whether it is doctors or registered health professionals. How can I accept this as fact if you don't even have the basics down? 
Likewise, and don't call me Ned.",14,15,topic_stance_votes_1
15,Doctors Vs. Guns,gun control,attack,"I wonder who killed more people accidentally... Pilots or people accidently shooting someone else?
hmmm.....
emoticonXGood",15,16,topic_stance_votes_2
16,Doctors Vs. Guns,gun control,attack,"Wow, how can I possibly argue with logic like that. You got me, I have been wrong about everything. Thank you for showing me the error in my ways with your superior logic and reasoning.",16,17,topic_stance_votes_1
17,Doctors Vs. Guns,gun control,support,"I never said guns are bad. In fact, I said guns save lives when used properly in the right situations. I agree to teach children about guns and their proper use, but I do not agree with leaving a loaded gun out in the open where a kid can grab it and have an accident with it. It does happen, and can be prevented. Children do need to learn gun safety as I and I am sure you did as well, but there is a difference between a 12 y/o using a gun with supervision and a 4 y/o picking up a revolver. In one case the parents should be praised for their willingness to teach their children safety and responsibility, in the other, the parents should go to jail. 
How many 13 y/o kids do you think have the maturity to be trusted with a gun when left alone? I am sure there are many who are, but also many who are not. We don't let kids dirve cars until they are 16 and get proper training, perhaps an age limit and training requirement for unsupervised gun use?
Hell no. They did nothing wrong. I do hold the parents and legal gun owners responsible when one of these accidental shootings occurs though. I call for tough penalties for them. Is this wrong?",15,18,topic_stance_votes_1
18,Doctors Vs. Guns,gun control,attack,"Actually, I do work in the health care industry (clinical laboratory testing). No, I don’t actually work in a hospital. 
First of all, if you know so much about it, why did you say “People die in the hospital every day… they must have been killed by some retarded doctor. The fact remains that sick people go to the hospital, sick people die, sick people die in the hospital.“
Secondly, you clearly don’t know that much about it because now you say “The only ""forms"" that a filled out are the death certificate (which is filled out for everyone) and the nursing notes.” What about the insurance forms? The test requisitions that are sent to the lab? The results from the lab that are sent back? The Pathology report? I think there are more forms than you know about. When was the last time you died in the hospital and took note of all the forms associated with your passing? 
The point is, a distinction is drawn between medical misadventure and other causes of death. Call the “forms” that information is documented on whatever you like. 
No problem at all. It’s Darwinism at its best! 
Because it is such a HUGE problem, right? 
We do that already. 
No I don’t. Do you honestly believe I said such as thing? 
Do you honestly believe that no children are killed by accidental medical care? 
Do you think a child’s inability to get a gun in a time of need has never resulted in innocent death? Or does this not bother you? 
You seem to have a problem with repeating that question. When you calm down, I’ll answer it.",15,19,topic_stance_votes_2
19,Doctors Vs. Guns,gun control,support,"I like Sundowner's thought of an age limit, like with a car. ""Gun Control"" in Canada is a joke. The leader of the Hell's Angels registered his guns. The program has costed over a billion and is constantly over budget. It actually makes it harder for people buying legally, while the black market is unaffected. Just the sort of thing to make you lose faith in your leader.",19,20,topic_stance_votes_2
20,Doctors Vs. Guns,gun control,support,"Well, whether you have calmed down or not, I’ll address your neurotic nit picking. 
.
First of all, doctors are responsible for the care that is meted out under their supervision. Secondly, I struggle to imagine someone being killed by a session gone awry with a speech pathologist, or an x-ray teche.
Furthermore, the definition of “medical misadventure” that I posted above is only the first one I found with a search on google. I didn’t look further because I could tell it was a concept you had never heard of before. This definition: 
“Any type of medical error such as surgical or medication mistakes.“
Taken from wrongdiagnosis.com (http://www.wrongdiagnosis.com/m/medi...ture/intro.htm)
Makes your entire “point” pointless, as only doctors can prescribe medication or perform surgery. 
There may be other definitions out there. I’m not a doctor, so I don’t know. 
Uh, I would guess that in some limited circumstances, organizations can be held responsible for medical misadventure. 
Look, rather than arguing the nuances of dying in a hospital, I can say any number of other things that make the same point. Try this on for size:
According to the NHTSA
http://www-fars.nhtsa.dot.gov/
37,862 people died on the nation’s highways in 2001
37,526 people died on the nation’s highways in 2000
According to the CDC,
http://www.cdc.gov/nchs/releases/02facts/final2000.htm
and 
http://www.cdc.gov/nchs/releases/03f...litytables.htm
A total of 28,840 people died from firearms in 2001 
A total of 28,663 people died from firearms in 2000. 
This data suggests that roughly 10,000 more people are killed every year by cars than by guns! Considering the fact that most of the highway deaths were accidents, and most of the guns deaths were deliberate (shooting apparent criminals), why aren’t you trying to do something about all the accidental deaths on the highways? Don’t you think we should have stricter laws about who can own a car? 
What about those 14 year old kids who take their dad’s car out for a joy-ride and end up killing someone in a stupid accident?? Or does that not bother you? 
The ""problem"" with guns in America is the way they are portrayed by the media and the politicians. 
You know, ""I'm not trying to take guns away from hunters and sportsmen."" and all that....",20,21,topic_stance_votes_2
21,Doctors Vs. Guns,gun control,attack,"No, actually what I said was:
People die in the hospital every day, and some people seem to think that if someone dies in the hospital they must have been killed by some retarded doctor. The fact remains that sick people go to the hospital, sick people die, sick people die in the hospital.
Don't try to misrepresent what I have said.
You said ""forms detailing the cause of death"". Better yet, ask me when the last time I was in the hospital and took care of someone until they died. Ask me how many ""forms"" I filled out. The only medical form listing the official cause of death is the death certificate, which is signed by either the doctor or the coroner / medical examiner. 
Good, then there will be documentation on ""medical misadventures"". Perhaps like the first link provided by rev? Maybe the WISQARS Injury Mortality Report? We will get to that later.
This has nothing to do with natural selection.",21,22,topic_stance_votes_1
22,Doctors Vs. Guns,gun control,attack,"Hmm seems like your pilot ego is bruised... Well lets see now.... 
In 2002 There were 1228 total lives lost at the hands of pilots.... 
Table 1. Accidents, Fatalities, and Rates, 2002 Preliminary Statistics 
U.S. Aviation 
Compared to:
In 2001 (closest year I could find) there were 802 deaths by accidental shootings. 
Injury Mortality Reports, 2000 - 2001
So yes... The answer is yes pilots are more dangerous than people accidentally shooting you. 
Pilots are more accident prone than guns!
Planes don't kill people, pilots kill people!",17,23,topic_stance_votes_2
23,Doctors Vs. Guns,gun control,support,"Any preventable accidental death of a child should be considered a problem. (or of an adult for that matter). 
Accidental medical care? Or do you mean a medical mistake? Yes, children are killed by medical mistakes. 
If they are not old enough to handle the gun responsibly, they should not be left alone in the first place. Perhaps if people feel this way, they should only employ a babysitter who has access to the family gun and training on how to use it. If they are old enough and mature enough to be left alone with the gun, no problem. But it seems extreme to say that all 12 y/o's should have access to the loaded .45 in the drawer. 
No, I had no problem repeating it. And perhaps I did so because it needed answered.",22,24,topic_stance_votes_1
24,Doctors Vs. Guns,gun control,support,"You assume a lot. Do you think it is possible that I have been trained and may have worked in the healthcare system? Do you think it is possible that I still do on a part time basis? 
Not really, because more people are involved in the surgery than just doctors. PA's can also do some surgery. They are not doctors. And as far as medications, yes, sometimes the wrong medications are prescribed, but many times, medication errors occur in pharmacy, or the nurse gives the wrong drug, wrong dose, wrong route...etc. You cannot blame a doctor for writing an order for plavix and the nurse giving lasix. 
So? Think about how many cars drive on american roads in one year. And what is the point in comparing them anyway? It seems you are so blinded by your hatred of anyone who even suggests that there may be some problem with guns, and that simple legislation or preventative measures may stop this, that you point out anything else that makes it look trivial, or anything that will take attention away from the problem. Face all of these problems, and address them all...or are you just too blinded by hatred of the ""anti-gun"" movement? 
Lock them up, Punish them. Lock their parents up for allowing them to illegally take the car. Punish the parents for allowing it to be possible. Yes, it bothers me. 
Do the media and politicians go around to peoples homes and leave loaded guns lying around for kids to have accidents with? If they do, then perhaps I owe you an appology.",24,25,topic_stance_votes_1
25,Doctors Vs. Guns,gun control,attack,"Rediculous logic. First off, how many of these accidents were pilot error? How many were errors caused by maintanence? How many were ATC error? How many were simply mechanical failure. 
Why do you continue to point out other problems and ignore the fact that guns can cause deaths to innocent people. Why do you try to draw attention away from the fact that there are gun accidents that are preventable. I am in no way saying aircraft do not have accidents. This is another problem which needs to be dealt with, and in many ways it is. The simple fact that a preventable accident is just that, a preventable accident, whether it is in a plane or in a home with a gun.",23,26,topic_stance_votes_1
26,Doctors Vs. Guns,gun control,support,"http://webapp.cdc.gov/sasweb/ncipc/mortrate10.html 
2000, United States 
Unintentional Firearm Deaths and Rates per 100,000 
All Races, Both Sexes, All Ages 
ICD-10 Codes: W32-W34
Number of
Deaths Population Crude
Rate Age-Adjusted
Rate** 
776 number of deaths, 275,264,999 population, 0.28 crude rate, 0.28 adjusted rate 
2000, United States 
Adverse effects - Medical care Deaths and Rates per 100,000 
All Races, Both Sexes, All Ages 
ICD-10 Codes: Y60-Y84,Y88(.1-.3)
Number of
Deaths Population Crude
Rate Age-Adjusted
Rate** 
2,804 number of deaths, 275,264,999 population, 1.02 crude rate, 1.02 adjusted rate.
I think the information speaks for itself. Yes there are more medical care deaths than accidental gun deaths, but not to the extent originally suggested in this thread. You asked me to look at the information, I did. Perhaps people posting these outrageous claims need to do the same. The thing that strikes me so hard is that the people I am debating here think that we should attack all of these other problems, yet fail to see that accidental and preventable gun deaths are a problem too. They ALL need to be addressed. I don't call for banning airplanes, guns, or doctors. Placing a ban on something creates more problems than it solves. Working to prevent avoidable accidental deaths is the key.",26,27,topic_stance_votes_1
27,Doctors Vs. Guns,gun control,support,"2000, United States 
Unintentional Firearm Deaths and Rates per 100,000 
All Races, Both Sexes, Ages 0 to 17 
ICD-10 Codes: W32-W34
Number of
Deaths Population Crude
Rate 
150 number of deaths, 70,484,500 population, 0.21 crude rate
I used 0-17 age range because at 18 you may be considered an adult. So these are just the mortality rates for children. Notice the crude rate rises in this age group over the total population with all ages. So it could be said people in this age bracket are more likely to die from accidental gun deaths than people 18 and over.
2000, United States 
Adverse effects - Medical care Deaths and Rates per 100,000 
All Races, Both Sexes, Ages 0 to 17 
ICD-10 Codes: Y60-Y84,Y88(.1-.3)
Number of
Deaths Population Crude
Rate 
76 number of deaths, 70,484,500 population, 0.11 crude rate
Also take notice that the mortality rate for ""medical misadventure"" is lower for the age group 0-17 than the accidental gun death rate. Hmmmmmm.",27,28,topic_stance_votes_1
