,title,topic,stance,comment,parent_id,comment_id,viewpoint
65,Please end the confusion,abortion,attack,"Anyway, I still fail to see how abortion makes everything better for you.
I don't. But I know choice does. Choice in EVERYTHING. I will choose whether or not to have sex, use birth control, get a job, be rich, be poor, where short skirts or long ugly dresses, to put on tennies or heels, to open my mouth or shut up, to stay home or go out - and I will choose whether the body under this skin will be pregnant. And you, whoever the hell you are, don't get to make a single one of those choices for me. Ever.
THAT is what pro-CHOICE is about.
Read-I WAS talking to Mizmaxx, and was referencing the accusations of ME having issues with women, and yet it appears that YOU have issues with men.  
Right above the statement was a quote from me. 
I do have issues with men. Especially mysogonistic XXXXXX on BnB boards thinking they know anything about me.
I find it curious that when I make what is perceived as being a negative comment about women that I'M the one with issues, yet you, and Mizmaxx, seem to have license to say whatever you wish about men without a similar label
Say what you want. But I will tell you when you are talking out of your rear. Which is has been most of the time in this argument.
I think you might need to pay attention yourself, afterall this IS about abortion, and I was referencing that just because ""men"" walk out and leave women with the responsibility of being pregnant and raising a child alone, doesn't give the woman the right to terminate the pregnancy. So, inTHAT sense, the child suffering.
You are right. That fact that it is her body gives her the right.
Nice though. Men can **** freely and walk, but the women is a slut who needs to be punished for it. THAT is a lousy attitude towards women. 
I really fail to see where my opinions reflect a ""lousy"" attitude toward women. All I have said is that women are as equally responsible as the man for getting pregnant, and just because the man abandons her does not mean she has the right to an abortion. As I have said with Mizmaxx, IF a woman is going to be promiscuous (a slut), then there are consequences to their actions.  
See above.
Why is my opinion that you should accept the responsibility of your decisions/actions appear to be a lousy attitude to you?  
Because you don't feel that it needs to be shared by men.
And there are those who feel that terminating an unwanted pregnancy is responsible. More so than bringing an unwanted child into the world or having an unhealthy pregnancy.
You both seem to have a great deal of anger or jealousy that a man can get away without dealing with a child. Don't take it out on the unborn is all.
Women who have abortions aren't taking anything out on anyone you simpleton. They are making what they feel are the right choices for their life. How about you make your choices and you let others make their own?
And let me state for the record, I have never had an abortion, nor would I unless it were rape or a serious health matter. But I made that choice all by myself.",62,66,topic_stance_votes_2
66,Please end the confusion,abortion,attack,"Thank you for making my point better than I could ever do!! It's all about you, right honey? I am woman hear me roar right? LMAO
ROTFLMAO, I don't even have to say a word, you are doing quite well yourself!!
THAT was a good response, when I make a point, dismiss it and move on
And YOU are wrong! You, by nature, have been tasked with giving birth, so that child within you is NOT YOUR body, no matter how you slice it, it isn't. Lie to yourself all you want so you can sleep well, but it's not
You are so consumed with jealousy that you just can't see the truth!! LOL AGAIN, my point is made, abortion to you IS to do what you want without consequences. SOMEbody has to be responsible when a woman gets pregnant, and if the woman was stupid enough to get pregnant with a guy she barely knows, or has a poor judge of character, and she has the child inside of her (again, not part of your body, sorry), then naturally the responsibility falls on the woman. If you could get past your resentment of men, I am criticizing men equally-they shouldn't be such wusses to abandon the woman, but the woman also has blame too. 
I'm sorry, despite whatever fancy words you want to use, you have to be missing a chromosome or something. I have never said that men shouldn't share in the responsibility. Short of chopping up what I say, I want to see a quote, or anything even close to what you accuse me of saying
And there are those who feel that terminating an unwanted pregnancy is responsible. More so than bringing an unwanted child into the world or having an unhealthy pregnancy.
And if the child is unwanted, don't do the act! Remember biology, it DOES only take one time!! But see, that gets back to it ""just isn't fair, men can do it, why can't we, waaaa"". Now, dry your snot and run along and play
BLAH BLAH BLAH, that's what every woman says who supports ""pro-choice"". Give me a break, I wonder who has had the millions of abortions then
EXCUUUSE me, Einstein. I tell you what, I choose rape, how about that? Is that a deal?",66,67,topic_stance_votes_1
67,Please end the confusion,abortion,attack,"This decision is one that will affect a woman's life profoundly. Of course it's ""all about"" her, no one else should make that choice.
What point is being dismissed?
Who has tasked a woman with this? If by God, what about those women who don't believe in God? As long as that entity is dependant upon the woman for all it's needs, it's part of HER body. It is NOT autonomous. I hope you won't say she can't make decisions about her own body, and as long as that thing is a part of her, she can make decisions about it. 
Why do you keep assuming that abortions are given to woman who sleep ""with a guy she barely knows, or has a poor judge of character""? Husbands accompany their wives to have abortions when they are the father. They are simply pregnancies that are not wanted, not that anything needs to be 'covered up'.
You're right, people need to have responsibility for their actions. I wish those mother's who had given birth and dumped their babies into dumpsters had been responsible and aborted their babies instead of trying to deny that they were pregnant.
Dude, this isn't about ""men get to do it I want to to"". It is about the ability to choose not to be a life-support unit for 9 monthes, then a provider for 18 years, when one does not wish to be or have the means or constitution to. But, since we're on the subject, what is wrong with wanting to have sex without having to worry about having a child? You suggest that women should just resign themselves to having children, whether they want them or not. That is a lousy attitude toward women.
hehe, what about men who are pro-choice? Are men out there having abortions too?",67,68,topic_stance_votes_2
68,Please end the confusion,abortion,attack,"BTW~ You can't exactly choose rape... if it were a choice, it wouldn't really be rape now would it?",67,69,topic_stance_votes_2
69,Please end the confusion,abortion,support,"Probably my last post in reply to you, since this has pretty much ceased to be a debate. 
I never said it wasn't a life. It is alive, it is human. Whether it is a person deserving full rights and privilages as a born person is what the question is, as well as when the bestowing should happen. Stop putting words in my mouth.
Eh? For my gender? Does that mean if I'm not intellectually honest you look like a 2 year old? I have not seen them say negative things about men in general. I *have* seen them say negative things about you in particular, but not men in general. Yet I see you continually assuming (with no basis or reference) that all women who have abortions are sluts, and all men that are pro-choice are ******. Yeah, I think we can safely say that you have issues, while no-one else has been as negative.
You didn't read carefully enough. I didn't say dependency = part of your body, I said part of your body = dependency. A 1 year old has been born, so is not really a part of this discussion. A born baby you can put up for adoption if you have no desire to care for a child. What do you do with a month old fetus?
You didn't answer the question. Who ""tasked"" women? Was there a meeting I missed? Who is it that said that all women must have children, that they have no choice in the matter?
Do even *you* know what you are talking about? When is this a discussion about if men leave women? Women in commited relationships *do* have abortions, you know, and don't have to have commited adultery. You're continual shifting to this point really makes it seem you have issues in your past you need to work out. If it isn't a medical issue (which I hope you don't disagree could *require* an abortion), then they don't want children. Yes they love their husbands. Yes their husbands love them. Yes they had sex, yes she got pregnant. Neither wants kids. She gets an abortion. Happens all the time.
lol, you say don't be bitter or angry when you're the only one who comes across bitter and angry. Assuming men who are pro-choice are ****** is very bigoted of you. This next bit is retorical, so you don't have to reply, but you're view is very republican. You don't believe anyone can be altruistic, they always are looking out for themselves. Anyone who pretends otherwise is just trying to lower your guard, eh? Heaven forbid that I actually care about what happens to people, what their rights are. Bet you report your neighbors for 'suspicious activity' like Bush wants you to do
You know what? I agree with you. It is to a certain extent selfish, if it's done just because the woman doesn't want kids. I'm sorry to tell you, the world is full of selfish people. You should understand, you're one of them. If a woman is selfish, and doesn't want to share her life with little babies at this time in her life, do you really think that forcing her to have them will make everything better?
And yes, people put their parents in homes when they don't want to deal with them. Yes, it's selfish. Would I do it? If I couldn't support them, it'd be my only option if they couldn't support themselves. That's life, I'm sorry.
Alright, I think that's it for me. Maybe I'll read your reply, it's sure to give me a laugh.",68,70,topic_stance_votes_2
70,Please end the confusion,abortion,support,"@syklopps61
could you address this? i posted it in the other thread, but no-one seems to be able to get a handle on it.
Through pregnancy the fetus USES the mothers internal organs to live. It is dependent on the mother to feed itself, it is dependent on the mother for immunity, it is dependent on the mother for excretion, breathing etc. This puts extra strain on the mothers body.
To say that is the requirement of the mother to provide the use of her organs so that another person can live does not co-incide with modern day organ transplant choices. My son or daughter might be dependent on me to donate a kidney for his or her survival, but it does not make it a requirement for me to do so. Similiarly, although the fetus may wish for the mother to offer the use of her organs so that its condition might perpetuate until it becomes healthy and no longer requires them, it cannot make that a requirement.
In otherwords, the argument that the fetus IS a human being than leads to the argument that no human being can require another human being to physically support them through involuntary use of their organs.",70,71,topic_stance_votes_2
71,Please end the confusion,abortion,attack,"OH DARN!! LOL
And you have such faith in mankind that we can determine that, let alone that we even have the power to do that? 
Well, you've done a pretty good job of doing it to me
Anything for the ""team"", huh? Jitobear flat out admitted she has issues with men, making negative comments toward me, and yet you turn your head. Guess you have to sacrifice your integrity to go along with your sister in the fight
uh, let it live?
Oh, c'mon already, it was obvious I was stating that women have the biological ability to bear children and men don't, that is the ""cross"" you have to bear. Women of course, DO have the choice whether to have children or not, they don't HAVE to get pregnant-talk about putting words in someone's mouth
I'm fully aware that married couples do have abortions, I just don't think that it is as common as you would want us to believe. I believe that is the ""official"" story so that your cause seems more noble. You must admit, going on national tv saying that married couples want abortions sounds alot better than ""we want abortions so we can do what we want and because we are selfish"". It's for public consumption and to bring more supporters on board.
It's clear that anyone disagreeing with your so called ""right"" would be perceived by you as being angry
I'll go even further, ""men"" who are liberals are ****** too! I won't retract either statement. The very nature of a liberal goes against the natural tendencies of a man-working hard, making his own way in the world, providing for and protecting. Men want some and these types think they have to go against their nature in order to get some. 
You ARE kidding, right? You are speaking about being altruistic in the same breath as admitting that a living thing inside of you should be destroyed because it is a nuisance. Truly amazing
I appreciate you admitting that, thank you. But just so I have a handle on this, could you put a percentage on that ""certain extent"" part? You have admitted that abortions ARE performed simply because the woman doesn't want kids (and throw out the miniscule amount that are performed for health reasons)
That first sentence referencing selfishness. I'd love to know how you can determine how selfish I am in all these posts. As far as the rest of your response, is it possible for you to look beyond and see that your crusade could possibly have negative effects on society? I bet if we find an amoeba on Mars, you people would be running around screaming there is life on Mars, yet we have it everywhere around us here and you people could care less. And yes I know, it IS life, so don't try to make it appear that I'm inconsistent.
Why not just kill them though, afterall, they ARE a burden and produce nothing. It would make life SO much easier, wouldn't it?",70,72,topic_stance_votes_1
72,Please end the confusion,abortion,attack,"Ironically enough, the pro-life argument is generally considered a leftist argument (all-beings are created equal) and is more closely associated with a socialist opinion, rather than the right-wing philosophy that the government should have little to no control over peoples lives.
Your flame about liberals is hardly become and does nothing but discredit anything of merit you ""might"" have said. A grade ""A"" example of how to make yourself look like a fool.
I take it that you ignored my above post because you cannot find fault with it, in which case your arguments are invalid, and you are merely spouting rhetoric. Prove me wrong.",72,73,topic_stance_votes_2
73,Please end the confusion,abortion,attack,"That's what I meant about being altruistic and caring about other's rights, though it would have been just as valid if I were a women and cared about other women's rights whether or not I wanted to get pregnant or have an abortion.",72,74,topic_stance_votes_2
74,Please end the confusion,abortion,attack,"Please don't try to appear to be openminded-that you would actually listen to anyone that disagrees with you? Sorry, not buying it.
You sure do have a high opinion of yourself, huh? First of all, I work and had no time to address your post, I can only address one ignoramus at a time. Perhaps no one has addressed your theory because it's absurd, to say a woman is FORCED to share her organs when pregnant? Organs do what they are put there to do, nothing more, nothing less. Is that all you do all day is think up this stuff? If I'm not mistaken, the only thing actually attached to the fetus is the placenta. Surely the fetus extracts oxygen and nutients from the mothers blood, but no organs are attached. Do you have a problem with organ donation, blood transfusions, other medical procedures that are ""forced"" on you and I to save our lives? There are things that just ARE, can't fight or change them. 
Is this an attempt to make it appear as if I'M inconsistent? If that be the case, then join the club because you should be against abortions then, using this logic, so don't use it to impugn me",73,75,topic_stance_votes_1
75,Please end the confusion,abortion,attack,"Thanks for the clarification. Please note I could have had a field day with this, but chose not to LOL I still believe that if you were truly altruistic, you would also have an equal concern for the life of the unborn.",74,76,topic_stance_votes_1
76,Please end the confusion,abortion,support,"Thank you for making my point better than I could ever do!! It's all about you, right honey? I am woman hear me roar right? LMAO
No, Read what I wrote again. I am capable of making my own choices. I have made millions of them in my life. In my life I chose to have a child and raise him alone. I chose to get a degree and a good job. I chose to buy a house. I chose to be a mom. This morning I chose a yogurt smoothie for breakfast.
What is wrong with making my own damned decisions? I bet you do it - every single day. Shall I mock you for it? Explain to me how this is a character flaw. Please.
And yes - I am a strong woman. With the choices I have made I have to be. What is wrong with that?
I do have issues with men. Especially mysogonistic XXXXXX on BnB boards thinking they know anything about me. 
ROTFLMAO, I don't even have to say a word, you are doing quite well yourself!!
This was plain and simple me insulting you, personally. Clearly you didn't get it, Einstein. (That ""Einstein"" but was sarcams by the way.)
Say what you want. But I will tell you when you are talking out of your rear. Which is has been most of the time in this argument. 
THAT was a good response, when I make a point, dismiss it and move on
If I think your point is bunk, you can bet your hands I will dismiss it.
You are right. That fact that it is her body gives her the right. 
And YOU are wrong! You, by nature, have been tasked with giving birth, so that child within you is NOT YOUR body, no matter how you slice it, it isn't. Lie to yourself all you want so you can sleep well, but it's not
I, by nature, have been given the ability to give birth. Whether or not I will choose do so is a whole other matter. You see, that child can't live without my body. Use of my body requires my consent.
You are so consumed with jealousy that you just can't see the truth!! LOL  
No I am not and I will ask you to refrain from telling me how I feel.
AGAIN, my point is made, abortion to you IS to do what you want without consequences.  
No abortion is the end of a life. A sad sad circumstance. I hate that people are irresponsible with it. But that does not mean I get to make choices for them.
SOMEbody has to be responsible when a woman gets pregnant, and if the woman was stupid enough to get pregnant with a guy she barely knows, or has a poor judge of character, and she has the child inside of her (again, not part of your body, sorry), then naturally the responsibility falls on the woman.  
This I save for later.
If you could get past your resentment of men, I am criticizing men equally-they shouldn't be such wusses to abandon the woman, but the woman also has blame too.  
But if they do, so be it. You don't mock them or what to legalize their behavior. They can make bad choices if they want. Since nature endowed them with a dick, they get to behave like one, eh?
Because you don't feel that it needs to be shared by men. 
I'm sorry, despite whatever fancy words you want to use, you have to be missing a chromosome or something. I have never said that men shouldn't share in the responsibility. Short of chopping up what I say, I want to see a quote, or anything even close to what you accuse me of saying
Here I quote YOU:
""SOMEbody has to be responsible when a woman gets pregnant, and if the woman was stupid enough to get pregnant with a guy she barely knows, or has a poor judge of character, and she has the child inside of her (again, not part of your body, sorry), then naturally the responsibility falls on the woman""
And if the child is unwanted, don't do the act! Remember biology, it DOES only take one time!!  
Good suggestion! I think all women who want to make their own choices should stop having sex altogether and just leave you boys to each other.
But see, that gets back to it ""just isn't fair, men can do it, why can't we, waaaa"". Now, dry your snot and run along and play
Hey big strong man, think you can find the balls to talk to me like an adult?
And let me state for the record, I have never had an abortion, nor would I unless it were rape or a serious health matter. But I made that choice all by myself. 
BLAH BLAH BLAH, that's what every woman says who supports ""pro-choice"". Give me a break, I wonder who has had the millions of abortions then
You know, I don't really think you are a responsible man who takes care of his responsibilities. I bet you just screw around and never pay child support.
.......
Like that? 
Don't call me a liar.",74,77,topic_stance_votes_2
77,Please end the confusion,abortion,attack,"All those choices, wow, you must have a headache, huh? I have what's called responsibility, and you are advocating lack of same. Are you actually equating your choice to have a smoothie to be on the same level as having an abortion? I made the choice to father a child, I could easily do what's EASIEST for ME and run away, but I choose to do the right thing. I'm saying a woman who chooses to become pregnant should make the responsible decision instead of the selfish decision
Don't have a problem with it one bit, just do what's right instead of what's easy, that's all. What is wrong with THAT?
Wait, you mean you are actually admitting to saying something negative? LOL Clearly, you don't have a clue. I got your feeble attempt at an insult, YOU apparently didn't understand that I was commenting about YOU having the hatred...no, loathing of men. Might have to go more than once a week to your shrink! LOL
You're coming along! You gave your consent when you laid on your back. Nature has NOT granted you the ability to choose WHEN you get pregnant, none of us can predict when that happens. 
Well you put your feelings out for all to see, damn right I'll write what I want to write-free speech? I CHOOSE to say what I want, whether or not YOU like it
Thank you for admitting that, and it IS sad. Do you feel obligated to stand up for what's right? Or do you just run your head and not get involved? In THAT sense, people like me are not making choices for others, we are just standing up for what is undoubtedly wrong. Even YOU admit that it IS a life, so would you turn away if a young child is fighting for it's life?
Can't wait to hear it!! LOL
Oh, c'mon now, I have mocked these ""men"" throughout this discussion, you apparently haven't been reading very closely. I'm not saying men should behave that way either, I'm just saying that many DO. Now, you did say a man acting like a ""dick"" with that kind of behavior, so I certainly can bring up that trerrible term ""slut"" when a woman sleeps around. I'm not talking about any of THAT behavior being illegal, I'm saying that the ABORTION should be-can't you separate the two?
AHHHHHHHHHH and all you women to each other-heaven, huh? LOL
Well little lady, when you act like one I'll be glad to treat you like one LOL
Of course you don't, because you think all men are the same like that scum that left you. Funny how, here I am, a man who is NOT running and behaving like a pig, and yet I am loathed by you. You really do need to sort out some issues.
Oh, and when you lie, I will call you a liar, you betcha",77,78,topic_stance_votes_1
