,title,topic,stance,comment,parent_id,comment_id,viewpoint
0,Please end the confusion,abortion,support,"Is that which is ""not considered viable"" legally covered by abortion laws? A fetus progressed, say, one or two years of age, left to its' own, is hardly viable? - 
Toddler Homicide?( already legal)
We no longer have to change poopy pampers
Fetal homicide, neither worse or better than Canniablism...
One kills them/ One gobbles them up, or perhaps they are one in the same.",0,1,topic_stance_votes_1
1,Please end the confusion,abortion,attack,"What is your point? Perhaps it is just me, but I am having a difficult time understanding your questions/statements. Can you please clarify?
Thanks!
The Bootfitter",1,2,topic_stance_votes_2
2,Please end the confusion,abortion,attack,"I'm really confused, I seen a show that kept speaking on viablity? I'm assuming they mean the babes capability of survival outside the Mother? 
Answer me this, at what point, stage in development, determines the right/wrong time to get grinded/hacked up?( whatever the method)",2,3,topic_stance_votes_1
3,Please end the confusion,abortion,attack,"And so am I...
Dear rapture -- With all due respect, I would encourage you to formulate a clear thought and communicate it in a way that an average joe like me will be able to understand. As your two posts are written, I have no clue what you are attempting to communicate. I do have some interest in the topic of viability though, so if you could perhaps explain what you are saying, I would be interested in discussing the topic with you.
Thanks!
The Bootfitter",3,4,topic_stance_votes_2
4,Please end the confusion,abortion,attack,"I'm a product of public education. 
What is it? Exactly",4,5,topic_stance_votes_1
5,Please end the confusion,abortion,attack,"[QUOTE=rapture]Is that which is ""not considered viable"" legally covered by abortion laws? A fetus progressed, say, one or two years of age, left to its' own, is hardly viable? -[QUOTE=rapture]
Viability in pregnancy is basically the gestational age when a fetus can survive outside the womb, as in cases of impending premature births, and it is determined by a doctor, usually with a diagnostic ultrasound. I don't think that it applies to babies who have already been born, especially at one or two years old, because it is something that is determined during the pregnancy itself; a pregnancy can not be considered viable or non-viable if the pregnancy has ended, and there would be no way at conception to determine viability or non-viabilty.
When a pregnancy has been found to be non-viable, it means that there is no chance for the fetus to survive, outside the womb and/or in some cases, inside the womb as well. If a pregnancy has been determined to be non-viable, most of the time, termination of the pregnancy is recommended by the doctor (depending on the doctor/s and the reasons why it was found to be non-viable). If the development of the pregnancy is in the 1st trimester (first 12 weeks) it is generally recommended, but it also depends on why the pregnancy is non-viable, and from what I have learned anything later (2nd or even 3rd trimester) again depends on the doctor/s and/or the complications that made it non-viable in the first place. It is still a matter of choice, because the doctor can only recommend what they think should be done. Trust me, that word (this whole issue basically) has been pretty much shoved down my throat by my doctors for the past month, and I know a large percentage of doctors do recommend terminating the pregnancy if it is non-viable, but again, it is ultimately up to the woman in question . Also, it is legally covered in abortion laws; if it weren't, doctors wouldn't recommend it to their patients. 
I hope this clears it up for you..(?) Your question was a little confusing, and honestly I don't see how anyone could respond to your poll; it doesn't apply and we can't ourselves determine viability- that is something that medical professionals have to determine, and the 'true' definition of fetal viability is also better defined by the medical professional. 
[QUOTE=rapture]Toddler Homicide?( already legal)[QUOTE=rapture]
What? Did I miss something? What is 'toddler homicide' and how is it already legal?",1,6,topic_stance_votes_2
6,Please end the confusion,abortion,attack,"It helped.. I wasn't sure if the concept of viablity extended outside the womb.....
[QUOTE=rapture]Toddler Homicide?( already legal)
Fetal Homocide? Toddler Homicide? A human in different stages of development.....Why/or What is the difference?And if someone wanted this legal( Toddler Homicide) ...I don't see much anybody could do legally to stop it..
When women kill their tots they are locked up/ and branded with a criminal record vs  the female who callously kills durning the fetal stage.(Double standard?) 
I have a couple friends, who have aborted more than once, because they didn't want to lose their girly figure(trivial). I find it eerie and disturbion.....
I hardly meet women who want their babies...sorry about your situation.",6,7,topic_stance_votes_1
7,Please end the confusion,abortion,attack,"At least one difference is that what you are calling ""fetal homicide"" (aka ""abortion"") is currently accepted as legal by the United States legal system under the interpretation of the Roe vs. Wade Supreme Court case of 1973. ""Toddler homicide"" is not.
If someone wanted ""toddler homicide"" legal, they would have to change many existing laws and the interpretations of those laws. The unprovoked killing of a human being (post-birth) in non-war situations is currently illegal in the United States legal system.",7,8,topic_stance_votes_2
8,Please end the confusion,abortion,attack,"Well, an abortion can't technically be called 'fetal homicide' because it isn't illegal... homicide is. If a woman kills her toddler, that is homicide, and it isn't legal, and I don't see how it ever could/would be... all murder is illegal, but to call an abortion murder is really only your personal opinion on the issue, because as of now it is a legal procedure. Some people consider it to be murder, and some don't.. it isn't an open and shut thing either way; if it were, there wouldn't be so much debate over it, and if it were considered to be murder all around, no questions, then it would not be legal. Maybe the laws will change someday, who knows.. but right now it's not illegal for a woman to have an abortion. You can call it a double standard, but again that is mainly just opinion.
But I also have had friends who have had abortions because they didn't want to 'get fat'.. I know of one girl who had 7 by the time she was 22... that is pretty disturbing, and I don't think that it's really right to do it for reasons like that... like I said to her, if she were so afraid of getting pregnant, or getting 'fat', she should have either not had sex or she should have used protection... there are ways to prevent pregnancy, and birth control costs a hell of a lot less than an abortion (especially 7 times).. but at the same time I also had a friend who got pregnant, and got scared, and made an appointment to a clinic, and once she got there she didn't think she could go through with it, and now she has a healthy, adorable 5 year old and she is very thankful that she didn't have the abortion after all... but in the cases of my friends, all I could do was offer an opinion if they asked, but I didn't feel I had the right to tell them what to do either way. You really can't know what is going on in a woman's mind when she is considering an abortion, or after she has had one done.",7,9,topic_stance_votes_2
9,Please end the confusion,abortion,support,"Rapture, 
Just curious... do you consider it to be murder when a death row inmate is given a lethal injection? Since you were implying that an abortion is murder, although it is legal; when an inmate is put to death, that is an example of one human killing another human, and it is also legal, so would you also consider that to be murder?",9,10,topic_stance_votes_2
10,Please end the confusion,abortion,support,"Would you consider a soldier in a time of war,killing the enemy a murderer?
Would you consider a father protecting his family from a armed felon murder?",10,11,topic_stance_votes_2
11,Please end the confusion,abortion,support,"Are you asking me, or are you asking Rapture? Sorry, I got confused! emoticonXRolleyes 
Rapture had said that abortion was murder, so I was just wondering if he/she felt the same about lethal injection.. personally, I didn't say either way about any of it.
But you did bring up some good points.",11,12,topic_stance_votes_2
12,Please end the confusion,abortion,attack,"Legally, the Death Penalty is not murder. Morally, it can be. Abortion on the otherhand is the intentional killing of an innocent human being. This completely destroys the trust that a child has for it's parents- children don't have sanctuaries anymore.",12,13,topic_stance_votes_1
13,Please end the confusion,abortion,attack,"Legally, abortion is not murder either.. morally it also could be perceived that way. The death penalty is also the intentional killing of another human being, and although probably not innocent, and there are probably good reasons for it, is it really morally right either?
How can aborting a baby destroy the trust it has for its parents? It would have no way of even being able to grasp the concept of trust.",13,14,topic_stance_votes_2
14,Please end the confusion,abortion,support,"Why would it? Most children are aware enough to know the difference between themselves and a fetus, and don't live in constant fear that they will be sucked back into the womb in order to be aborted. That sounds like a truly peculiar phobia.
What are you referring to here? When did ""children have sanctuaries""? Children are murdered, starve to death, bombed into oblivion, forced into prostitution, etc. every day. Do you really think that forcing women to bring every pregnancy to term will somehow magically make the world a safer place for children, or that there was a ""sanctuary"" for children during the time that abortion was outlawed?
It has always highlighted for me how much bunk the whole ""save the life"" line is when anti-abortionists are pro-death penalty. In particular, given how this process plays out in practice- that is, it is extremely racially and economically unbalanced, not to mention often disproportionate to the nature of the crime. In practice, people who die from d.p. have bad lawyers because they have less money, and could have not even been in the room when the murder occurred. 
BTW Carman, how are you doing? :)",14,15,topic_stance_votes_2
15,Please end the confusion,abortion,support,"I'm doing ok... thanks :)
I had the procedure done last week.. I had gotten really sick and ended up in the hospital, and they found that I had been leaking amniotic fluid since my amniocentesis (over 2 weeks).. it was slow, so I didn't notice it really, and by then I had a bad infection and the baby wasn't doing well at all... the heart rate was very weak and slow and I had been having bad cramps for about a week, so they said I was beginning to miscarry, but because of the infection they sent me the next day for the procedure.
So, physically, I feel ok.. mentally it's been pretty hard...the doctor at the clinic I went to was really cold about things, and told me details I didn't feel I needed to know, and I had asked not to be told since I wasn't there by choice and it wasn't something that I wanted to have done..so that made things a lot harder.. I know after all that if something ever did happen again, I won't have that done no matter what. 
We see a genetic specialist in a few weeks so they can do some tests and go over everything with us, but they did say based on what they do know, they think the chances of us having another baby with those problems are less than 1%, so we were happy to hear that. I wish it didn't happen at all, but at least now they will know what to look for when I get pregnant again.
But I am hanging in.. it has been hard but my husband and my family and friends have been very supportive, so that has helped a lot.",15,16,topic_stance_votes_2
16,Please end the confusion,abortion,attack,"I love it how you completely change the debate to your liking! It’s really cute.
An infant certainly isn’t aware that it is different from anyone else. So let’s kill infants too! 
Age of viability really is around 5 or 6 months. But viability doesn't define humanity.",15,17,topic_stance_votes_1
17,Please end the confusion,abortion,attack,"There is no definite age of viability during pregnancy. The norm is around 20 weeks gestation (about 5 months), but it varies.",17,18,topic_stance_votes_2
18,Please end the confusion,abortion,support,"How terrible. It looks like the decision was taken out of your hands regardless, and thankfully you haven't been harmed. 
That's too bad. Often I find nurses much more helpful in these situations, because they often are less emotionally distant. It's already a hard enough situation for you without someone being that way.
I'm glad to hear that you have husband, family and friends around you at this time. That can make a difference, even if it can't make everything better. I know that friends who have been through similar experiences have felt that they needed to have some kind of ceremony, almost like a funeral, to commemorate the end of this life that could have been. People often go through so much grief when they miscarry or abort, because of the tremendous loss, that they need to express this grief and dissapointed expectations in some way. 
Whatever you do, good luck with the geneticist. I know other people I've known were very scared to go through getting pregnant again, in case of the same thing happening again. It sounds like in your case that's not likely, but I still think it takes courage to try again when you've been through so much. This kind of thing just goes to show what a miracle and a gift your daughter is. Good luck! :) 
Thanks! So, are you going to answer the question, or are you just going to go on about how cute I am? Feel free, I don't mind, and it's true, I'm pretty darn cute. I think I'm a bit old for you though... emoticonXEmbarrassed 
Well, I don't think killing infants is a good idea. Besides which, my point was that your comment that children felt ""unsafe"" with their parents because of abortion was absurd.",18,19,topic_stance_votes_2
19,Please end the confusion,abortion,attack,I never siad children felt unsafe. I said that children ARE unsafe in the wombs- this is true. 1/3 of all pregnancies end in abortion.,19,20,topic_stance_votes_1
20,Please end the confusion,abortion,support,"The nurses actually were very nice and pretty supportive... the doctor was the one I had the problem with, but I suppose to do what he does he would have to be emotionally distant.. It's been easier to move on and put things in perspective now that everything is over, and I am hopeful and I think next time things will work out... everything happens for a reason I believe, so I just have to try and figure out the reason! :)",19,21,topic_stance_votes_2
21,Please end the confusion,abortion,support,"Actually, you said-
Which is completely absurd. Lucky for you you don't remember what you have said...
Chosen or not? Spontaneous abortions are very frequent, almost 50% before the first two weeks, at which point often the woman is not even aware she was pregnant, and the child is flushed unceremoniously.
The womb is not a safe place. The world is not a safe place. That's no reason to oppose abortion or to fight for choice.",15,22,topic_stance_votes_2
22,Please end the confusion,abortion,attack,"Mizmax, if you have ever taken English grammar, you would know about tenses. Obviously, you havn't.
Mizmax, stop being a smarta$$. Unintentional abortion has been replaced by ""miscarriage"". When speaking of abortion, we mean the intentional killing of a fetus. 
The world is not a safe place- let's kill our children! Your logic is that of my sister- always trying to mimic my logic without success.",22,23,topic_stance_votes_1
23,Please end the confusion,abortion,attack,"Indeed. Thankfully good grammar is irrelevant to the quality of an argument. As is spelling.
Again, this wasn't my argument. It isn't a strong argument for or against abortion rights. The relative safety of the world or the womb is irrelevant. I don't know why you keep talking about it- do you have a point?",23,24,topic_stance_votes_2
24,Please end the confusion,abortion,support,What about the wombs of the women who don't choose abortion? The womb isn't always a safe place; sometimes there are things wrong with mother and/or the baby that have nothing to do with abortion.,24,25,topic_stance_votes_2
25,Please end the confusion,abortion,attack,"That has to be the single most ignorant thing I have ever heard.
First of all, abortion has absolutely nothing to do with the death penalty. The death penalty is a punishment set by governing laws based on religious belief. An eye for an eye, a tooth for a tooth and all that. If i steal 20 dollars from you, I am require to give you 20 dollars in return, not 150. If I take your life, then i'm required to give mine in return. Most of the time, the death penalty isn't near enough. They have killed sometimes dozens of lives and they only have one to return. It is also supposed to be a deterrent, but even that doesn't work, becuase ignorant people claim that it's racist or economically motivated. There is no reason a poor person or a person of color should have to kill someone. Murder is a solitary crime that isn't require to do for survival, or to feed yourself or your family. 
Second, the number of death row inmates innocently convicted is a tiny percentage. It does happen, but it is rare. There are always mistakes in a system run by men. We are a fallible people. But let the punishment fit the crime. 
Personaly, I'm against the death penalty on a purely economical reason. It cost 4 or 5 times more to execute a murderer that to put him up for life in a maximum security prison. After the required appeals for a commuted sentence, the further investigations, the lawyers, the re-trials, it costs millions of dollars to finally execute the criminal.",15,26,topic_stance_votes_1
26,Please end the confusion,abortion,attack,"Carmen, I'm very sorry for your loss, and if you need to talk about it with women who understand, there is a great forum at http://www.afterabortion.com/ 
Just click on Message Board on the left side and register (it's free)
I don't really have anything constructive to add, as everything I would say has been said by one side or the other.",26,27,topic_stance_votes_2
27,Please end the confusion,abortion,support,"Thank you :). I don't have anything constructive left to say either... it has helped me a little to post everything that happened on here, although sometimes it's hard to get things across the way you want.",27,28,topic_stance_votes_2
