,title,topic,stance,comment,parent_id,comment_id,viewpoint
0,"Religion a ""Psychological Disease"" Say Experts",existence of God,support,"I found this article on the Internet and would like to hear what others think about it.
Religion a ""Psychological Disease"" Say Experts 
LONDON (AP) ~ According to the Royal College of Abnormal Psychology, based in London, England, religion as we know it is actually more of a disease than an organization. 
""When you look at the various aspects of religion, you find that psychoses actually play a very large part,"" stated Prof. Dawnette Vancurenko, a practicing psychologist and long time member of the College. 
""For instance, irrational belief, which is usually associated with conditions like schizophrenia, is actually one of the primary ingredients of mental illness,"" she continued. ""It is a pervasive pathogen that finds its home in all religions."" 
Belief is an emotional acceptance of a proposition, statement or doctrine, according to the College’s own definition. ""Much of humanity’s beliefs are the result of prolonged and incessant indoctrination during their formative years, generally recognized as being the first four to five years of life."" 
""Intimidation and peer-pressure exert an ""I must believe"" ethic that soon becomes commonplace. A conceptual system is then created that will describe the actions an individual may or may not be permitted to perform."" 
""The process is augmented by another psychological factor, that of paranoia, a functional disorder in which the symptoms of delusions of grandeur and persecution are manifest. The delusions develop insidiously and become knit together into a rational and coherent set of beliefs that are internally consistent, and, once the initial set of assumptions is accepted, compelling and vigorously defensible."" 
""In the old days, voices in the head were referred to as ‘Revealed Knowledge,’"" remarked Vancurenko. ""Today we call them schizophrenia or multiple personality disorder."" 
""Fortunately, most modern prophets are on medication,"" she said.",0,1,topic_stance_votes_1
1,"Religion a ""Psychological Disease"" Say Experts",existence of God,support,Teeheehee! :),1,2,topic_stance_votes_1
2,"Religion a ""Psychological Disease"" Say Experts",existence of God,attack,OH BRUTHA!! emoticonXCry Where did this load of fertilizer come from?,2,3,topic_stance_votes_2
3,"Religion a ""Psychological Disease"" Say Experts",existence of God,attack,"That article brings up a good point if Jesus or a prophet such as Mohammad was to appear today what would happen to them ?
They would probably be locked up in a nice padded cell, and they would be given all sorts of drugs to stop those voices that reveal divine knowledge to them.",3,4,topic_stance_votes_1
4,"Religion a ""Psychological Disease"" Say Experts",existence of God,support,"I am curious if there are people out there today claiming to be the messiah, and do they have followers? Has anyone heard of such a thing?",4,5,topic_stance_votes_1
5,"Religion a ""Psychological Disease"" Say Experts",existence of God,attack,"Unfortunately, our ""enlightened"" society today has caused us to have blind hearts.",4,6,topic_stance_votes_2
6,"Religion a ""Psychological Disease"" Say Experts",existence of God,attack,"Honestly though Bassman if a long haired person with a beard came up to you and claimed he was the son of God what whould you do ?
A) Call the police to take the crazy man away
B) Ignore him, and go on your way
C) Get down on your knees and worship him",6,7,topic_stance_votes_1
7,"Religion a ""Psychological Disease"" Say Experts",existence of God,attack,"If I were following the prophets all along, and had a heart toward God, then I would know that messiah has come.",7,8,topic_stance_votes_2
8,"Religion a ""Psychological Disease"" Say Experts",existence of God,attack,"That is such a cop out answer. I for one would loveto hear you answer this question...not only because I work in mental health, but because it is such an intriging question.....if a long haried, bearded man came up to you on the street and claimed he was the messiah, would you follow him? WOuld you call the police? What would you reaction be? Have ya seen the movie with George Burns called ""Oh God""?",8,9,topic_stance_votes_1
9,"Religion a ""Psychological Disease"" Say Experts",existence of God,support,"It is also worth mentioning that the current DSM IV has a diagnosis for religious addiction....The symptoms do resemble some of what the first post is talking about, although it more refers to people who actually ""get high"" off of religion. WHich yes, folks, if you can get addicted to internet porn, drugs and tv, religion can become an addiction too! I believe it is rare, but it does happen. People have lost jobs, spouses and lives do to addictions to ""jesus"".",9,10,topic_stance_votes_1
10,"Religion a ""Psychological Disease"" Say Experts",existence of God,attack,People have lost lives being addicted to gay anal sex. Maybe that should be in the DSM IV.,10,11,topic_stance_votes_2
11,"Religion a ""Psychological Disease"" Say Experts",existence of God,attack,"and this is relevant ?
Back on topic
Of course Religion can be harmful, but there are studies out there that say people who have some sort of spirituality seem to have a better quality of life and those who don't.
If you guys give me some time I will see if I can dig up the Report. It might be relevant to the Topic at hand.
Please can we keep this on Topic. Pretty please with sugar on top.",11,12,topic_stance_votes_1
12,"Religion a ""Psychological Disease"" Say Experts",existence of God,attack,"You bet. The self-contrived religion of gay America, where anything goes and you still get waltzed into heaven. No repentence, no singed consciences, and no remorse. Certainly there must be help for this somewhere in medicine / psychology / psychiatry.
If the DSM IV people weren't so politically correct they'd have gay disorder put back in their manuals like it was before. After all, the behavior falls into the ""abnormal"" range of the Bell Curve on human sexual behaviors.",12,13,topic_stance_votes_2
13,"Religion a ""Psychological Disease"" Say Experts",existence of God,attack,I see your homophobia is showing. I guess this statement of hate cancels out your whole guide of love the sinner hate the sin...Obviously there is more to it with you.....No wonder I see you as hate filled....you are!,11,14,topic_stance_votes_1
14,"Religion a ""Psychological Disease"" Say Experts",existence of God,support,"It isn't relevant to this topic. Everytime the topic of religion as harmful has come up on this board somebody (you this time) wants to show how lovely it has been for some people. I agree with you....so does everyone else. But that doesn't discount the fact that is has been an addiction and psychotic for others......I appreciate what you are saying, but the point of this thread isn't how religion is good, but when it is bad......can you come up with those numbers?",12,15,topic_stance_votes_1
15,"Religion a ""Psychological Disease"" Say Experts",existence of God,attack,"Is there a better way to phrase it so you don't go off spitting out invectives yourself? Maybe, ""Joe, you know tens of thousands of gay men are dying of AIDS due to homosexual sex. And still a great many of them fail to use condoms even after they've been counseled."" 
It's really hard getting through to you folks, brummer. How many gay deaths is it going to take before gays start recognizing it's not godly religious beliefs that destroy lives, but the abrogation of those beliefs, including supporting gay sex.",14,16,topic_stance_votes_2
16,"Religion a ""Psychological Disease"" Say Experts",existence of God,attack,gay sex is not the cause of AIDS....HIV is the cause of AIDS. HIV is spread through promiscous behavior.......heterosexuals are just as risky as gays.......as have just as much chance of being infected.....how many deaths will it take for you to realize this.....people have known for a decade that HIV is not a gay disease....where you been?,16,17,topic_stance_votes_1
17,"Religion a ""Psychological Disease"" Say Experts",existence of God,attack,"Ugh! You don't get it! AIDS is not caused by gay sex. It is what happens after one is infected with HIV. More and more these days the gay community is aware of the risks, and more guys are being careful. 
Here, try this out for size.
""Tens of thousands of straight men and women are dying of AIDS due to heterosexual sex. And still a great many fail to use condoms after they've been counseled.""
""It's really hard getting through to you folks, EZ. How many heterosexual deaths is it going to take before hets start recognizing it's not godly religious beliefs that destroy lives, but the abrogation of those beliefs, including supporting heterosexual sex?""",16,18,topic_stance_votes_1
18,"Religion a ""Psychological Disease"" Say Experts",existence of God,attack,"The DSM IV has reduced mental health treatment to what can be billed and every poster on this forum could qualify as having half a dozen disorders from it.
I agree with much of what you say most of the time Joe, but please don't bring up this kind of stuff knowing most people aren't going to know what you're talking about so you can explain what the DSM is and feel smart.",10,19,topic_stance_votes_2
19,"Religion a ""Psychological Disease"" Say Experts",existence of God,attack,"You know how lame you guys sound? Gays getting AIDS from illicit behavior is okay because other people do it. That kind of thinking fails to address the central problem (ungodly, irresponsible behavior to begin with).
The fact is that it doesn't matter how many heterosexuals are buying the farm if the gay community is slowly going down the drain.
Do something constructive. Either quit with the irresponsible sex or take better measures to protect yourselves, so us taxpayers don't have to pick up your sick tab.",18,20,topic_stance_votes_2
20,"Religion a ""Psychological Disease"" Say Experts",existence of God,support,"EZ- Look we can discuss this, but can we please discuss this somewhere else? Does every thread have to be about gays and lesbians?",20,21,topic_stance_votes_2
21,"Religion a ""Psychological Disease"" Say Experts",existence of God,attack,It is not about feeling smart. I do not need to make those kind of satement. My self-esteem isn't in question. The point is that this is a recognized disorder. NOt everything in the DSM is billable....many of the codes are not billable...it is about what is recognozed as a disorder and what is jusy rubbish.,19,22,topic_stance_votes_1
22,"Religion a ""Psychological Disease"" Say Experts",existence of God,attack,"really! it gets old! I am gay, it is a piece of my life, not my whole life...EZ only made those statements as an attack..a very christian thing to do...(another attack, yes, I bite back)",21,23,topic_stance_votes_1
23,"Religion a ""Psychological Disease"" Say Experts",existence of God,attack,"This ""religious disorder"" is just another attempt by the politically correct to try to kick god out of society, so they can be their own gods and engage in whatever kind of sin they choose without having to have their consciences pricked.",22,24,topic_stance_votes_2
24,"Religion a ""Psychological Disease"" Say Experts",existence of God,attack,"If this is a disorder then I'm a monkey's uncle. Let me tell you. Some of the most level-headed people that I know are Bible-beleiving eevangelicals (my pastor, for one) who have real struggles and real problems just like everyone else. The difference, and it's a BIG one, is that our lives are much more managable.",22,25,topic_stance_votes_2
25,"Religion a ""Psychological Disease"" Say Experts",existence of God,attack,"Tell that to those who have the disorder....who have lost jobs because the wouldn't stop trying to convert coworkers in the lunch room....when anything has become a blocker to your normal survival...it is an addiction....when you crave the high you get from ""witnessing"" so much that you are willing to lose your loife over it....you are an addict....",24,26,topic_stance_votes_1
26,"Religion a ""Psychological Disease"" Say Experts",existence of God,attack,"Oh?? Your sister must have married a very interesting person then.
And I would like to see hard evidence that 'Bible beleiving evangalistics"" have more managable lives.. that certainly is a big claim.. and I bet there is not objective evidence for it.",25,27,topic_stance_votes_1
27,"Religion a ""Psychological Disease"" Say Experts",existence of God,attack,"Next think you know you people will be boiling them in oil like they tried to do with the Apostle John. Or locking them up in institutions so your consciences won't be offended. Very sly, but very predictable. Anti-Christian bigots will stop at virtually nothing to shut up his people.",26,28,topic_stance_votes_2
28,"Religion a ""Psychological Disease"" Say Experts",existence of God,attack,"well they do not seem to have a religious addiction, they just sound like people of faith. There is a difference. Stop being so offended and look at what is before youl....the facts....some people just drink others are alcoholics....some people play the lottery, other have a gambling problem...some people are just religious...others are getting high off ""god"" to an extent it isn't healthy. Maybe they are using god as a way to distract from the real issues in there life.....or whatever the case may be...but don't deny that it happens. When science knows it does!",25,29,topic_stance_votes_1
29,"Religion a ""Psychological Disease"" Say Experts",existence of God,attack,"And as I said before, science is extremely flawed, and it is your idol.",29,30,topic_stance_votes_2
30,"Religion a ""Psychological Disease"" Say Experts",existence of God,attack,And the bible is your idol.,30,31,topic_stance_votes_1
31,"Religion a ""Psychological Disease"" Say Experts",existence of God,support,"OK, Bassman
Let us look at this in more simple terms and scenarios.....
If a person is about to be fired, divorced and evicted all because he will not stop talking about his religion....is this not an addiction? Lets look at the simple part of the addiction
He cannot seem to control it
He doesn't seem to care if it is controlled or not.
He is willing to lose everything to continue his religious behavior?
Sounds like addiction to me.....Now tell me what you think of the scenario...",31,32,topic_stance_votes_1
32,"Religion a ""Psychological Disease"" Say Experts",existence of God,attack,"If you mean the inspired, infallable, inerrant Word of God as contained in the entire canon of Scripture from Genesis to Revelation...",31,33,topic_stance_votes_2
33,"Religion a ""Psychological Disease"" Say Experts",existence of God,attack,"If you're referring to a person sharing his faith, then what's the beef?",32,34,topic_stance_votes_2
34,"Religion a ""Psychological Disease"" Say Experts",existence of God,attack,"I didn't say everything is billable. But the fact is, for someone to be able to get treatment, whoever is treating them has to give them a label from the DSM to be able to get paid. It's nothing but pathology and money.",22,35,topic_stance_votes_2
35,"Religion a ""Psychological Disease"" Say Experts",existence of God,attack,"I understand your point here, but would you say the same thing about other beliefs that are strongly committed to? Would you say the same thing about someone who was just as devoted to gay rights?",32,36,topic_stance_votes_2
36,"Religion a ""Psychological Disease"" Say Experts",existence of God,support,"The relevant comment was directed to EZ, who brought up a ridiculous statement that was not relevant to the Topic at hand.
I have no reason to defend Religion, I am an Atheist. I am sure the positive effects of Religion(or more broadly spirituality) come from solace it gives to people in troubled times. I think the report(if I find it) will help to balance the debate slightly .
I wonder if you will give me some more time to dig up the report, I am trying to find the actual Academic Paper rather than post from a biased source such as Evangelical Website.
I found this link, I will try to find the study behind it
http://news.bbc.co.uk/1/hi/health/401091.stm 
In regards to mental health which is more relevant to this thread, the BBC article states
I still want to find the study, it is hard to analyse their results from a news story.",15,37,topic_stance_votes_1
37,"Religion a ""Psychological Disease"" Say Experts",existence of God,attack,You are mistaken. Evangelicals are extremist nutters. It is not possible to be a level-headed extremist nutter. There are no level-headed evangelicals.,25,38,topic_stance_votes_1
38,"Religion a ""Psychological Disease"" Say Experts",existence of God,attack,"As compared to this Perpetrated in the name of Jesus. 
http://en.wikipedia.org/wiki/Spanish_Inquisition
By the churches own estimate ""31,912 people were executed from 1480-1808.""
or poor Giordano Bruno http://www.ronaldbrucemeyer.com/rants/0217almanac.htm his crime was that he thought the earth went around the sun. Is this your loving chritian church
Lets go closer to home
http://www.salemweb.com/guide/witches.shtml
All of the above happen when the church is mixed with the government. The salem witch trials were closer in history to our founding fathers then the civil war is to us. They knew the dangers of mixing government and religion. Religion kills people dead.
Now EZ if you study history you know that religion can be good and bad. What I see comming, if the evangelicals have their way and the war against my people continues, are the 21st century version of the salem witch trials. Only this time, instead of witches, it will be the GLBT people who are hanged and executed. All in the name of Jesus and you wonder why GBLT have something against the church.",16,39,topic_stance_votes_1
39,"Religion a ""Psychological Disease"" Say Experts",existence of God,attack,"Then you have been wrong before, as well as being wrong this time. If you stopped saying it, you could stop being wrong. It's a remarkably simple concept.",30,40,topic_stance_votes_1
40,"Religion a ""Psychological Disease"" Say Experts",existence of God,attack,"In an inappropriate venue.. to people who don't want to hear, and have expressed a strong opinion to him that he is harrassing them..
Or, lets just say this person is a Muslim, and the person who he is sharing his faith with non-stop is you?",34,41,topic_stance_votes_1
41,"Religion a ""Psychological Disease"" Say Experts",existence of God,support,"As much as I tend to agree with what the article suggests, I cannot find a website for any Royal College of Abnormal Psychology anywhere in England nor can I find in news stories, AP or otherwise, that mention Dawnette Vancurenko. IMO, this article is cleverly disguised satire.....",1,42,topic_stance_votes_1
42,"Religion a ""Psychological Disease"" Say Experts",existence of God,attack,"Yes, if someone is using their devotion to gay rights as an escape from reality. That too, could be an addiction.....but back to religion as a ""psychological Disaese"" or addiction....here are some talking points on the subject....
Some people can be so preoccupied with religion and its rites that, as with other addictions, they are unaware of events going on around them. They will hear no talk which threatens their addiction. 
As with work, religious addiction can be difficult to pinpoint because devotion to religion is worthy - so using it as a cover for compulsive behaviours is very effective. It is a classic case of the right words excusing the wrong actions. It is perhaps not insignificant that some family trees show a generation of religious addiction, the following generation of alcoholism, the following of religious addiction, the following of alcoholism and so on. 
Religion can be used as a cover for compulsive order, control and a feeling of power, for forced suppression of feelings, and as an excuse to govern the words and acts of others.  It can also allow the sufferer to feel safe, through justification, from the consequences of their own actions. As with all addictions, it allows the addict to avoid dealing with reality. The following indications of religious addiction I have compiled from a number of sources: 
Do you find that, when you are faced with problems or frustrations, you tend to pray or read/recite the Bible/Talmud/Koran instead of taking an objective look at the problem and building a constructive response to it? 
Have you changed your value system when you felt it your religious duty to do so? Have you put religion before your feelings and/or your children's feelings? 
Are you unable to doubt or question religious information and/or authority? 
Do you see things as black or white, good or bad? 
Do you think that God/Allah will fix you/do it all without serious work on your part? 
Do you have a rigid adherence to rules, codes, ethics or guidelines? Do you often use the words ""should"" or ""must""? 
Do you readily pass judgment? Are you ready to find fault or evil? 
Do you believe that sex is dirty and/or that physical pleasures are evil? 
Do you compulsively overeat or excessively fast? 
Do you put religion before science, medicine and/or education? 
Have you alienated any family member, friend or colleague with your religious stance? 
Have you cut back on social, family, work or other activities for your religion? 
Do you suffer from back pains, sleeplessness, headaches, hypertension? 
Do you manipulate scriptures or texts to justify your actions, feel specially chosen, or claim to receive messages from God/Allah? 
Do you get into ""high"" trance-like states? 
If you answer ""yes"" to only a few of these, you need to look at how you are using religion to suppress your feelings and to avoid dealing with reality. 
http://www.arfanswers.org/answers2.html
The few research studies aforementioned seem to suggest that religious people develop a dependency on religious practices for social approval. Since religious people seem to be describable in terms of relatively high levels of dependence, it seems useful to borrow a concept suggested by Peele and Brodsky (1975)- that of ""addiction."" According to these writers addiction is ""a person's attachment to a sensation, an object, or another person... such as to lessen his appreciation of and ability to deal with other things in his environment, or in himself, so that he has become increasingly dependent on that experience as his only source of gratification"" (p. 168).
There are a variety of definitions for the concept of religious addiction. Arterburn and Felton (1992) state that ""when a person is excessively devoted to something or surrenders compulsively and habitually to something, that pathological and physiological dependency on a substance, relationship, or behavior results in addiction"" (p. 104). They indicate that, ""like any other addiction, the practice of religion becomes central to every other aspect of life...all relationships evolve from the religion, and the dependency on the religious practice and its members removes the need for a dependency on God...the religion and those who practice it then become the central power for the addict who no longer is in touch with God"" (p. 117).
http://www.a1articles.com/article_9105_51.html
Despite the growing research concerning religiouscults, research specifically concerning religiousaddiction among members of traditional ChristianChurches is lacking. Clark (1983) reports that, ""weare reticent, as a culture, to criticize anythingcalled religion"" (p. 279). The aim of this literaturereview was to: 1) help mental health professionalsimprove diagnostic assessments when religious addictionand other psychoreligious problems are involved; 2)reduce iatrogenic harm from the misdiagnosis ofreligious addiction and psychoreligious problems; 3)improve the treatment of such problems by stimulatingclinical research; and 4) encourage clinical trainingcenters to address the religious and spiritualdimensions of human existence
http://www.bookpump.com/dps/pdf-b/1122101b.pdf",36,43,topic_stance_votes_1
43,"Religion a ""Psychological Disease"" Say Experts",existence of God,support,"Dang, a lot of that sounds like the right wing of the republican party.
And a lot of the 'right wing' talk radio hosts.",43,44,topic_stance_votes_1
44,"Religion a ""Psychological Disease"" Say Experts",existence of God,attack,"I think this is interesting......because I've realized the difference in two key points in religion....
There is Zeal....which in today's terms means you strap a bomb on your back and XXXX yourself up for a just cause......or you line people up and put your palm on their head screaming at the top of your lungs that Jesus deliver him/her, and 'push' them over......these are zealous XXXXXX that have let passion rule reason....
Then there is Love.....an undeniable emotion and component to a healthy life......to love and have love is almost in every aspect correlated to happiness.....of course love is sometimes misinterpreted as sex, lust, or infatuation.....but love it self is the ultimate concept of what Jesus preached and what God has tried to show.....ex: John 3:16.....the ultimate love from both God and His Son.....
To say the least religion is evil because it has only spawned hate, rivalries(so to speak) and wars.........people have focused so much on tradition, rituals, and what not that they have lost the focus and principle of what Jesus had originally tried to convey.....love.....
So wow...I""m a hippie.....hahaha",44,45,topic_stance_votes_2
45,"Religion a ""Psychological Disease"" Say Experts",existence of God,support,"<flush>
I think you have a screwball outlook on things, Clive.",45,46,topic_stance_votes_2
