,title,topic,stance,comment,parent_id,comment_id,viewpoint
46,"Religion a ""Psychological Disease"" Say Experts",existence of God,support,"Hey EZ, I think Clive's definition of a Christian is one who has no backbone and claims to be a believer (anyone we know?)",46,47,topic_stance_votes_2
47,"Religion a ""Psychological Disease"" Say Experts",existence of God,attack,"It seems to me that you and Ez spend most of your time on this board judging others and whether or not they are Christian enough for your liking that your are far from real christians yourself......
I do not feel a real christian following the teachings of christ, would judge others ""backbone"" nor would real christians condone these bullying tactics. The only reason you made this comment bassman is to feel buddy buddy with Ez and to make fun of someone else....yes, that is sooo christian. Or more hypocrite.",47,48,topic_stance_votes_1
48,"Religion a ""Psychological Disease"" Say Experts",existence of God,attack,"The difference here is real Christians are born-again, believe the Bible, live the life, and yes, are not linguini-spined modernists who attempt to reshape the Word of God to their personal policy preferences, or disregard the Bible altogether.",48,49,topic_stance_votes_2
49,"Religion a ""Psychological Disease"" Say Experts",existence of God,attack,"Do I see a no true Scotsman fallacy ?
Basically a true Christain is someone who agrees with you I guess.",49,50,topic_stance_votes_1
50,"Religion a ""Psychological Disease"" Say Experts",existence of God,attack,"Not in all cases, not sure whether you have heard of Horizon (science program over here, might have another name there) or temperal lobe epilepsy but they did a program about it that was quite interesting. When you have a fit people tend to see a bright light and then have a religious vision. They found people suffering from this disease on further investigation also physiological reacted to religious words the same way as most people react to sexual ones (with regards to pupils, heart rate etc). It was assumed that this part of the brain deals with abstract things and predicition - i.e religion could have evolved out of the part of the brain used for imagining tigers could be hiding somewhere being exposed to unusual things (radiation or hallucinogens and suchlike).
Knowing which section of the brain is then triggered when they have their fits, a team of engineers built a 'God-helmet' which stimulated the part of the brain with EM radiation (think it was radio waves). Whilst it didn't trigger religious visions (they didn't try it with sufferers of temporal lobe epilepsy) in normal people it gave them the impression of a invisable presense in the room with them, something that even Richard Dawkins could feel when he tried it on.
Got crazier later on when they used the technology to 'exorcise' a demon from a girl who kept having horrific nightmares of being raped by the devil - it turned out in the end her radio clock was emitting the same frequences as the helmet did.
It could still be argued that this has no bearing on whether or not God exists or whether we are just on the edge of discovering how he communicates with people - whatever your views, its really worth having a look into.",25,51,topic_stance_votes_1
51,"Religion a ""Psychological Disease"" Say Experts",existence of God,attack,"Yada-yada yada,
So you are going to admit that your post about the backbone was wrong and unchristian? Figures!",49,52,topic_stance_votes_1
52,"Religion a ""Psychological Disease"" Say Experts",existence of God,attack,"Consider now, some memorable quotes from EZ...
",46,53,topic_stance_votes_1
53,"Religion a ""Psychological Disease"" Say Experts",existence of God,support,"Oh please...ez,
come out of sodom...come out of gomorah......how about come out of the dark ages and welcome to 2005.
Gay people are nothing like you potray them to be.....",53,54,topic_stance_votes_1
54,"Religion a ""Psychological Disease"" Say Experts",existence of God,attack,"I think your ""psychological religious disease"" is just another politically correct concoction from the radical liberals to try to put away in a rubber room anyone who might put forth the Word of God. So you heathens won't have your fragile consciences tweaked. Very subtle, but easy for the wise to see through your demented schemes.",54,55,topic_stance_votes_2
55,"Religion a ""Psychological Disease"" Say Experts",existence of God,attack,"Why does science scare you EZ? Is it that bad for people to find things out for themselves rather than being told what to do my a bronze age goatherder?
You claim the science is on your side in backing up your claims that the Bible is the word of God and yet anything else is clearly wrong. Surely if part of part of science can be wrong why can't the others also be?",55,56,topic_stance_votes_1
56,"Religion a ""Psychological Disease"" Say Experts",existence of God,attack,"Science doesn't scare me a bit, Fish. I've even got a degree in it. How about you? 
If you knew anything about science you'd know it can neither prove nor disprove the supernatural.",56,57,topic_stance_votes_2
57,"Religion a ""Psychological Disease"" Say Experts",existence of God,attack,"Sadly not, mines just Molecular Genetics in Biotechnology, never saw the just plain 'Science' option.
We aren't talking about the supernatural, we are talking about the proofs that get trotted out to show that the Bible is not just a bunch of stories written by people a long time ago - copy fidelity and suchlike.",57,58,topic_stance_votes_1
58,"Religion a ""Psychological Disease"" Say Experts",existence of God,attack,"Think evidence, vs. proof. That's how ancient history usually works.",58,59,topic_stance_votes_2
59,"Religion a ""Psychological Disease"" Say Experts",existence of God,attack,"well, lets see, 99.9999999999999999999 percent probablity, and it isn't good enough for you.",59,60,topic_stance_votes_1
60,"Religion a ""Psychological Disease"" Say Experts",existence of God,attack,"Its just you don't seem to be very even handed when judging evidence - on one hand you happily accept anything that agrees with the Bible, even if there is a lot of dubiousity around it whilst if something disagrees with an aspect of your beliefs you just tend to disregard it automatically. 
The OP here isn't saying religion is bad, nor is the study, its just it can be like OCD and small actions but for behaviours linked to religion. In this case its not religion which has caused the problems but the patients inability to apply them appropiately.",59,61,topic_stance_votes_1
61,"Religion a ""Psychological Disease"" Say Experts",existence of God,attack,"More Treborian folly, I'm sure of it.",60,62,topic_stance_votes_2
62,"Religion a ""Psychological Disease"" Say Experts",existence of God,attack,"Now you're getting stupid there, Treb",60,63,topic_stance_votes_2
63,"Religion a ""Psychological Disease"" Say Experts",existence of God,attack,"YOu are right. When it comes to the ancient stories.. it is not a matter of evidence showing that it is true... it is falsifing it. 
Since genesis is, as history is falsitiable, it has been falsified. The world was not created in 6 days.. Eve was not created from Adams rib. . and plants were not created before sun.
That makes the probablity of that story being literal absolutely 0.",63,64,topic_stance_votes_1
64,"Religion a ""Psychological Disease"" Say Experts",existence of God,attack,"Trebor, I've noticed that you tend to use your head too much, and your heart not enough. When you try to over-analyze and justify a doctrinal stance that is contrary to the literal translation of the Pentateuch, then you're headed for a world of trouble. BTW, you have a PM coming.",64,65,topic_stance_votes_2
65,"Religion a ""Psychological Disease"" Say Experts",existence of God,attack,"Of course Trebor is just fulminating again, with no evidence of any kind to back up his allegations. Typical.",64,66,topic_stance_votes_2
66,"Religion a ""Psychological Disease"" Say Experts",existence of God,support,"The problems that unbelievers have is they tend to use their heads too much. There's nothing wrong with objective thought. But when you over-analyze and incorperate biases into it, then there is problems.",66,67,topic_stance_votes_2
67,"Religion a ""Psychological Disease"" Say Experts",existence of God,attack,"Yes, I do use my head. But , myhead and my heart are in sync. I don't see abandoning reason for the sake of wishful thinking.",65,68,topic_stance_votes_1
68,"Religion a ""Psychological Disease"" Say Experts",existence of God,attack,"But there's a point (no, not in your head) where one can think and over-analyze too much. Matthew 18:3-4 ""I tell you the truth, unless you change and become like little children, you will never enter the Kingdom of Heaven. Therefore, whoever humbles himself like this child is the greatest in heaven."" The problem here is that you are so proud of your Jewishness that you're blind to the truth. And it's this very pride that God despises.",68,69,topic_stance_votes_2
69,"Religion a ""Psychological Disease"" Say Experts",existence of God,attack,"You have a degree in 'science'? Could you please elaborate on this a bit? I ask only because I'm puzzled as to the curricula involved in getting a degree in 'science'. This is in addition to your 'advanced degree' in theology? 
If I recall correctly, you once mentioned that you took a course in 'Christian psychology' wherein you witnessed an exorcism. Was that part of your science education? Is this where you also learned about demons, demonic possession, and Satanic influences?
Perhaps you could see fit to present us with your CV (curriculum vitae)?",57,70,topic_stance_votes_1
70,"Religion a ""Psychological Disease"" Say Experts",existence of God,support,Bassman and Easyrider make a pretty good case in support of the topic article.,70,71,topic_stance_votes_1
71,"Religion a ""Psychological Disease"" Say Experts",existence of God,attack,You are entitled to your opinion.,46,72,topic_stance_votes_1
72,"Religion a ""Psychological Disease"" Say Experts",existence of God,attack,"What? Assuming this statement could be interpreted as meaning something, it would certainly be news to any professional Ancient Historian. Or are you claiming to have a degree in Ancient History too?",59,73,topic_stance_votes_1
73,"Religion a ""Psychological Disease"" Say Experts",existence of God,attack,"As long as it doesn't get so objective as to conclude that much of the Pentateuch is, if interpreted literally, inaccurate or contradictory. Then objective thought becomes bad. Is that it?
Now, how much analysis is over-analysis? Presumably the long and tortuous 'analyses' by which evangelical writers try to resolve biblical contradictions are just hunky-dory; whereas trebor's very basic observation that plants could not exist before there was sunlight, or the observation that the creation accounts in Genesis 1 and 2 are in direct contradiction, counts as 'over-analysis'. Am I close?
Do you wonder that biblical literalists are so often regarded as anti-intellectual?",67,74,topic_stance_votes_1
74,"Religion a ""Psychological Disease"" Say Experts",existence of God,support,They make a case for fundamentalism being a psychological disease anyway...,71,75,topic_stance_votes_1
75,"Religion a ""Psychological Disease"" Say Experts",existence of God,attack,So in essence you are saying that no one gets addicted to religion? If that is your claim it is seriously misguided considering there is proof and evidence that people do become addicted to religion. The fact that you would deny the existence of such a disorder leads me to believe you may have the disorder.,55,76,topic_stance_votes_1
76,"Religion a ""Psychological Disease"" Say Experts",existence of God,support,"Careful Jo, Bassman may accuse you of thinking to much.",75,77,topic_stance_votes_1
77,"Religion a ""Psychological Disease"" Say Experts",existence of God,support,I would be happy if he did. I like that quality about me...I don't think you can ever think too much. Especially when it comes to your soul.,77,78,topic_stance_votes_1
78,"Religion a ""Psychological Disease"" Say Experts",existence of God,support,"I’m sorry joebrummer, I was speaking to Jo Bennett’s comment.
I guess I wasn’t thinking to much when I posted it.
As far as joebrummer is concerned I think even though you think to much already I think you should go right ahead and continue to think to much as much as you want until you think it’s to much thinking.",78,79,topic_stance_votes_1
79,"Religion a ""Psychological Disease"" Say Experts",existence of God,support,"Nooo, I think we should conduct a pole, as cell death would call it, to determine whether or not joe brummer thinks too much. We can't leave it for just monster to decide.",79,80,topic_stance_votes_1
80,"Religion a ""Psychological Disease"" Say Experts",existence of God,support,"I agree completely.
Deciding who thinks to much is way more responsibility than I should ever have. :-)",80,81,topic_stance_votes_1
81,"Religion a ""Psychological Disease"" Say Experts",existence of God,attack,"You people are missing the point (no, not in your heads). I'm saying that the heart (soul) is just as important as the mind.",81,82,topic_stance_votes_2
82,"Religion a ""Psychological Disease"" Say Experts",existence of God,attack,I know. Why do you think I completely disregard the anti-gay rhetoric from you and EZ?,82,83,topic_stance_votes_1
83,"Religion a ""Psychological Disease"" Say Experts",existence of God,attack,"Your absolutely correct. I followed my heart and found love...with another guy....my head said it wasn't the right time in my life, but I followed my heart and well....the rest is a fairytale....no pun intended...",82,84,topic_stance_votes_1
84,"Religion a ""Psychological Disease"" Say Experts",existence of God,attack,"This is probably true, but it's more a sad reflection on today's society than the religion. IMO anyway.",4,85,topic_stance_votes_2
85,"Religion a ""Psychological Disease"" Say Experts",existence of God,attack,"Sure, sorta like the addiction some have to political ideologies like gay pride. emoticonXAngel
It's not the fact it's religion that makes it addictive; it's the fact that it's an ideology and people sometimes get really wrapped up in ideology to the point of being pathological.",76,86,topic_stance_votes_2
86,"Religion a ""Psychological Disease"" Say Experts",existence of God,attack,"It's a fine line though, between judging Karamoz (spl) and accepting everything a crazy person assumes to be true.
I think its far safer to assume that people might have been crazy in the past than to assume that everything a homeless heroine adict says is absolute truth. Sadly you really only have the two reasonable choices unless you want to risk killing/medicating Jesus a second time",85,87,topic_stance_votes_1
