,title,topic,stance,comment,parent_id,comment_id,viewpoint
23,Why do you want to take my guns?,gun control,support,"I agree. Most people I know that carry a concealed weapon are doing so mostly for the protection of their family and not for themselves, although protecting oneself is certainly noble enough as well.
I would further add that carrying a concealed weapon does not indicate fear on the part of the carrier, but rather precaution. Concealed carry permits require safety training and that the carrier demonstrate he is competent to carry the weapon both physically and mentally. Carrying a weapon is one of those things where one hopes he will never need it, but if the need arises, it could be life-saving to have it.",23,24,topic_stance_votes_2
24,Why do you want to take my guns?,gun control,attack,"So be it. I just wouldn't make a good killer. I couldn't look at myself in the mirror. You decide if that makes me morally superior.
Oh Boy. A little old-fashioned? What century did you just step out of. You and I wouldn't make it through our first meal together. I'm married 31 years - just as background info. Chance in .... I'd ever give the time of day to any man who uttered the words ""I may be a little old fashioned, but I believe that, as the man of the house, "". Them's fightin' words. Wouldn't matter what followed that phrase. If you'd use that phrase in reference to protecting me, you'd use again to control me. That's the kind of phrase that should signal a wise girl to RUN not walk. I resent the implication that I, as a poor little meek female, should hide behind some big strong man. No second date for you buddy. But then, you wouldn't want one. I don't stroke male egos.
By the way, I said I can't go to an ATM after dark, but that was for dramatics. I do it if I need to. There's a difference between being fearful and street wise.
This may be fun after all. I'm hot under the collar now. Go ahead. Let's see if you can find another comment to turn me to a lesser person because of my sex. Ever hear the phrase, ""With one of these, I can get all of those I want.""",23,25,topic_stance_votes_1
25,Why do you want to take my guns?,gun control,attack,"i feel the same way, and my wife also feels to is her duty to protect me and the kids, there is nothing wrong with the desire to protect your loved ones.
in m yhouse, i would be the one out in frount in case of a conflice, but that is dur to me being the only one in the house that has through MOUNT training.
WTF?!?
would it be OK for me to ask my wife to stand behind a big strong, TRAINED man, and cover my back?",25,26,topic_stance_votes_2
26,Why do you want to take my guns?,gun control,attack,"So what's she protecting you from? Cholesterol?
I have no idea what MOUNT training is, but I'd rather have a man who doesn't get in to a conflict in the first place. Just what are we talking about here.
So you don't see what's offensive about ""I may be a little old fashioned, but I believe that, as the man of the house, "". This is the same phrase that's used to make any and all decisions, totally arbitrarily, based on the virtue of genitals. This easily turns into everything from what color the bathroom is, to when she's allowed a new dress. No no puppy. No pulling rank based on your .......
So now he must be trained? How about earning respect, mutual respect, based on something other than the ability to throw a punch. Actually, I am married to a big strong man. But that's not the fascination. He's not threatened by me. He doesn't need me to swoon. That's attractive.
We have different talents. 31 years and I have no idea if he makes a good body guard. Did I miss out on something?
How does that go? Don't walk in front of me. I may not follow. Don't walk behind me. I may not lead. Walk beside me.",26,27,topic_stance_votes_1
27,Why do you want to take my guns?,gun control,attack,"Everybody is a killer. I fyou don't think you are a killer, you just haven't been in a situation where you needed to kill. Self preservation is still strong in humans. I once saw a bhuddist mow down a half dozen guys wiht a machine pistol. I am sure that emclean, as a ranger who has seen combat, has seen similar things
Huh? Men are generally bigger, stronger, and more aggressive. If somebody is going to stand and fight, it is probably better that it be the man. Sorry, this is just the way it is. I know we are supposed to pretend that there are no real differences between women and men, unfortuantly, that is a load of BS and we all know it.
That said, I know who the boss is at my house, and it isn't me.
Not really. I go thte the ATM whenever I want, day or night. I know I can handle whatever happens.",25,28,topic_stance_votes_2
28,Why do you want to take my guns?,gun control,attack,"I'm not a fearful person either. I've been in several bad situations, one of which, had I not had a gun in, I would be dead right now.
I'm not going to belittle your position, but I do have to disagree on your remark that the best chance of survivability is to give them what they want. This IS defeatist attitude. It also cost 3000+ American's their lives. Never, EVER give a criminal what he wants during a crime. It enboldens them and puts other people at risk. Because of the standard airline policy to give terrorists what they want, bad guys used that BAD policy against us and killed thousands of our people. Bear in mind that the bad guys used box cutters to achieve this. 
I carry a gun, my wife carries a gun and when my children are old enough they too will carry a gun. I'm going to make sure that my family has every advantage against criminals of every kind possible. Does it make my family safe? More so than being unarmed and a willing sheep to the slaughter victim but it doesn't make them invulnerable. Nothing in the world can make you invulnerable.
Mike",21,29,topic_stance_votes_2
29,Why do you want to take my guns?,gun control,attack,"I don't know who to answer first. But I seem to be attracting macho men like flies.
What kind of mass hysteria have you guys fallen victim to? I don't live in the wild wild west. Here I sit in the big bad city never having been the victim of anything. Nor has anyone in my family. The worst thing that happened was 20 years ago when somebody robbed my inlaws house while they WEREN'T HOME. Evidently, they were only looking for cash, there wasn't any to be found so they literally took the piggy bank. Get a grip.
Several, huh? What is it about you that makes you a repetitive victim? Maybe you should rethink where you're hanging out - and possibly your behavior while you're there.
First, 9/11 had nothing to do with gun ownership. Second, why then, oh why, is every cashier and teller trained to give just 'em the money. Why is it that the only ones that make the news are the ones where the guy behind the counter pulled a gun. Frequently, it's his blood on the wall. Armed robbery, that's about the only thing that I seriously envision myself being the victim of. Armed robbers want the money, not me. They're not looking to commit murder unless forced. Nobody has a vendenta against me personally. I can promise you that noone is out there planning my demise. And may I point out, the only reason the armed robber is armed is because of guns. If he wasn't armed he'd pick my pocket, just like in Europe.
Oh goodie. Can't wait to have a fender bender with one of you and get shot as we argue over whose fault it is. Next thing you know, I'll be one more of those ""situations"".
You said it all. That attitude is just making your own trouble. Now you're trying to convince me that trouble is everywhere, it just unavoidable. No. It's not. Are you sure trouble is finding you? Chicken or egg?
It's that go get 'em attitude and irrational fear that I refuse to lower myself to.
By the way, told my husband last evening about our conversation. Told him somebody said ""as the man of the house"". His answer, ""Oh my God."" He thinks it's all pretty amusing. You had his ire up for about 10 seconds with the ""trained"" remark. Briefly considered replying himself, but he got over it. He just walked away laughing and saying how much he loves to sig me on the world.",29,30,topic_stance_votes_1
30,Why do you want to take my guns?,gun control,attack,"kickin50, i should appolige, i had thought that you were some one who I could try to understand the anti-gun point of view. 
it is training to fight in an urban envirement. i have not ever been in a violent conflict with my famley around, but i am prepared for what ever comes, just like i have not had am accdent that the falut was atruibuted to me, but i still carry inshurance.
no, but i am, that why the plan is for me to establish a defencive position in frount of my famly. this is like a fire escape plan, you should think about what you will do if something happens to you.
and no one in my famley has lost there homes in a fire, or died of an accedent at a young age, but i am inshured aganst both. i have a plan in case of fire, flood, storm damage to my home, utility loss. have you planed for any of these?
no i do not see it that way, it is a discripitive turm, i am the man of my house, the re is also the woman of hte house, and the kids. if you are looking for sexism, you will find it.
i was a airborne, i never went after the tab, no offence taken, i just do not want to clame an honor i did not earn.",30,31,topic_stance_votes_2
31,Why do you want to take my guns?,gun control,attack,"Well you may be right when you generalize that all armed robbers want is your money. You must remember, however, that all of them are prepared to offer you violence to achieve that goal, and that being unarmed and/or physically unresisting is certainly no guarantee that you will not be seriously injured or killed. I don’t know where you get the belief that robbers only kill when “forced” to do so (which you imply they are forced to do by the victim’s resistance). That view does not accord with the reality of armed robbery. I can give you many examples of unarmed and unresisting victims being killed or seriously wounded by a robber.
I do not believe that women are a weaker sex, but since we are talking about armed robbers let me say that my views are not shared by them. Rightly or wrongly, they perceive women as weaker and easier targets for robbery. If all else is equal, the man who wants money for another rock of crack and who sees both of us exit a store at night will choose you over me. He will do so because he thinks that you are less able or willing to resist him. He may also have another motive to choose you which would exclude me: he may wish to make you the victim of a sexual assault. 
Having said this, however, I live in the real world where I know that being a man is no shield against assault and or robbery. I see a lot of violent crime involving all manner of victims. I carry a gun because I know what’s out there in the real world, and I wish to be as prepared as possible to deal with it should I ever be targeted for victimization. Yet, if a man ever gets me into a situation where he has a gun pointed at me while demanding my wallet, I would be unlikely to try and outdraw his trigger pull. The fact that I carry a firearm does not mean that I will automatically use it if confronted by a robber. It merely means that I am better prepared to defend myself if the opportunity to do so presents itself. The law of self defense is the first law of nature, and I fail to see the logic in condemning those who lawfully and peacefully arm themselves with the ability to choose not to be a victim wherever possible. 
------------------------------------
""False is the idea of utility that sacrifices a thousand real advantages for one imaginary or trifling inconvenience; that would take fire from men because it burns, and water because one may drown in it; that has no remedy for evils, except destruction. The laws that forbid the carrying of arms are laws of such a nature. They disarm only those who are neither inclined nor determined to commit crimes. Can it be supposed that those who have the courage to violate the most sacred laws of humanity, the most important of the code, will respect the less important and arbitrary ones, which can be violated with ease and impunity, and which, if strictly obeyed, would put and end to personal liberty--so dear to men, so dear to the enlightened legislator--and subject innocent persons to all the vexations that the guilty alone ought to suffer? Such laws make things worse for the assaulted and better for the assailants; they serve rather to encourage than to prevent homicides, for an unarmed man may be attacked with greater confidence than an armed man. The ought to be designated as laws not preventative but fearful of crimes, produced by the tumultuous impression of a few isolated facts, and not by thoughtful consideration of the inconveniences and advantages of a universal decree.""--Thomas Jefferson, Commonplace Book, 1774-1776, quoting 18th century criminologist Cesare Beccaria in On Crimes and Punishment, 1764.",30,32,topic_stance_votes_2
32,Why do you want to take my guns?,gun control,attack,"You and I were having a perfectly civil conversation until some changed the subject from target shooting and hunting and what impact this has on society as a whole, to why I should be packing. Just when did it change from why do I want to take your guns to how come I don't have one? Me carrying a gun. That's just not going to happen.
And there is no way I can say it's a good thing to arm anybody and everybody on the street who steps up and says they'd like one. It's not only unnecessary, it's dangerous. There's way too many people walking our streets, carrying a gun, that aren't wrapped too tight. No amount of firearm training is going to turn an overly aggressive paranoid into a person with good judgment. They got that gun because they're an overly aggressive paranoid or just plain a trouble maker. It won't be a robber the vast majority of them pull that gun on. It will be a fight over a parking space. Crazies get legal guns too. And I don't mean the technically diagnosable kind. These aren't people who want to take their target pistol out and around with them. They never owned a gun at all until they could keep it in their glove box. They're the same loud mouth that got bounced out of the bar last Saturday. And every one of them makes our lives a little more dangerous.
More scare tactics. Life is odds. Just like Vegas. I could get run over by a bus, too. Bad things happen to good people. There's just no guarantee no matter what. 6 possibilities:
1. Without a gun - I won't be a victim.
2. Without a gun - I'll be a victim. I'll survive.
3. Without a gun - I'll be a victim. I won't survive.
4. With a gun - I won't be a victim.
5. With a gun - I'll be a victim. I'll survive.
6. With a gun - I'll be a victim. I won't survive.
You're focusing in strictly on 2 of the 6 possibilities -- #3 and #5. Chances are 4 out of 6 that I'm right. So long as I don't have a gun at all, the odds are 2 out of 3. I like my odds way better.
As for rape, yep. Could happen. That's #2. Hope I don't get a disease. I wouldn't crawl in to a hole and pull it in after me. Life goes on. A woman's reaction to that is based totally on her personality. I can see how it would be tougher on a young girl - teen or inexperienced. But I for one, stopped taking that quite so seriously after a few trips to the delivery room. Mind if I look, they say? He.. no. Everybody else has. :) We're a teaching hospital you know. Yeah. I figured that out. We'll talk after you've been in the stirrups more times than you can count. Scooch down they say. Just a little more they say. About the time you have your knees in your ears, you begin to realize that you're just not that special. It's time to get over yourself. More than you wanted to know? :) :) :) 
Exactly. I think I said that a long time ago. So, I should have this thing handy at all times why? For a preemptive strike? I'd never do that anyway, (so much for #5) and it would make my purse way too heavy for no good reason. Also, I eliminate the #6 possibility where I didn't survive because I had the gun. Logic people. Logic. Play the odds. They're on your side if you leave the gun at home.
I already did. Read above. I wondered how long it would take for the rape warning. Ever since the topic changed to self protection, the tone has been all about me and why it's just not safe for me to walk out the door. This woman thing is just another strike against me. So how come I'm the one having the nice peaceful life. Not all the rest can say that.",31,33,topic_stance_votes_1
33,Why do you want to take my guns?,gun control,attack,"Taking responsibility for the protection of your family is hardly ""macho"". I love my wife and my children. I will take all reasonable steps to ensure their safety. I will keep fresh batteries in the smoke alarms. I will keep fire extinguishers around the house. I will make sure thet my wife is driving a safe and reliable car. I will keep a gun. They are all the same. They are just common sense measures.
That is good. Have you ever had a fire? Do you have smoke detectors? If you have never had a fire, smoke detectors are a waste of time, right (joking, of course, only an idiot wouldn't have smoke detectors). How often do you wreck you car? Do you still carry insurance? I haven't had an accident in 15 years. My insurance is up to date. I even carry full coverage. 
Your attitude is one of fear, not mine. I refuse to live in fear of the occasional socially maladjusted individual. This is MY TOWN and I will not have criminals dictate to me where I can go and when. Apparently they have actually scared you to the point that you plan your activities around them. 
so sad.
""Man of the house"" is just like ""woman of the house"". It is a lable which explains who I am (generally, ""Man of the house"" would be the oldest male). You are looking for something sexist that simply isn't there. Sorry. Like I said, I know who is in charge around here, and it isn't me. 
As far as the ""trained"" remark, the was Emclean, not me. He has a point, though. He was trained by the military to kill. In my book, that certianly makes him a better defender than his wife, who most likely has not had the same training. Of course, if she HAS had the same training, I would still prefer to have emclean between me and trouble, since he is almost certainly bigger, more agressive, and stronger than his wife. 
Please back this statement up with facts or statistics that support it. the DOJ has always said that people who have a concealed carry permit are far, far LESS likely to engage in criminal behaviour or initiate hosatile confrontations. 
If you actually have backing for this, you may have discovered a new argument fro the antis to use.",30,34,topic_stance_votes_2
34,Why do you want to take my guns?,gun control,support,"Will I be alive tomorrow?
There are 2 possibilities:
1. I will die.
2. I will live.
That means there's a 50% chance I will die, right?
How about this one:
What will the weather be like on the north poll tomorrow?
There are two possibilities:
1. 80° or warmer
2. below 80°
So, apparently there are pretty good odds that it will be warm enough to go to the north poll without a coat.
As you can see, assuming that all outcomes are equally possible is a mistake.",34,35,topic_stance_votes_2
35,Why do you want to take my guns?,gun control,attack,"[QUOTE=kickin50]I don't know who to answer first. But I seem to be attracting macho men like flies.
What kind of mass hysteria have you guys fallen victim to? I don't live in the wild wild west. Here I sit in the big bad city never having been the victim of anything. Nor has anyone in my family. The worst thing that happened was 20 years ago when somebody robbed my inlaws house while they WEREN'T HOME. Evidently, they were only looking for cash, there wasn't any to be found so they literally took the piggy bank. Get a grip.
Several, huh? What is it about you that makes you a repetitive victim? Maybe you should rethink where you're hanging out - and possibly your behavior while you're there.
First, 9/11 had nothing to do with gun ownership. Second, why then, oh why, is every cashier and teller trained to give just 'em the money. Why is it that the only ones that make the news are the ones where the guy behind the counter pulled a gun. Frequently, it's his blood on the wall. Armed robbery, that's about the only thing that I seriously envision myself being the victim of. Armed robbers want the money, not me. They're not looking to commit murder unless forced. Nobody has a vendenta against me personally. I can promise you that noone is out there planning my demise. And may I point out, the only reason the armed robber is armed is because of guns. If he wasn't armed he'd pick my pocket, just like in Europe.
Oh goodie. Can't wait to have a fender bender with one of you and get shot as we argue over whose fault it is. Next thing you know, I'll be one more of those ""situations"".
[QUOTE]
Macho men? Gee, let's stick to the topic and avoid the barbs please.
I'm glad you have only had a robbery when you weren't at home. You are very lucky. A friend of mine lost her parents when a man broke the law and brought a firearm into a restaurant and killed quite a few people. You may have heard of the incident, it was the Lubby's Diner in Killeen, Texas. My friend went on to become a state legislator. With her help, the state law was changed to prevent such a tragedy from occuring again.
I used to work in a place that was located in a very bad area. Since Virginia has enacted the right to carry laws, that place has changed dramatically. It is no longer the crime haven it once was. The reason I was put in these situations was due to my job duties. I'll leave it at that.
9/11 has a lot to do with gun control. Had anyone on those planes been armed with a handgun, 9/11 would not have happened. Yet, the zone of disarmament continues there and other places. Ever notice that violent crimes always happen were guns are forbidden? Like schools? Office buildings? planes? You never see a mass shooting at a gun show...
I disagree with the notion that tellers and counter workers should give over the money. It encourages robbery and crime overall. Twenty years ago, that tactic was okay, today, the criminal mind is more violent and they do it for kicks. It's a mental control thing for them. 
As for a fenderbender, again, let's stop with the inuendo and barbs and stick to the topic. Your comments are typical of those who cannot articulate a proper argument for their stance and must result to attempting to ridicule your opponent. I'll give you a bit of advice, it didn't work for Kerry or the rest of the Democrats and it doesn't work for you. 
Mike",30,36,topic_stance_votes_2
36,Why do you want to take my guns?,gun control,attack,"Besides common sense? But okay. Story on MSNBC 10 minutes ago. Florida. Guy walked in to a Radio Shack. Opened fire. Then killed himself. No clue why he did it. Had been involved in a road rage incident earlier that day. That would be an example of a nut with a gun. And no. He's not a criminal - not in the sense that we were talking about. He's not a robber. Just a crazy with a gun. Has personal problems and decided to go out in a blaze of glory. I like my odds fine with the criminals. These guys -- I don't like so well. You'd want me to with you were there, too. Sorry. The solution is if he didn't have a gun at all.
A guy with a carry permit isn't a criminal. I never said or implied he was. He's a vigilante. He doesn't initiate it. He just ends it. If there weren't so many guns, there wouldn't be anything to end. This is just a downward spiral. Your little DOJ fact is true - as far as it goes.",34,37,topic_stance_votes_1
37,Why do you want to take my guns?,gun control,attack,No the odds aren't 50/50. Just like the odds in my example aren't 33/33/33. My odds are way better. But you already knew that.,35,38,topic_stance_votes_1
38,Why do you want to take my guns?,gun control,attack,"that is what the appoligy is for, the disscution took a left turn some where.",38,39,topic_stance_votes_2
