,title,topic,stance,comment,parent_id,comment_id,viewpoint
0,Why do you want to take my guns?,gun control,support,"The issue revisited, 
Why are there people who want to take away my guns? I have an ""assault rifle"", an “assault shotgun”, and hand guns. All three of these types of guns are under attack and I would like to know why you think that they should be “off the streets” or banned?",0,1,topic_stance_votes_2
1,Why do you want to take my guns?,gun control,attack,"This is probably going to be a short thread. I just don't have a reason that you would consider ""good"". I doubt I can offer any new insight that you haven't heard before.
It's just that everything has consequences. I know that you're just having fun. But your fun has cost a price that's too high. We all have to pay the price if only in fear.
Crime goes on. I know that. Example: I was in Belgium. My husbands pocket got picked. They're good. They have a skill. Here in America, robbery is scarey. There, it's a travel story. Almost a fond memory. It was only about $20 and we laugh about it.
I suppose at this point there's no point arguing the subject. The damage is done. There are so many guns on the streets, that if the honest people turned theirs in the criminals would still have the rest.
I just don't honestly understand why we have to wrangle so about registration and waiting periods. Why do honest people have to have their newest toy TODAY. And why does it have to be a secret that they have it. I know what I'm afraid of. What are you afraid of?
A little common sense would go a long way. The words are there, in the constitution. I'm stuck with it. Although I don't honestly think they ever envisioned a car jacking with teflon bullets. They envisioned the citizenry rising up if those dang red coats ever came back.
I was kidding before. Sex will be outlawed before the guns are gone. So relax. Now there's a thought. Sex starved people with guns. That's something to really be afraid of. LOL
P.S. I have an arsenel, too. Mostly antiques from dead relatives that used to hunt. Wouldn't matter to me at all of they were all gone. It was years of trying to make sure the children didn't find them.",1,2,topic_stance_votes_1
2,Why do you want to take my guns?,gun control,support,"Ok. Now I'm laughing really hard. Truly.
I actually just read a post by a guy who thinks that we could use them to overthrow an oppressive government. Please don't. My city will look like Fallujah.",2,3,topic_stance_votes_1
3,Why do you want to take my guns?,gun control,attack,"there are few reasons i could think of outlawing guns as good, and there are likly as few that i could use to convence you we need less controles on guns. i am not trying to change your mind, i am trying to understand your position.
i worry that the same law makers who push for registration are the same ones who want to ban all guns. for an example ""If I could have gotten 51 votes in the Senate of the United States for an outright ban, picking up every one of them, Mr. and Mrs. America, turn them all in, I would have done it.""
-Senator Dianne Feinstein, D-Calif, discussing the 1994 ""crime bill"", one of the largest gun control bills of the last 30 years.
this was said in '94 on onr of the news shows (i will dig up a link if you would like.) Senator Feinstein had one of the few permits to carry conseled weapons in San Fransco. this is who i am afraid of, add to the lits Rosie O'Donald, guns are bad, and no prites person needs one, unless they are the guards for my famley.
there is a large diffrance between illegal guns, and legal guns. i would have no problem with wating periods for a gun if it served a porpose. to get a gun today from a dealer your name is processed through the FBI to see if you have a criminal record, in about 30 seconds.
you could just send them to me, i could add them to my dubble locked collection.",3,4,topic_stance_votes_2
4,Why do you want to take my guns?,gun control,support,"There's always been an amazing pattern of those who seek to take freedoms of others, fully expect to keep those exact same freedoms for themselves.
Why do some people want to take away your guns? Think about this - we have many areas with seat belt laws for cars, but no areas with smoke detector laws for homes. Why? - what's the difference? We have many areas with auto emissions testing, but no areas with chimney emissions testing for homes. Why? - what's the difference? The difference is that it's a lot more risky for any branch of government, local or federal, to inspect and control the homes of an armed citizenry, than it is to inspect and control people and their cars, when the carrying of guns in cars (in public in general) is largely outlawed. 
The outlawing of guns, and an increased presence of government in our homes, go hand in hand.",4,5,topic_stance_votes_2
5,Why do you want to take my guns?,gun control,support,"the number ok people killed and injured, on the tax payers dime.
you have to pay every year for the car, and have am easy to regulate the areas where indistry pollutes more.
and to think we got back a few gun rights, and we still have the patriot act.
i know all the reasons given for why ""THEY"" want to disarm us, what I am trying to understand is why one person wants to see them outlawed.",5,6,topic_stance_votes_2
6,Why do you want to take my guns?,gun control,support,"The reason why ownership of guns is so fundamental to our society lies in the origins of our country. The founding fathers wanted to make sure that if our government ever became tyranical (sp?), the average joe would have the means (guns) to resist and even overthrow that government.
The founders saw the government as a necissary(sp?) evil to be limited and controlled. They knew that people not only can, but SHOULD make most decisions for themselves. They then can live with the consequences of those decisions.
After the debacle (sp?) of the Articles of Confederation, it was realized that some sort of Federal government was needed to 1) negotiate international agreements and pay national debts and 2) operate a national armed service for times of war and 3) to collect taxes to fund those lilmited objectives.",6,7,topic_stance_votes_2
7,Why do you want to take my guns?,gun control,support,"also they were aganst there being a standing army, and they wanted the people to be able to defend there homes and countyr from any attack, or to defend the Constitution of the United States against all enemies, foreign and domestic.",7,8,topic_stance_votes_2
8,Why do you want to take my guns?,gun control,attack,"So what. Congress can pass any law it wants. Doesn't mean it will stand up in court.
The first portion, ""A well regulated Militia, being necessary to the security of a free State,"" is a qualifier to what follows ""the right of the people to keep and bear Arms, shall not be infringed."" It seems pretty clear to me. But I'm not one of the Justices. This decision has been made, although I don't like it or agree with it. I don't see where today's hobbyist meets the intent - most especially in the well-regulated part. But there comes a point where what the dead guys thought just doesn't matter that much. It is 200+ years later. They left us with the ability to adjust with time and we've done that. They recognized their own shortcomings which might have the the wisest thing they did. The current interpretation is clear. We look at the last portion of the statement only. I don't think that, as I said before, a little common sense, is going to alter the interpretation in any meaningful way.
After all, I could easily argue (if I was totally stupid) that my front yard is the perfect place for a working cannon. We both know that isn't going to fly. Just where does the armament argument end. With a cannon? Or with a Nuc. Let's face it. They said arms and they meant arms. Not guns. They'd probably let me have the cannon. The founding fathers never envisioned the kind of weapons we'd have available today or what they'd be used for. That's why their thoughts are purposely criptic and open ended. Since we will always draw the line someplace, why not draw it at a good compromise between you and me.",4,9,topic_stance_votes_1
9,Why do you want to take my guns?,gun control,attack,"you had asked what i was afrade of, and that is it. it might have been shot down by the courts, but with the speed of them the guns i had turned in would have been distroyed before it was decided.
if your frount yard was big enough (twice the max. range for example) what would be the harm?",9,10,topic_stance_votes_2
10,Why do you want to take my guns?,gun control,attack,"You asked where the line should be drawn in regards to weapons?
How about where ownership and use of weapons does not violate the rights of others. 
Before you respons think about it. Do anything you want. If I don't violate anyone then what is the beef? If I don't break any laws or endanger anyone what is the beef?
The safe storage and handling of cannon, cannon propellant, and cannon ammo is well known. They can be stored in places typical of homes without violating the rights of others. BTW a cannon is not a weapon. It is considered a 'firework' by the ATF. Ever see a civil war renactment? Lots of cannons? So yes having a cannon in your front yard does fly.",9,11,topic_stance_votes_2
11,Why do you want to take my guns?,gun control,attack,"Guys, I know you feel passionately about this. Truthfully, I just think that we'd all be better off if guns weren't everywhere. It's a hobby. That's all it is. But it's a hobby that has ramifications that ripple through our whole society.
I can't change it. I know that. And I just don't have the anti-gun fervor that you think I have.
If I could wish for one thing, and only one thing, it wouldn't be gun control. But then as my son says, Wish in one hand and **** in the other. See which fills up first.",11,12,topic_stance_votes_1
12,Why do you want to take my guns?,gun control,attack,"what would it be? i would eather wish for all people to be able to setal problems non-violently, or for my famley to never have to worry about money, bepending on mu mood at the time.",12,13,topic_stance_votes_2
13,Why do you want to take my guns?,gun control,attack,Free Guns for everyone! More Guns means more Murder. And More Murder means population control. That way we wont have to resort to the satanical process of abortion!,13,14,topic_stance_votes_1
14,Why do you want to take my guns?,gun control,attack,"I've had time to think about my answer. I predicted your response.
I suppose it would be for true religious freedom. It's making a mess all over the world as well as inside the US.
As I typed my answer, I decided I really need to expand it a bit to say tolerance. A little more live and let live.",13,15,topic_stance_votes_1
15,Why do you want to take my guns?,gun control,attack,"Yes, because congresses powers are actually pretty limited. It hink it will be interesting to see how the 2 upcoming supreme court cases (one has already been accepted, the other is pretty much a shoe in) regarding the commerce clause will be handled, since the majority of the laws that congress passes are tied to it. 
We look at the last portion of the statement because that is the actionable clause. The first portion is the justification clause, and the actionable clause is not dependant on the justification clause. This is the way it was taught back then, and it has not really changed. The accepted rules for the usage of the english language are pretty well documented.
Several states have similarly worded provisions in their state constitutions. the Rhode Island constitution contains this:
Reading it the way many of the anti gunners read the second ammendment would suggest that liberty of the press may only be enjoyed in situations where it is somehow related to the security of freedom in a state. This si simply not the case. Free speech is ensured in rhode island even if it has NOTHING at all to do with security or freedom in a state. You have the right, under the constitution of rhode island, to write and print recipes, novels, personal letters, poetry, or just about anything else youw ould like,regardless of their connection to the security of a free state. That is becasue the justification clause adds no controls to the actionable clause.
Many of the founding fathers had their own arsenals including heavy cannons and even artillery. These were the most destructive devices on the planet at the time. they certainly werte aware that even more devestating items would become available as time drew on. Keep in mind that most of the foudnign fatehrs were alive to see the transition from the musket (with an accurate range of rougly 30 ft) to the rifle (with an accurate range of over 200 yards). 
The ""that means you could own a nuclear weapon"" argument is nonsense brought about by anti gunners in order to provoke an emotional response. First off, there are no nuclear weapons available on the civilian market. If you do find one available, it is stolen. It is a crime to buy stolen goods. The second reason that the argument is rediculous is that nuclear weapons are offensive weapons. the founding fathers were VERY clear that the second ammendment recognised an individual right, and on that SHALL NOT BE INFRINGED. They also made very clear that the purpose of the ammendment ws to provide for the defense of the people, even if it was against their own government. Nuclear weapons, as offensive weapons, would certianly not be protected under the second ammendment.
The supreme court puts a great deal of weight on the original intention of the founders when interpeting the constitution. Here are some quotes from the founders to ponder:
They that can give up essential liberty to obtain a little temporary safety deserve neither liberty nor safety. 
---Benjamin Franklin, Historical Review of Pennsylvania, 1759. 
I think we would do well to heed Franklins words, not only in regards to the issue of gun control, but in all matters political right now.
To model our political system upon speculations of lasting tranquility, is to calculate on the weaker springs of the human character.
---Alexander Hamilton 
[The Constitution preserves] the advantage of being armed which Americans possess over the people of almost every other nation...(where) the governments are afraid to trust the people with arms.
---James Madison,The Federalist Papers, No. 46. 
Here is one that I think is a favorite among pro gunners. I have seen bumper stickers that say ""Fear the government that fears your gun"". I think there may be a certain amount of truth to this. What exactly do they plan to do that is so bad they are afraid you are going to shoot them for it?
Here are some quotes by constitutional commentators of the day:
Before a standing army can rule, the people must be disarmed; as they are in almost every kingdom in Europe. The supreme power in America cannot enforce unjust laws by the sword; because the whole body of the people are armed, and constitute a force superior to any band of regular troops that can be, on any pretence, raised in the United States. A military force, at the command of Congress, can execute no laws, but such as the people perceive to be just and constitutional; for they will possess the power, and jealousy will instantly inspire the inclination, to resist the execution of a law which appears to them unjust and oppressive. 
---Noah Webster, An Examination of the Leading Principles of the Federal Constitution (Philadelphia 1787). 
I think that he hit the nail on the head here. We see it argued that private citizens should not be allowed to be armed with military weapons. The founders disagreed, and Webster has explained quite well here why. In an age where every PD has a swat team armed with everything from handguns to grenade launchers, the intention of the founding fathers was that the citizenry be able to effectively resist the government if needed.
Many peopel scoff at the idea that this may ever be needed. Think back to RUby Ridge and Waco. Put aside the automatic respect and fear that we are supoposed to feel for law enforcement and look at what happend those two places. Government agents murdered innocent people who were unable to defend themselves effectively. These are people who were never sharged with cromes following the massacres at those 2 places. At Ruby ridge, federal marshals murdered a 14 yr old boy, and an FBI sharpshooter took down a mother who was holding a baby in her arms. At waco, people were shot from helicopters, tanks and flammable tear gas were used against women and children, and there is some pretty compelling evidence which shows that as the structure burned, those who tried to escape the blaze were shot down.
Granted, randy weaver would not have been able to beat the feds at their game regardless of how well aremed he was, but those people who were protesting on the road could have. The Branch Davidians could not have beat the ATF, but again, their neiborghs certainly could have if they had access to modern, powerful military weapons as our forefatehrs intended. It seems that the idea was that the American people didn;t have to just lie down and take it. We were meant to be able to fight back. 
Who are the militia? Are they not ourselves? Is it feared, then, that we shall turn our arms each man gainst his own bosom. Congress have no power to disarm the militia. Their swords, and every other terrible implement of the soldier, are the birthright of an American...[T]he unlimited power of the sword is not in the hands of either the federal or state governments, but, where I trust in God it will ever remain, in the hands of the people. 
---Tenche Coxe, The Pennsylvania Gazette, Feb. 20, 1788. 
The whole of that Bill [of Rights] is a declaration of the right of the people at large or considered as individuals...[I]t establishes some rights of the individual as unalienable and which consequently, no majority has a right to deprive them of. 
---Albert Gallatin to Alexander Addison, Oct 7, 1789, MS. in N.Y. Hist. Soc.-A.G. Papers, 2. 
(note that in saying ""some rights"", he is not alluding to only some fo the rights in the bill of rights, he is referring to the fact that people have many more rights than are recognised there, the ones in the bill of rights are being made unalienable)
I think that it is clear why the second ammendment was included in the constitution, and exactly what the founding fatehrs meant by it. Ther easons for its existance are no less pressing today than they were at its inception.",9,16,topic_stance_votes_2
16,Why do you want to take my guns?,gun control,attack,"Thank you for the very thorough explanation of the legal technicalities. Now I fully understand why I can't visit at an ATM after dark. And what's more, I understand that Benjamin Franklin wanted it that way.",16,17,topic_stance_votes_1
17,Why do you want to take my guns?,gun control,attack,"But how would banning guns make your trip to an ATM any safer? A criminal is by definition somebody who does not obey the law. All a firearms ban would accomplish is to ensure that the criminals would have guns and law abiding citizens would not. What is the point of that? That is exactly opposite of what we should be striving for. The idea is to get the guns away from criminals, not to get them away from law abiding citizens. Law abiding citizens obey the law, there can surely be no reason to prohibit them form having guns.
If you want to improve the survivability of a late night ATM visit, get your own gun and learn to use it. 
Oddly enough, I think Franklin would have prefered the danger associated with the visit than the banning of firearms. It was franklin who said:
They that can give up essential liberty to obtain a little temporary safety deserve neither liberty nor safety. 
---Benjamin Franklin, Historical Review of Pennsylvania, 1759. 
Granted that was a different time, a time when people were more independant. They understood that there was nobody standing by to babysit them, and that when confronted with a bad situation they would have to handle it, because nobody was going to do it for them. 
The founding fathers understood that there would be those who would abuse their right to bear arms. They were not stupid. That is what the courts are for.",17,18,topic_stance_votes_2
18,Why do you want to take my guns?,gun control,support,"wouldn't be more effective to go after the illegal guns, and those who posses them, rather than to give the ones who are trying to remain legal? i could get a gun for less is i did not worry about the law. a gun that is six or seavon hundred dollers in Indiana is three hundred in Chicago.",18,19,topic_stance_votes_2
19,Why do you want to take my guns?,gun control,attack,"Want to see an example of some illegally obtained guns from an outside source (smuggled) used in a crime? Check out the North Hollywood Shootout. Want to see private firearm stockpiles being used to stop crime? Look at the same shootout and all the AR-15s the police were suddenly using and at one point took down the last suspect with. Those were taken, on loan, from a local gun shop.",17,20,topic_stance_votes_2
20,Why do you want to take my guns?,gun control,attack,"I've been called a defeatest multiple times (on other threads) because I say that abortion can't be eliminated. (I'd much rather be debating that.) But this argument tops mine by a country mile.
First, I will NEVER carry a gun. I refuse to lower myself. I refuse to join the throng who say America is so far gone, the best way to proceed is to be prepared to kill at a moment's notice.
Second, if I did have one, should I ask this criminal to wait patiently while I take it from my purse. Or should I get a Quick Draw McGraw holster -- in multiple colors to coordinate with my outfits?
Third, the best chance of survivability is to give them what they want!!!!
Fourth, I'm not a fearful person. And I'm not the type to crumble if I were ever to be the victim of a crime. You see, my Dad was a feminist before it was fashionable.",18,21,topic_stance_votes_1
21,Why do you want to take my guns?,gun control,attack,"I personally don't view owning a device for protection as ""lowering yourself."" Even you expressed fear about going to an ATM at night.
There is a wide variety of concealed carry options. You may want to consider the ""Pager Pal"" or some other IWB (in the waist band) holster. I'm sure there are sme available in whatever color you desire. :) 
I disagree. I think hollowpoints would probably also be effective in stopping a threat. What if the assailant intends to do harm?",21,22,topic_stance_votes_2
22,Why do you want to take my guns?,gun control,attack,"So you are somehow in a morally superior position if you are laying dead on the ground than if you are standing with a smoking gun and your attacker is dead? 
I may be a little old fashioned, but I believe that, as the man of the house, part of my responsibility is to protect my wife and my children. I would be remiss in my duties if I did not seek out and ensure that I posess the absolute best tools available to me to that end. 
We certinaly live in strange times if taking responsibility for your own safety and that of your family is ""lowering yourself"". I would argue the exact opposite. I think it is sad that we live in a society where a large portion of our society is so insecure and so unwilling to take on any personal responsibility that they won't even take common sense steps to protect themselves. 
People like that are WHY crime is so high. Criminals know that those who are unwilling to take responsibility for themselves have pushed very hard to ensure that the rest of us cannot (apparently on the assumption that since they are too incompetent to handle a gun, so are the rest of us). Cops don't stop crimes and they don't prevent them. They show up afterwards, clean up the mess, and capture the bad guy almost 20% of the time! 
You should carry your weapon in a manner that makes it quickly and easily available. By your logic, police officers shouldn't carry guns because they can't get to them in time anyway.
What would make you think that this person, who is obviously lacking in moral fibre, deservs your trust? Is there really something that leads you to believe that somebody who is willing to rob you is not willing to kill you? 
I think you would have a great deal of trouble finding a self defense instructor who would not tell you that in a dangerous situation, it is far better to be proactive than reactive. Even the feminazis who come around once a year and try to teach the college girls around here that scratching people with your keys is somehow a good defense agree on this point. 
Not a fearful person? You are apparently afraid to go to an ATM at night. You are apparently afraid that if you did carry a gun you couldn't handle it effectively. You are apparently so unsure of your ability to defend yourself (which almost certianly is born of fear) that you prefer to give a criminal waht they want rather than stand up for yourself. And you say you are unafraid?
Wahy if what the crimainal wants is your children? Do you still give them what they want? What if they want to rape your wife? stand by and politely ask them to use a condom? 
We live in a society where people are killed for their tennis shoes. People are fairly routinely killed during the course of robberies that involve less than $20. Quit being afraid. Step up and take responsibility for your own safety. You will feel better.",21,23,topic_stance_votes_2
