,title,topic,stance,comment,parent_id,comment_id,viewpoint
55,Why do you want to take my guns?,gun control,attack,"[QUOTE=kickin50]All I can say is that I can envision a compromise where hunters can have their fun while society at large is relatively safe. Be aware the there are lots of people like me out there. And phrases like ""assault weapons"" push all the same buttons as ""partial birth abortion"". You guys have a real PR problem. Every time the NRA opens it's mouth, it gets worse.
The problem is the technical details of such a compromise. My wifes grandfatehr was all for the assault weapon ban, stating ""nobody needs something like that"" until I pointed out that he owns 3 of them.
The label ""assault weapon"" is something that was pushed off on us by the anti gunners. It is not something that people generally familiar with firearms EVER used in conneciton to any semi automatic only weapons until the Anits changed its meaning with the Assault weapon ban.
But the only people who HAVE bullets designed premierly to penetrate bulletproof vests are law enforcement. They are generally not available on the civilian market. This is another of those technical problems. A .17 will go through a bulletproof vest easily. That is a reound commonly used for furbearers. A jacketed .308, 30-06, or a 7MM magnum will also go through a bulletproof vest easily. Those are the most popular deer hunting rounds in the country. In my state (kansas) the only round legal to hunt deer with that would not penetrate a bullet proof vest is a .30-.30, and that is not a very popular deer round anymore (many people consider it underpowered).
First, your argument here makes no sense. It is not logical. you are still arguing that by regulating law abiding citizens, you are somehow going to effect criminals. This doesn't make sense. How is making the guy who has never had any mental problems, any kind of criminal tendancies, jump through a bunch of hoops, going to effect people who are not inclined to follow the law? This is just a logical fallacy. It is non linear reasoning. 
But you are incorrect when you say that your methods work. Crime has always been much higher in cities. Always, no exceptions. This would imply that the problem is not with us country bumpkins, or in the way we do things, but with you all city folk and the way YOU do things. Your methods have never worked well, ever. Cities have always been crime ridden, and the polices they enact in an attempt to alleviate the crime problem have always backfired. Elitest? I think not. You folks have social problems that the rest of us cannot even fathom, and frankly, to a lot of the country, it seems that you all are a bunch of XXXXXX. You pass up common sense answers to simple problems, instead preferring to complicate the hell out of everything and base policy decisions on a bunch of idealistic garbage.
I live in the country in a fairly rural community. Over 90% of the people in my county own guns. I know for a fact that everybody on my road has at least 2 guns in tehri house. We have MUCH lower crime that just about any city you might care to list. On my road, there has NEVER been a violent crime, despite the fact that we have more guns per capita (by SEVERL orders of magnitude) than most places in the US (this is largely due to my personal collection, which is extensive).
I am not sure where these peopel come from who are not able to look at a problem and come up with a solution, but instead view a problema nd come up with something that is not only NOT a solution, but does not even remotely touch on the problem. 
This is the problem with most gun control legislation. Most of it has absolutly NO crime control element built into it, despite the fact that crime control is almost always stated as the problem that they are tryign to address. Having stringent requirements for weapn permits has NOTHING to do with crime control. It is completely lacking in any type of crime control element. It is simply annoying those who are already inclined to follow the law.
An example of a GOOD gun control law, that being one that DOES posess a crime control element, can be found in many states (my own included). Here in Ks, if you are caught in the comission of a burglary, and you are armed with a firearm, you recieve an automatic 5 years in jail. This is a GOOD gun control law. It is enforcable, it targets criminals, not law abiding citizens and it addresses a problem. States and cities that have similar laws experience a significantly lower level of armed burglaries. Oddly enough, New york state and New york City do not have such laws. LA does not have such a law, nor does the styate of california. They have instead chosen idiot measures that have NO effect on criminals, but TARGET law abiding citizens. This is lunacy.",55,56,topic_stance_votes_2
56,Why do you want to take my guns?,gun control,support,"the problem is compounded by the media, all you hear are inflated clames desined to scare people into watching the news.
personaly i do not see a problem with something like this, but the problem is the politishins who say that redstration is just the first step, to be folled by banning the guns (Dian Finstine {i know it is spelled wrong} is an example of one)
who gets to decide if i need one? i drive through Gary In. every working day (#5 of the worst for crime), how can some one sitting back in my home town know weather or not it is a need? also the Indiana Constitution tells me i have a right to self defence.
reporting it stolen would not keep it out of the hands of criminals, they do not care about the SN, they scrach it off. 
and daewoo, we need to jump on her, she may be ignorant of the word games we see all the time,but i do not think she is stupid, she was just resed in a big city.",56,57,topic_stance_votes_2
57,Why do you want to take my guns?,gun control,support,"I know she's not stupid, but as you say, she is from the big city. I, too was originally from a big city. It wasn't until I had been out of there for several years that I realised that they are full of XXXXXX and I had been one of them. One day I just kind of woke up and realised that the folks we kind of looked down on as country bumpkins were applying comon sense a lot more liberally than us sophisticated city folk did. 
To be entirely honest, I used to make the same arguments that we see here. It sis just kindof what you are raised to believe or maybe it is more social prjudice that you pick up along the way. It took me quite a while to realise that it was a completley rediculous viewpoint.
I think a lot of this has to do with the differnce in the level of independance you see between country folk and city folk. If you have a problem uin the city, you call the cops, and eventualyl they show up. BUT, you see them all over the place (mostly writing tickets) and that makes you feel secure (despite the fact that nationwide conviction rates are abysmally low, and most cities test their cops to ensure that they are not very smart). In the country, you have aproblem, you call the cops, and then you deal with it as best you can for the 15 or 20 minutes it takes for them to get there. Same goes with an ambulance, or a fire truck. You get a flat in the city, you wander up to the nearest gas station or house and use the phone to call for help, or you use your sell phone. If you are out in the sticks, you chuck the cell phone in the back seat (odds are you don't get reception) and get the spare on before you freeze to death. 
If you have never lived in abig city, I would higly recommend you try it, but move away before you loose all your common sense. It really helps you understand the governemtn nanny mentality, because folks there are so dependant on the syatem and on having a bunch of service types running around doing things for them that they never really have to think.
In the coutry, even today, you do for yourself or you do without.",57,58,topic_stance_votes_2
58,Why do you want to take my guns?,gun control,attack,"Surprise. I actually did know that these descriptive names aren't all that useful - although I couldn't quote the .17 .308 30-06 etc. It doesn't alter your PR problem.
Of course it makes sense. In order to make them readily available to you, they're readily available to everybody. I don't know why they bother with background checks at all. They're just a sales tool used to convince people like me that the pro-gun community is attempting to compromise. They're obviously not doing any good. The problem with guns is that they're cheap. Relatively. You can quote the $1000 dollar model that you bought and love dearly - would never let out of your sight - but they're also available for much less. A murder weapon, a criminal tool, is so inexpensive that it can be considered a disposable item. No matter how much it cost or didn't cost, no matter what's the individual invested emotionally or didn't invest emotionally, it's still a gun. That's the link that ties. You're forever tied to that other kind of gun owner, whether you like it or not. Gun ownership is your commonality. Every step to protect your rights enables them.
First, it worked fairly well for many many decades. You're choosing to ignore the WHY it broke down. Because we're states not countries. We have no border security. Back in the day, before interstates and fast cars and lots of money to made in the gun industry, there just wasn't that much importing of guns between states - from states that weren't regulating them. The day came when we were swamped in them because they had been illegally transported across state lines. It didn't sneak up on us. We knew it was happening and we knew it when it was happening. There just was no way to stop it.
I'll glady address ""policy decisions on a bunch of idealistic garbage"" at the end.
This one you're ignoring the WHY we have crime. High population areas are what they are. It's never going to change. It's an environment where people who can't afford to live in your neighborhood reside. They simply don't have the assets to head out to the open sky and buy themselves a plot of land. But we'll glady build some low income housing in your town. Can you just imagine the town hall meeting that would bring. What's your logical solution to that? We seem to have missed it here. Everybody there has a gun so you'll teach 'em a lesson or kill 'em off? Problem solved. Do you have jobs there for them to pull themselves out of poverty? Barring those, what are you going to do with those hungry kids?
It's an environment where we bump elbows and it's possible to offend each other's space minute to minute. Arming ourselves certainly doesn't solve that. It makes it worse.
Speaking on non-linear. You're out in the country where there are no opportunities for the segment of the population that has the social problems. Frankly, they have no reason to even visit there. You knew that. That's why you went there. Then you argue that you don't have these problems BECAUSE of your guns. NO. Guns didn't solve it. It never existed.
What I just said. We have the problem. We have the solution. You don't have the problem but won't allow us to institute the solution.
Admittedly, you can't fathom it but you're pretty sure you have the solution.
We're not about crime control. We're about crime prevention. The jails are full.
It's not a gun control law at all. It's a punishment law.
As usual, no answer to the sporting aspects of guns. I'm trying to give the benefit of the doubt. You could at least pick up on it. I'm trying to find some reason for your thinking OTHER than dictating to us how to solve our problems and run our lives. You won't let me.
We're not falling victims to scare tactics. We fully understand when a statement is designed to inflame. Do you? This is just an argument that's ramping up using any possible lame argument. Including politishins who say that redstration is just the first step But gun crime is real. We're so totally caught up in the BS catch phrases that the real debate is lost.
Yep. Gary In. isn't a nice place. Agreed. Why is just driving through such a hazard? Is there something special about you that makes you different from the other hundreds or thousands of cars around you? Do you have to carry cash? Do you have to leave the beaten path? Are you driving a $100,000 car? Do you have to do this in the middle of the night? Are you visually offensive? :) Sorry. Couldn't resist that last one. Just trying to have a little fun.
You're jumping ahead to the world we do live in rather than the one we could create. It's not about what the police would do. That's up to them. It's would be about (1) him recognizing that he alone was authorized to posses that gun, (2) taking a vested interest in making sure that it wasn't stolen to begin with and (3) protecting himself from being held criminally liable for what was done with that gun after it left his possession. These are the elements of responsible gun ownership. Not the NRA (and I'm quoting from Bryan here) --- It seems certain we agree that responsible firearm ownership should be taught and encouraged to those who own firearms (believe it or not, this is what the NRA primarily does). --- ""Encouraged"" isn't the word we want to hear.
So much for wanting to understand my point of view. But I do appreciate the not stupid part. As for the big city, you couldn't drag me out of here kicking and screaming.",56,59,topic_stance_votes_1
59,Why do you want to take my guns?,gun control,attack,"in what way would any of that stop, or slow someone from breaking in and stealing the gun? 
would you perfer to hear demanded, to the point of having random inspections? also how would it affect illegal gun owners?
witch one would constute me needing to be able to carry? (i have a beard, that is offencive to some) :p 
i will answer to sporting uses as soon as i can get some imforation from you, first the ""bullets designed to go through bullet proof vests"" are you talking about the teflon coated bullets (used to reduce friction in the barral) or the cops having body armor that is not rated for the rounds being shot at them?
second the ""huge clips that can mow down trees"" how many rounds would be needed to mow down the tree? are we talking a small tree, that only needs 8-10, or a redwood that would need thousands? also whar calaber are we talking?
when you have Dian on natinal TV telling the US that if she could of gotten enough votes it would have been ""Mr. and Mrs America, turn them in"", and natinal orgnations whos goal is to ban all firearms, I guess it is still just BS catch phrases?
so banning something that can and has been made in caves, by kids, is the way to get rig of them?",59,60,topic_stance_votes_2
60,Why do you want to take my guns?,gun control,support,"Oops! Forgot the -- I'll glady address ""policy decisions on a bunch of idealistic garbage"" at the end -- part.
IF IF IF I were a member of the religious right pro-life at all cost group these would be the typical arguments.
1. We're fighting against the general coursening of our society.
2. The root problem is that our society is saturated with sex.
3. Just teach abstinence.
4. Abstinence isn't working because not enough people believe in it.
5. Abortion is the enabling factor. It caused the decline in moral standards.
--------------------------------------------
Just look at those arguments are see that I'm making the same arguments only in regard to gun control and crime rather than pregnancy. I can accept it if you were to just say that you think my arguments are idealistic garbage. But understand that what's good for the goose is good for the gander.
Your entire argument comes down to - it won't work.
Why is it that when a person from a blue state is idealistic, we're elitist. From a red state they're God fearing and Christian.
You'll have to excuse me if I say that at least my plan to control guns and crime is achievable and has the possibility of actually working - as opposed to attempting to control sex. If that's not idealistic, I don't know what is.
If my plan were to fail, we'd be no worse off than we are now. If their's fails, we'll have hundreds of thousands of unwanted children -- along with lower taxes and refusal to financially commit to the results of the failed experiment.
So, that's my answer in response to --- frankly, to a lot of the country (or in my case the city), it seems that you all are a bunch of XXXXXX. You pass up common sense answers to simple problems.",59,61,topic_stance_votes_1
61,Why do you want to take my guns?,gun control,attack,"It is absolutly a PR problem, but not one that is easy to solve. We have the antis preying on peoples ignorance here, and in order to straighten things out you have to convince people that it is important enough to bother learning baout such things.
But illegal guns are cheaper than legal ones. I bought my wife a little H&K .40 last year to carry. It is what our local KBI agent refers to as a ""grey market item"". It was smuggled in from mexico to be sold on the streets. I gave $400 for it, brand new in box, and had the local sheriffs department run a make on the number just to be sure it had never been stolen, etc... In a gun shop, that is a $1000 item. This is an entirely untraceable weapon (or at least was before I had the local sheriffs department check it out) and was less than half the price of the same item at a gun store, which is fairly tracable. 
No, it didn't. It NEVER WORKED. There has NEVER been a time in our nations history where cities had less crime than suburban or rural areas. This has been true in America since the 1800's. At one time people farily routinely carried firearms in NY city. It was decided that gun crime wa a problem, so they put restrictions on guns. Crime went UP in response as the criminals realised that they could now prey on their victims without any real fear of reprecussions. Instead of recognising that the plan was flawed, the fine libs running the place came to the conclusion that they just hadn't gone far enough. So they tightened restrictions more, and crime went up again. Still didn't get the point, that you cannot legislate the actions of criminals and having a completely defenseless society, full of citizens who are unable to effectively defend themselves from crime, is NOT the way to curb crime, they tightened them AGAIN and crime went up AGAIN.
Places with very tight gun control laws in the US have higer crime. That is all there is to it. It is indesputable. The argument that this is only the case because theya re being brought in across the border holds no water. You really think that by limiting guns to law abiding citizens you are going to effect criminals? Drugs are illegal. They bring them in from OTHeR COUNTRIES, and there seem to be plenty of them. You don't think the same would be true with guns if they made them illegal? Theya re already smuggling them and they aren't even illegal, and the smugglers find it so easy to do that they can sell cheaper than the gun shops. Unlike drugs that you can use a dog to find, guns have no distinctive odor. They ar just hunks of metal. Stick them in a crate labeled ""machine parts"" and mail them. I know a couple of guys in the home gunsmithing community who routinely do this with parts and part kits for guys in canada, and it is no big deal. You take a parts kit for an AK-47 or an uzi, break it into 2 seperate packages, and put ""lathe parts"" or ""mill parts"" on the customs paperwork and it si good to go. Customs watches small shipments like that a LOT closer than they watch containers or trucks. The guy I bought that pistol from for my wife had hundreds of them.
I live abotu 10 miles from the biggest low income housing development int eh state. Emporia kansas is the proud home of IBP (Iowa beef packers) it is the ONLY non union packing plant in the coutnry and it is almost entirely staffed by illegal aliens. Emporia is like a mecca to illegals coming over from mexico because they know they can get a high paying job here if they simply provide a randomly chosen social security number. If you follow I-35 south through texas and make your way to any of the mjor border crossings, on the mexican side, there is invariably a sign showing the distance to emporia, Ks. I have seen them. Unfortunatly, we end up with about 3 times as many illegals as IBP can provide jobs to at one time, so we end up in a situation where we have a whole bunch of fresh across the borde illegal aliens running aorund who can't find work and often as not have their entire family in tow.
Illegal aliens commit BY FAR more crime than any other group, especially the ones who are newly arrived. I have heard that this is because they are used to rural mexican law, which is close to non existant. I am told by those who harvest our pecan orchard (who are all mexican, but not illegals) that one of the warnings they get when they come here from the other mexicans that are laready here is that everybody has a gun. They know that if they tryt to break into somebodies house, there is a better than average chance they will be shot. If they try to carjack somebody, there is an excellent cahnce that they will end up with a bullet between the eyes.
There are not really many shootings around. You don't have to shoot anybody. The guy who is willing to steal from you when there is little or no risk to himslef is certainly not willing to do it when there is a good chance he will be killed. 
Can you prove that, becasue the numbers certainly disagree with you. You seem to be living in the fantasy world created by the antis where you get in a fender bender and people start blowing each other away, or youhave a dispute with the guy next door about blowing leaves in your yard and he takes you out with a bazooka. Sorry, just doesn't happen.
Bull. The coutry is full of poor white trash. As far as no reason for the criminal element to visit, bull again. Occasionally some mron will get the bright idea that farm houses are a good polace to burglarise. They are isolated, nobody is generlly home during the day, none of them have alarms, and if you screw up and do one where somebody is home, you can be long gone before the cops show up. They learn before long that we take an interest in our neiborghs. If I see a strange car at the house down the road when I don't think anybody should be there, I will go down and check on things to make sure everything is OK. If they pick the wrong house, one where people are home, they don't ahve plenty of time to get away before the police arrive. They catch a load of buckshot in the face and lay there dead until the coroner takes them away. Who ever heard of a farmer that didn't have a gun??
But your ""solution"" impacts me, and has nothign to do with the problem. Not only that , you folks have been trying your ""solution"" a little at a time for years, and every time you institute a little more of your ""solution"" the problem gets worse. This heavily suggests that your ""solution"" is not a ""solution"" to the problem at hand. If you are not going to deal with the problem, why should I have to suffer through your idiotic ""solutions""?
I don't have the solution. You folks have destroyed your cities to the point that a bulldozer and starting fresh may well be the solution. I do know, because we have data from the DOJ, that your solution certainly does not work. I know it never will because it never has, mostly because it is entirely illogical. 
No, it is gun control. It attaches penalties for the use of a firearm in a burglary. And IT WORKS. I can show with statistcs that IT WORKS. you, on the other hand, can only show that your gun control concepts are an utter failure everywhere they have been tried, not only here in the US, but in the rest of the world. In south Africa, posession of an illegal firearm can get you the death penalty, and they STILL have major problems with crime related gun use. 
The sporting aspect of guns are well known and I don't think in debate here. 
I really don't care how you solve your problems, as long as I don't have to pay for the solution or be inconvenienced by it. You guys created the problems, go ahead and solve them, but do it witouht penalising me or infringing on my rights, and for gods sake, this time around, try to actually solve the problem instead of simply making it worse like you have in the past.
It hardly seems that I am the one here trying to dictate to others how to live their lives. I want people to be as free as possible to live their lives as they see fit. I am not telling you ""go out and get a gun"" I am telling you to keep your nose out of other peoples business, and if THEY want to gou out and get a gun, let them do it. It won't hurt anything, and it may help in some small way.",59,62,topic_stance_votes_2
62,Why do you want to take my guns?,gun control,support,"you are trying a cure the symptom, the problem is the crushing poverty that makes teh people think there is no way out. gun controle, in any form, will not address the problem.",62,63,topic_stance_votes_2
